,Comment
3480,"1.5 years, become clear many even cathie wood, noted investor, underestimated rapid progress ai. could even evident little 12 months."
3484,would people want 1% get even rich? talking ending poverty ai help
3486,ai create better world humanity. prices go means everything becomes affordable
3487,probably good bottom billion access ai doctor nurse free next free via smartphone. education developing world.
3490,"increase difference money distribution 1% get rich number poor people increase jobless people, poor get even poor"
3492,saying poverty world poor jobless people?
3502,ideas worth sharing — gone good ol days
3503,used excited ted talks. great idea was. unfortunately entire thing gone strait toilet. crap! sometimes less more. quality quantity imperative.
3517,"thought great, need watch 1.5x though"
3518,also massive guess... one knows ai go.
3520,"​ fantasy. completely unoriginal obvious, boringly presented. everyone knows jack anything already knew everything said. trying convince legions dull-witted ceo's astoundingly limited imaginations."
3521,cucumber alone magnificent together tomato cheese… absolutely amazing.
3527,good thing?
3532,technology always upper hand performance surpasses human capability fear complete integration ai facets economy like energy finance would leave us reliant controlled ai instead way around.
3537,still waiting bitcoin $1m prediction
3539,​'s i'm still waiting lol. come back 2years
3541,talk exciting
3544,"tesla optimus 90% physical work us 60% physical work worldwide. imagine gpt-7, gemini, grok ai, anthropic 90% knowledge work. much companies would worth? tens trillions dollars. she’s talking investing ai companies."
3547,math. compute used train sota ai models increasing x 30 least annually. source: dario amodei others.
3549,​ creation artificial superintelligence would mean end energy scarcity.
3577,"got you, bro. nothing happy scraps given."
3581,get power victim king victims congratulations
3589,knows. say extra profit increased productivity enough pay it. guess good mine. crazy times entering
3591,"understood video that, there'll massive ai bubble followed blood bath massive crash next 1-2 years.."
3594,always important rebalance portfolio around second ai boom
3595,nice see non woke talk ted. quite unbelievable.
3602,can't wait comments get disabled
3604,"cant wait day dont think, work, question, exercise, create. bliss, every wish granted free, instantaneously. hunger, rape, waste, drought, war. life fully automated."
3606,power n control powerful
3607,use ai build wealth & get ahead 97% peoples [from 0].
3608,can’t wait wef take
3612,"​@marcoborghi9327 etf funds lost tins money covid bubble. never invested etfs, ark good data think long run she'll proven generally right."
3614,fund lost ton money last couple years made number predictions didnt come true. generally sounds like idea talking covering complicated diverse topics like ai biotechnology etc. understand people even listen nonsense anymore
3617,​ wish good luck investments together cathy wood
3619,never wrong before? know said past right ai going amazing humanity provide world hyper abundance everything dirt cheap free. assuming end humanity course :)
3621,"agree ai great probably useful future. personally, however, buy crazy predictions impression good grasp topics. learned mistakes seems. still want invest fund go ahead money"
3623,"came say this! best, disinformation, worst market breaking mistake. doubling questionable judgement standing jump bandwagon ai, predictably low-effort."
3625,"throws around bunch buzzwords, would wary investing this. research understand ai, blockchain, biotechnology etc still think makes sense go ahead invest"
3627,"care, feel free write fantasy novel. laws physics, nature, economics, psychology, etc malleable meet fantastical imagination."
3635,ai proven worthy accomplishing difficult tasks. there's form technology capable this.
3641,love cathie wood.
3643,khan helped finish math school youtube channel new. glad see they're going stronger ever advancing ai ways help students.
3646,"said :""we going give student planet every teacher ..."" khanmigo available africa, mean africa planet?"
3649,make ai college free
3653,"could embedded ai automatically tailor specific standards states associated common core? virginia standards learning, developed brand new set standards 2024. question stems see question stems common core."
3655,might email university
3657,"sal khan amazing! total free platform education, khan academy, savior studying! deservers many many prizes contribution!"
3658,"public schools oasis making friends learning teamwork solution: free, quality education model, based first principles human connection (no digital ai tutors!) linked initiative channel, anyone wants help us make neoducation reality"
3659,"that's awesome, love khanacademy's work"
3663,"data analyst , man thought much , covering statistics relation python machine learning . god bless khan !"
3664,every time see ai possibly evil like deapfakes things like maybe doomed
3666,never give ai free will; especially cause harm humans. specialized ai (sai)is way forward.
3667,hi khan. think people lingers site always take exam superlative mental ability?
3670,good ai replaces teachers eventually parents!! students work!! distraction!! written ai help!!
3675,sal global super-intendant
3677,pleas someone help ai
3679,another load ai hype bullshit : )
3680,"well, explain 100 ways. 1000s reasons ai good 1000s reasons ai bad."
3682,khan help much calculus 1. amazing teacher!
3686,lmao what's point learning maths coding ai better us get better point onwards
3691,plan khanmigo availible europe/eu/eec?
3692,"let's let geniuses build ai, let's focus creative using correctly, electronics, many study understand base waste time, others go directly use become millionaires."
3693,"can't believe great is! recently read similar book, absolutely incredible. ""game theory pursuit algorithmic fairness"" jack frostwell"
3695,"however, here's reality. students would sit another ai feed answers ai."
3707,"khan academy helped brush math prepare aptitude tests, useful tool. ai imagine much useful, $4 month incredibly affordable. exciting times!"
3708,awesome video. must recommended 100 times.
3709,exactly saying. glad khanacademy board!
3712,"fantastic, wonder many schools afford price tag. know school cannot. case haves always lot havenots left behind again. realize cost business. wish could afford it."
3716,man behind tiktok ai voice
3717,awesome!
3719,ai know keep students task?
3723,"voice soothing. even didn’t know looked like could feel connected teaching. regardless common belief, one man actually make difference. sal beauty wish good health"
3724,"adult learner, gives immense hope catch feel passionate pursuing career despite uncontrollable life setbacks. thank khan academy."
3727,sal amazing
3730,cool put face voice! guy helped overcome math anxiety. god bless gentleman!
3731,think therefore - hm? ai i?
3732,"really impressed take ai education. khanmigo genius application merging ai teaching educating. really liked give answers, instead leads students like teacher would."
3734,great man
3735,"cool story, missing substantial issue chatbots pose education... make education obsolete. scholarly knowledge become irrelevant"
3736,that’s ai that’s automated curriculum human human ai
3738,"pity, seems date ai teaching tool works united states. hope one day also available outside usa."
3740,wouldn’t bsc applied maths wasn’t khan academy. thank sal andteam!
3741,great project made great man
3742,i'm completely blown away this. amazing!!
3744,incredible!
3748,actually amazing
3751,available outside us ?
3754,great overall star trek.
3755,great well drop teachers' salaries.
3757,"sal naive active participants decision. privileged perspective multimillionaire harvard grad. everyday people live suffer rapid changes jobs economy. lots people left impoverished, run desires corporations 1%ers."
3761,"love you, khan"
3764,wow thank you!
3765,love love love this! learn explicitly khanmigo ai similar help students like understand unique ways!
3770,feel fortunate guy lives period history do. definitely spending way little time watching khan academy videos.
3772,thanks
3775,"here's thought you: ai teach people things exactly think stop business owners using ai things? right, silly socialists, much better able earn decent wage :) i'm sure capital owners totally care dont need anymore"
3776,"nothing stop businesses replacing people ai. may even universal basic income, think cheap everything labor longer cost business. least teachers teach kids hate country go along one world order nonsense."
3777,"interesting talk well respected educator. unfortunately, recent situation coleman hughes significantly damaged credibility ted talks. rather ""ideas matter"" seems ideas staff ted agree properly promoted. disappointing."
3780,admiration bestowed sal khan. khan academy profoundly amazing enhanced love mathematics.w(°°)w
3781,"used learn computer language web also data science,and admit best teacher ive ever had, think releate minds need"
3782,khanmigo (or similar ai personal assistant/tutor) replace classroom teachers? maybe replace online teachers?
3783,future ai things bright especially right hands.
3785,mashallah brother. keep making us proud!
3787,great ad…
3788,khan academy continues amazing job! keep us posted going available india.
3790,"really address ai education, big advertisement khan academy. get wrong great there's much ai outside khan academy's new ai bot."
3801,"well put sal!!! worked ai research stopped. convinced take up. myself, life planet!! kudos contributions."
3802,man done education absolutely incredible!. sal deserves nobel prize education..
3805,rosy tinted glasses? students may amenable improved learning methods. ai increase divide good bad learners ?
3806,costs money. students/schools cannot afford ai plug in. seems infomercial.
3807,"$4/mo, lol. know much schools, families, spending inferior products services? infomercial, really? love vision. 14 year hs math teacher btw."
3808,"yes, ai going make revolution education: time need adulation anymore teach stupid biological brain teach ai instead. next question - need biological brains existed general."
3809,"wow, balanced positive approach ai education… thank you."
3812,"realm intricate puzzles, individuals driven political agendas offering little substance find adorned nobel prize peace, profound contributions figures like sal khan remain unnoticed margins."
3813,basically long khan academy ai advertisement. wow.
3816,can’t thank enough sir app helpful us.. it’s blessing kids. god bless good health happiness.
3817,sal khan favourite person unarguably. human biggest impact human race. educated many free. best class education
3818,thank sir everything done continue education!
3819,"totally agree ideas, sal. make khanmigo available beyond us?"
3820,"sal helped turn life around kahn academy feel indebted felt like teacher allways needed, great guy"
3821,amazing
3822,"unfortunately, paid service khan. work title one school use khan free resource. would love use students school district would pay it."
3823,"great, stop ability ask answer ai."
3824,little disappointed.. speaker selling platform. ted losing good honest speakers.
3825,absolutely awesome mr khan. keep phenomenal work.
3826,high school teacher love this.
3834,"sal khan ............ words express gratitude towards khan academy. wonderful free platform learn. amazing work, god bless team."
3835,physical teachers gone kids get better education. teacher ai teach you?
3837,"ai write code, waste time teaching humans? unless intrinsic value coding"
3839,anyone jain uni? let's connect!
3844,thats great! u got insta? maybe talk there.
3845,anyone jain university? let's connect
3855,"ai make engineers obsolete. sense indeed level playing field (for non owner classes ofc, get richer) make masses fight low requirement jobs pay little possible i'd advise prepare"
3873,"fellow dinosaur, business model, done performed. thank service go away"
3874,us terrorist state - good acrors talking about?
3875,fence type robots ai answer would happen jobs robots ai u
3876,great presentation.
3877,"yeah sure. fails address “problem” ai education, third party ai. would student consult limited ai tutor third party ai gives answer/writes essay?"
3878,ai would destroy human knowledge ability think yourself.
3883,khan academy appallingly error riddled left errors available study from. (!!!) esp know corrections available... study time unlearn errors excessively chatty videos. ka offensive learning.
3884,testing ai autism robotics segragated classrooms children prefer bots versus abusive teachers requre pop adhd pills
3886,"impressive - every tool use - like harnessed ai made useful education (not every person/place that, good see positive examples)"
3887,ai makes work easy also became students less creative imaginative work opinion
3889,get voice interface ai assistant share smartboard student i'm starting think i'll job. i'm working hard part problem.
3890,thank everything sal! appreciate you. love alternative narrative framing offer think used areas beyond education well -- e.g. ai hopefully replace human musicians make music; help give humans access learn create better music : )
3893,great great fan khan academy!! amazing work. thanks much.
3894,student learn ai knows everything? humanity needs redefine purpose learning going school.
3895,wow exactly comment! +1
3896,salman bhai relieves stress
3899,"interesting video! asa prospective math teacher, found helpful hearing mr. khan's insights ai positive impacts education."
3900,"i’ve finished teacher action research study draws conclusion chatgpt grade student writing excellently. real teacher grades compared grades generated chatgpt rubric, mean difference = 0."
3901,ai learning humans think. program empathy relatability? here’s argument…ask ai humans develop ai cons well pros?
3907,inspiring. using new technology way explained really propel us new renaissance.
3908,im gonna cry love much
3911,"one best talks i've encountered, thanks hope action sal!"
3913,sal khan one inspiring people beautiful world
3915,amazing
3917,sound like andrew tate certain points
3918,literally see ai different slightly longer version students already already. teaching process weak.
3919,"ai never destroy anything, people will....politicans....billionaires...etc"
3920,"ted make intros worse every years? wrong first one? ai could save destroy species planet millions ways. key word ""could"" that's something anyone arrogance predict certainty. such, risk needs managed."
3921,always appreciate sal forward looking
3922,beautiful. give every student equal opportunities equal resources
3923,"finally, finally, super intelligent approach new super intelligent workhorse"
3924,"exactly use chat gpt for. interact ask questions like code working code work ,and everything comes nice clean explation amazing grow mush using ai tools"
3925,"me, really need ai tutor read graphs/something visuals text together regular mathematical equations"
3926,cool
3929,hoping ai would make education obsolete.
3931,"legend, always give new innovative ideas make learning easier appealing, great thanks significant contribution made next generations better learning. thank you!!"
3934,one best tech ted talks i've ever seen!
3935,artists\painters die)) need? ai faster
3936,"nothing short logical, grounded, forward thinking, awesomeness."
3938,"good use khan academy website learning youtube video wikipedia article reading online article/book . really need socratic approach khanmigo understand , use khanmigo?"
3939,11:52 august? access august 2022 ahh elites unfair access opportunity iterate rest us sigh
3942,nice see optimistic talk
3943,motivated this. thanks sal khan & ted uploading this!
3945,"great video, huge thanks"
3947,"1:45 everyone average standards ""average"" increases, means everyone becomes average again."
3948,love it.
3950,love this!
3951,"note sal khan: average students become excellent, excellent student become new average student."
3953,handle hallucinations ai?
3957,thank sal khan
3959,would say calculus khan acadmey helpful? im pre-med student struggling math wasnt best math high school
3962,"swear, hearing sal's voice explain anything makes feel immediately comfortable confident that, end video, learn it! :)"
3963,"also thank creating cool tools!! educator, sooooo cool"
3964,positive cool outlook future education personalized tutoring. inspiring. folks important!!! thanks sharing novel thoughts.
3967,"14:20 ""the best way predict future create it."""
3969,joined khan academy last week. think made great decision coz learn want learn flexible. i'm learning things care called passion khan academy. tysm
3970,incredbile love well done sal khan sam altman !
3974,"buying stock easy, buying right stock without time-tested strategy incredibly hard. hence suggest get financial-advisor provide entry exit points best stocks buy put watchlist."
3980,"thanks sharing,found internet."
3982,diamond age begins! (see neal stephenson’s incredible novel exactly model.
3983,thanks hardwork make education accessible many children.
3985,"i'm sure ai kinds things never thought of. especially dark web. great job openai! sam altman runs congress asks ""regulaiton"" dangerous software - dangerous, release begin with? could money? gaslight us more! eat up!"
3988,"available public free? since beta version released, i'm curious teachers know terms susceptibilities vulnerabilities."
3989,"amazing academic proposes, point youth going become emotionally educationally dependent ai. story tell self youth trust ai mentors/parents."
3990,amazing! subhanallah
3992,good incentive teaching humans math computing ai better?
3993,"likely ai kill jobs, human ingenuity creating dependent class low wages. ai possibly destroy humanity. benefit? pass"
3994,"great talk! great point around ai used enhance human intelligence, human potential human purpose."
4001,king khan best academy world
4002,educational super man!
4003,"amazing, average students become extraordinary help ai tutor."
4005,'ai may help enhance hi (human intelligence)' - sal khan
4006,"real question is: ""why hire student hire 10 ai teacher fraction price? learn all?"""
4009,agree! working tammy aito enhance whole youtube experience. old problems solved new ai solutions know change world!
4010,"doesn’t clue he’s preaching. ai tutor, ha. education means first foremost human interaction, undermined pandemic lockdowns."
4012,technology ai progresses....mankind not. think ends? first guess correct.
4013,"possible find prompts ai tutor manner? prompts, want find more!"
4015,ai great job explaining concepts different ways well! i've asked ai explain concepts using story poem song!
4016,ai definitely help young salman. remaining 99.99%?
4017,love ai way learn truly understand something ask every small detail edge cases fully form mind. gpt-3.5 helped work issues random questions need know may take week never answered posted stackoverflow.
4020,"imagine books reading comprehension?, wow!"
4021,love this. thank u.
4022,"think sal ai, saved education!"
4024,"thanks neuralink, people learn like matrix"
4025,"problem come people want coding, algebra etc. problems 'done' ai rather done us. coding algebra cumbersome. however might problem. currently limited subset population interest working algebra coding."
4028,ms physics. first video newton's third law plain wrong. made common error amateurs make n3l.
4029,"oh, college professors science virtually zero training good pedagogy."
4030,epic closing statement
4031,brilliant
4032,what's point ai we're going automate jobs
4033,wow educational optimistic
4035,didnt know much sal khan searched listening impressive talk. fascinated him. seems like amazing genius
4036,"14:14 makes important point - give fear. totalitarian governments criminal organizations pause, resulting bad actors better ai power confers good actors."
4037,greatest thing make mistakes infront entire class.
4038,"presentation truly invigorating. science fiction always passion mine, never thought would see things depicted favorite pieces sci-fi media. however, llm revolution reaffirmed optimism technology also life general. thrilled see take us."
4042,"species lost battle. cannot compete pc playing chess car trying run. ai. brain limited, slow lives short"
4046,wyatt role us humans it’s done ai
4050,fkn brilliant!!!
4056,someone please find way inject sal's essence ai... everyone world needs access him.
4057,respect sir. thank you.
4058,ai = amazing intelligence !!
4059,world blessed visionary like sal.
4061,owe entire life's education sal khan. would today without him. helped everything biochemistry calculus art history. brilliant.
4062,amazing khan academy ai education. ironic thing ai may make human intelligence obsolete. need learn agi?
4064,outstanding.
4065,love notion ai used educators enhance teaching. happen bean-counters don’t look ai’s capabilities start salivating idea slashing staffing budgets. see school districts happily replacing teachers minders help students interact productively robots.
4066,first ensure works. going teach? scientistic blind faith gee whiz tools.
4068,"problem ai tutors speaking computers lonely, matter sophisticated is. part good education teacher pupils with."
4070,"rollout artificial telepathy giving every well heeled student access without 'by leave' learned persons mind. part 'great reset'. arrogance wealth, hand hand, rule all."
4071,powerful talk i've watched v.long time! everyone watch think this. thank sal working transform education.
4072,students ai perfect; question would guide kids empathetic critical thinking. claims similar internet created. waiting hear quantum computing
4074,"hello, anecdote matters say writing ai improved writing!"
4075,wow!
4076,"sal, great staff. hope ai trend, contribution people like you, move right direction."
4077,friend told 14 yr old son using ai write school work. amazing.
4081,"dr ofenmu youtube channel deserve many rewards done lot good things wife, infection fighting long, herbs get cured"
4082,sword cuts directions. chat love rainbows. address dangers
4084,"thanks, sal, voice sanity amid blather hysteria."
4085,incredible
4087,"wow mr khan - selflessly working humankind world, ever since took degree ten years ago. supporter since then..!"
4093,"balanced approach pretty convincing! congratulations, sal!!"
4094,"wonderful tool, long fully replace human interaction."
4096,fantasies good done could become true (like many tech innovations past) didn’t get immediately high jacked profit motive. serve rich owners expense ordinary person
4097,"college student currently, ai powerful tool terms helping learn. actually get done, learn subject, longer need scour internet hours information."
4099,"sal khan wonderful, brilliant star human. team khan right here."
4102,wow awesome!
4111,"mr. sal khan, khan academy gift providence well. society always indebted you. thank"
4112,"thank sal, inspiration"
4113,"interesting. but, sure bias built ai built current educational system. cannot. look current state affairs regarding social injustice."
4114,"college grad parent 2 kids less 2 years old, brings hope future hodgepodge failed ai constructs kind dystopian battleground next ""best"" thing."
4115,"probably best perspective i've heard ai development potential far. slowing new tech never worked well. double good stuff engage global community openly instead. change education, change world."
4116,"planning one best parts teaching. problem marking, said ai save time planning felt sad (and tragic audience gave applause), planning creativity, give creativity computer?"
4117,"planning one best parts teaching. problem marking, said ai save time planning felt sad (and tragic audience gave applause), planning creativity, give creativity computer?"
4125,world ready ??? sal quote one close heart mind “if ai artificial intelligence used enhance hi human intelligence?? remain discovered. let’s dive it.
4127,"kids today lucky use technology actually learn. last year high school 2014 - almost 10 years ago, haha - relied youtube, khan academy, online answer sites. can't wait see future holds!"
4129,"great speech, sir! hat off!"
4133,amazing human being. positivity action bias solve world problems. true teacher. thank sal khan do.
4135,"i’m 2 years, government going ask $100 billion implement ai teaching tools public school classrooms, geared teaching students communist propaganda."
4137,really amazing informative video ai students..
4139,"millions millions people around world, included, lucky enough call sal teacher. feels like watching proudly close friend giving ted talk. remember counting jack nicholsons, laughing ""two hundredths"" - man treasure"
4142,chinese really dominating ai field spend time talking it.
4144,teach ai solve it?
4146,people brains.
4147,"amazing, future"
4148,afraid ai ridiculous thing i've ever heard. going improve lives ways can't even imagine.
4149,"khan merely pontificating hope ai potentially enhancing teaching & student learning. reality teachers replaced students collaborate ai, they'll willingly hand intellectual autonomy ai. khan financial stake ai best highly skeptical predictions & motivations."
4151,"started good sounded like buissnessplan went along, hmm"
4152,want get access khanmigo well currently available us :(
4154,sal amazing entrepreneur! awe achieved
