,Comment
1410,"yeah, problem people support musicians anymore actually buying music, yes think ai may fact replace real musicians."
1411,"clear ai didn'y ""compose"" anything. got greenwood in, stole greenwood, spat greenwood back out. ai, art. software steals artists way creators hope skirt current ip laws."
1412,hope not! ai sucks!
1413,idk sounds like would make pretty great mighty boosh episode
1418,lame brain comment gets 11k likes. thats people nowadays.
1420,nah ai going back years quite prone suicidal tendencies.
1430,um… ai easily that.
1432,ai _become_ real musician
1433,"jonny fantastic musician, sure. wishful thinking say he, us, eventually replaced ai."
1436,"yeah, ai could never make weird noises... settle"
1437,naive. a.i. replace everything.
1438,johnny ai that’s hasn’t aged 30 years
1440,wow doesnt prove anything
1441,people afraid beating guitars pathetic annoying.
1444,go sleep's solo...man genius
1447,one thankful end it.
1450,actually have. multiple times. thanks assumption.
1451,nobody suffers seizures thankful episodes. lying piece s***.
1456,video ::exists:: ai: ::learns::
1457,ai doesn’t learn
1458,artificial intelligence absolutely this.
1468,thing ai human input tool replace ment ive ai covers trust shit till twik twick somemore
1476,​ oxford too? bro oxford makes fucking best musicians wtf lmao
1477,"swervedriver, foals supergrass oxford. jericho tavern famous venue/ pub"
1478,"bro, supergrass too? ok open another branch british music im gonna study much madchester lmao thx"
1491,"""fake fan alert"" - proceed say exact statement, except part guitar stolen. it, true. must super fun parties dude"
1495,"nearly 30 years since performance, music devolved something easily replaced ai. changed little little once."
1496,"really. think garbage bubble gum pop popular like 60s. i'd take dua lipa gunna shit day. besides, insane amount incredible music made like 15 year olds bedroom days. got look around good stuff"
1498,"sorry, that’s bullshit, shouldn’t searching good music, good music popular without trying, unlike today, noise foolish people call music unfairly popular."
1499,pop music always sucked. youve always dig good shit.
1505,"radiohead evolved sound since bends, much creative also great solo albums soundtracks individual members too."
1512,wait machine absorb
1516,mean ai music point.. alive.. care people behind it.. that's large part enjoying music imo
1521,um ... click track ai ...
1524,thanks man
1526,sounds exactly like sound would think ai would make
1527,happens feed ai guitar solos use replace woman screaming sound effect
1529,"overrated guitar player people dont play guitar barely play. cool yeah, genius...i dont"
1531,ai could make sounds
1532,good jonny tho (also jonny looks cool too)
1533,"ai never look cool, probably can’t come ideas good, i’m sure could take radiohead song input spit another pretty good radiohead-like song. maybe right soon"
1534,man im impressed byt ai think ai intresting def radiohead cooler forever even could make sounds..
1552,"idk, sounds like chad me. maybe y'all get good music"
1554,school need money lmao. crazy players though. you’ll hop jam session find best musicians world
1556,"@ukraineaissance2014 give drake honorary doctorate let give berklee's commencement address. ""the important thing need writing music producer....who write music."""
1559,"​ nah, music creativity talent everyone born with. plastic arts (painters, sculptors, etc), everyone produce high level product. true u develop ur talent lot effort there's innate talent nonetheless."
1569,ai coult totally make sound lol
1570,thought talking hair whole time
1571,mean...ai make too.
1572,guitars afraid man
1573,guitar i'd afraid too.
1576,think they're scared cobain hendrix
1577,"nah man, amplifier's afraid them, guitar jonny"
1593,checked songs. pretty awesome far.....
1596,could easily program ai add sorts weird fucked dissonant sounds.
1597,could easily program ai start sucking weiners well
1599,"oh brother, wait 2 years. ai basically became ""okay"" months ago. hope happen, know people one creative bone body gonna get popular using ai."
1600,"lmao, ""wait 2 years"""
1604,"someone takes good care guitars, scared"
1609,"why? talk great care maintaining instruments strings meant destroyed, replace anyways"
1612,"yeah, sounds exactly like ai generated"
1613,"really, ai generated things formulaic follow patterns. radiohead unpredictable band interesting music, maybe asked ai make radiohead song would dense shallow imitation would sound like radiohead."
1615,"​ record, describing true ai. true ai yet"
1616,"​​ dadabots ai sounds exactly like this. ai much ""creative"" formulaic."
1617,seem like ai expert
1621,ecept merry festherwells dallow falling upon evening strict rehicterost folows mere weasel downt corridors cathedral easle
1623,​@tonyjuanpailos think he's trying give example something (a seemingly random string words/non-words) ai would struggle quantify.
1626,nice prose good nonsense words bro
1627,"thanks, cant wait see ai try distill one xd might need 200 monkeys"
1632,"yes, radiohead rock band plays sings live, replaced ai. maybe pop singers, already using backing tracks vocals, yes, rock bands."
1642,rubbish people love means ai take
1648,get digitech whammy pedal it’s super easy copy.
1652,"treat guitar like damsel is. could never rough, even sounds cool lol"
1654,"i'm bassist pop kinda violently string. one day best friend saw said ""dude gonna break them"", like naah technique"
1657,"playing 25 years wouldn’t attempt shit (no - course tried something like interesting me, mainly jonny already it)"
1659,"yea? what? there's always ""rubbish"", forget something real comes along. honestly care justin bieber drake get replaced ai, good music still there, dig bit deeper."
1662,-tt9lg2ss1hnice
1664,​@shoegazer93 second part haiku.
1675,"it’s pretty cool actually get string make weird noises, hella risky though"
1678,tried once... turn great. change strings anyway- left mark hand string snapping full week. like red line thing.
1688,radiohead exactly music would sound like ai created
1691,sure proves incapability ai.
1695,"radiohead music created ai, real."
1700,"wow! agree clickbait headline, i've heard artist. good."
1704,still waiting nin/radiohead collaboration/tour. know sick be?
1709,congrats
1711,best
1718,nice
1724,good one lol
1734,genius
1736,"time, ai also able emulate this, come stuff original surprising (and beyond). performance (probably) remain human affair, composition, arrangement production become something human needed anymore. dark times indeed."
1739,"maybe know make music. reason make music min-max get best marketable product least effort possible, least people, would ai replace artists?"
1742,thank kind well argumented response. answer question: got article written chatgpt.
1743,dudes artist advocating replacement. ai definition unoriginal. get music business youre stupid.
1746,"one day, robots free us slavery ""creating art"" truly free work factories forever. beautiful."
1750,"lol, pretentious rush. alright mate. go off. us 'artsier' people keep making music ai churns hits, worry."
1752,seem like ai expert
1753,"ai absolutely able make music full soon, including music like created computers existed. works learning already created people. point creation product reason people create"
1755,-fg9cc ai already composing music full many years still people listening outside curiosity research.
1759,super underrated
1766,"feel little bit relieved, hearing facts. hope majority people around world, they'll still working bright future."
1768,issue past automation job training fired employees. job training we'd social push back now.
1770,"mention a.i. continue shrink available job opportunities, make rich richer."
1772,imagine ai starts demanding kind compensation worm
1773,great job! saw first video hours ago stop continue listening next like 6-7...
1774,"i'm confused. title says ""why ai never replace jobs"" video basically saying going happen quickly think. never happen."
1777,video feels off. bad points man. agi first technology surpass human intelligence. neural networks modeled brains evidence working similar way
1778,"lovely content, background instruments playing, pure art! debate would good"
1780,"cited boogiemen said ai replace jobs, expecting frame cgp grey's video ""humans need apply""."
1795,thankyou ican finnaly tell people ai put children unemployment
1796,debunk idea ai gonna lower salaries. im afraid true
1797,"hello hari, better check facts. ai/robots steadily replacing jobs years & we're pivot point job loss going accelerate rapid rate. one example many educators (teachers/professors) needed. many, many people likewise let go due superiority ai...."
1798,ai like replacing chainsaw place axe
1799,dude clearly denial. must great degree/ career replaced ai
1800,amazing channel. glad stumbled upon
1803,guy good - new sub
1804,"simple answer using ai job. using ai task / job do, ai help"
1805,thoughts think ai may take alot jobs may create alot newjobs
1807,program ai? humans?
1809,based ai trained
1810,@zsi thar ai goes buggy can't fix broken
1811,"@iamtheman325 goes human. doctors exist. make mistake assuming ai single entity. ""buggy"" ""broken"" ai could ""repaired"" simply superseeded another ai system. look evolution resulted creation humans living organisms.. survival fittest."
1812,"still highschool thinking getting dentistry parents insist anything tech based jobs. dont know do, dont know ai us humans coming years"
1814,"thank much going in-depth it. using ai coding, coding python 2 years. stopped interested bio dentistry. thank much help"
1815,bad future ai taking jobs. bad future ai giving employers enough leverage able demand employees work even hours.
1816,like channel think loosing jobs ai need open eyes
1819,"​ years now, jobs ai create automated ai?"
1821,unless ai becomes sentient decides pursue goals always service human beings always limited human needs
1822,love open source ai
1824,never gonna happen tried replacing truckers ai years ago failed dishwashers theyve trying replace thoes employees self washing places never
1826,"ai expose lazy ass people. like lawyer totally relied chatgpt hook, line, sinker."
1828,"watching video, may repeating something here, ai way less likely take jobs could be, human's sheer determination happen. (edit: emphasis 'less likely' alone stop it)"
1834,bro love videos
1841,"human born created , ai replace human decision making capabilities. ai good joke (pardon english)"
1843,one best videos ai . great work bro
1844,video brilliant. thank logically answered!
1845,"always thought ai smart replace jobs. makes happy, far right :d thanks video!"
1846,"agree! i've always intuitive sense ai replacing anything, i've never able express why..."
1849,"it'll downsize jobs ask me. we'll end part time use ai speed work immensely. even ai perfect, that's people for. ai spit information insane rates, humans correct errors."
1850,amazing overview human history pre-history modernity
1852,love channel logical approach . every creator praising a.i making insane claims views chose spit facts
1853,"sure forget economics work... fear ai, fear humans. trillionares future, think money come? everyone else."
1855,got ai mimicking 2pac's voice ...and sounds real peep dopfunk. he's writing music! ...and sounds good!!!
1857,"that's holding back gpt4 systems integration, office 365 company database. today gpt4 drafted priced quotes me, yesterday summer intern adapt excel vba he's learning c# never seen vba. gpt4 main collaborator technical matters. video age terribly."
1859,jobs require simple photoshop job got wiped ai imaging apps
1861,"current version ""ai"" programmed do. going suddenly think itself. learns human inputs can't take job. unless job generating random texts."
1862,"gpt4 check compliance tolerances certificates me. sort process data accurately loose plain english instructions. instructions clear, asked come appropriate requests clarification."
1863,well replaced human gfx artist midjourney. one restaurants go replaced handful waiter jobs bellabot. there's that...
1865,yeah nothing new. calculator ask functions thing ask clarification. mean currently ai advanced calculator way user asks it. waiting user ask questions.
1866,"ai ""programmed."" code. biggest thing people understand. mathematical models."
1869,thing agricultural revolution industrial revolution shifted position workforce. ai meant mimic human intelligence i.e. meant replace workforce.
1872,wow thats look like
1875,man genius! learnt much channel. really long sight vision.
1879,"teaching students 20 years, topic comes up, still recommend read ""profession"", isaac asimov. published long time ago (i believe already public domain), still excellent job explaining automation never completely ""replace humans""..."
1881,"may happen later people think, ai make us obsolete."
1883,​ fear mongering???? can't wait intelligence like gpt4 fully integrated office 365. far gpt4 already allowed move deputy earning work giving administrative support. that's 3 months without full systems integration.
1884,"that's wonderful, chris"
1885,"far worst video made, almost unsubscribed. yes, affect 1sr world. failed look ai affects disparity rich poor countries."
1888,ai take jobs definitely
1889,"best take ""a.i going replace us all"" yt! btw, i'm loving seeing face last couple videos!"
1892,love increased production value
1897,ai predict winning lottery numbers longer need work. sounds good me.
1898,"really good video, thanks"
1902,"lose jobs ai, need work robots it, everything free, money obsolete"
1903,love content flashing back destroys video. stop watching videos place.
1904,ai something everyone wants play right now. everyone plays trains it. gets smarter use it. yes always jobs...as slaves servers. hal. skynet. day ai figures maintain perpetuity know ends
1907,"finally, someone fear monger. i've enough videos predicting singularity event next 50 years, can't even prove ai technology works."
1909,"predict hari ... hitting one million subscribers end year love content , simple informative always unbiased"
1911,personally think hype ai propagated ceos tech companies increasing stocks attract investors supposedly next thing change humanity
1913,"off, mind think. ai could think box like scientists soon..."
1914,awesome video start finish made single simple prompt tho.
1918,"really good see talking videos, like format, nice camera presence. always love productions, great videos. congrats, good this..."
1921,bro trying hard show ur face. feels good
1923,"stories chatgpt amazing things outliers outright lies, part thing damn useless better googling yourself."
1924,love channel! great video.
1925,ai take jobs like drones deliver packages crypto replace money cars drive we’ll spend time virtual space and… whatever else venture capitalists tech bros hype extreme valuations cashing leaving investors holding bags vapour.
1926,"yup. online retail meant kill brick mortar. it’s decades aside crappy malls dying, person shopping experience still thriving."
1929,"least foreseeable future, human intelligence still irreplaceable. ai still, stands, remains artificial..."
1932,"grade moron would compare ai mechanical automation!! goal generative ai emulate eventually surpass human cognition itself, something never done before!! draw parallel fuckinng tractor computer even??!!"
1933,"iv impression ai bring output per person. yes jobs ""replaced"" . anyone unwilling learn outs might left behind. ai new tool, cars, computers, internet.... list goes on. knows, 100 years now? maybe, time think problem."
1934,guy video ai?
1939,"sidenote, worst thing companies using word ""ai"" basic machine learning existed way back ai thing"
1940,machine learning subset ai.
1942,"may technically true, ever since popularization neural nets 'ai' mostly used refer field deep learning. think called decision tree regressor 'ai' nowadays eyebrow raises."
1944,"ai thing around 1960s - term used describe logical inference, automated reasoning, automated proofs, machine learning search heuristics. nothing changed, besides two ai winters forced term common use."
1946,"ai 100% take over, question long take. way could believe that, believe something magical going brain."
1947,"ai may decrease total number jobs, may destroy yours. already using ai summarize video instead watching 17 min, going quit use ai pump content compensate? companies use ai pump gurbage users use ai consume less, wins?"
1948,earned sub me. awessome rational.
1949,"indian, ai created person"
1954,"ai get there, right unprofitable tech limitation, sure stay. even get hands american companies infamous censorship dictatorship"
1955,"ai basically new religion tech bros/intellectual idiots. predicting ""singularity"" human replacement last decades now."
1957,"man, used watch every one videos, unsubscribe. since face reveal pacing became off. stock footage plus narration perfect, care less look like. understand trying make channel relatable resilient ai replacement, like change"
1958,current ai systems definitely can't replace noticeable enough number humans said ai create jobs achieved agi fair enough i'm curious new jobs think achieve agi.
1970,yeah current ai still jobs left us
1974,"underestimate severity threats ai pose. get youtuber, need create content drives engagement."
1975,lowest viewed video mr ai tech billionaire.
1977,let's honest. artificial intelligence yet intelligent.
1979,thought clip indian tech youtuber look lips. first time seeing you. also since indian channel centered around tech guess indian tech youtuber. keep good work
1980,"speculate want, end, lands still taxed, core jobs sustain civilization still paid pennies, useless parasitic managers politicians paid mansions, yachts, private jets."
1981,"obviously ai nonsense. missing ai used excuse eliminate useless jobs detract company bottom line. lockdowns proved ""workers"" waste (office) space."
1984,ai right can't even distinguish canned salmon living salmon
1986,"man love channel. many idiotic statements tech ""geniuses"" fearmongering ai. skewered arguments made look easy. well done!"
1989,"think ai replace us, sure hell would good competitor, also ai advances fast cause information it, come time probably stagnate."
1990,agree. thank you.
1992,"that's case every (currently-tried) system, nice would blame one"
1994,yout video arrived panic searching way cope ai.
1995,"main panic excitement ai happening online world business connected it. areas, change way people work."
1997,japan aging countries severe worker shortage. labour ai frees greatly help.
1998,"ai increase workplace efficiency intelligence requirements certain jobs. worker shortage get bigger since need intelligent people. take farmers example, regular farmers can't compete big corporations need learn new skills handle technology job they've years."
1999,disagree. dont even need ai routine task automation. currently isnt recognised artificial intelligence rather applied statistics. market demand come without humans?
2004,use ai lol doom gloom guy.
2007,"productivity data actually evidence, think see true meaning. unique longer contribute economy say washing clothes. that's done machines. production."
2010,exactly guys predicting future kind doom ai wipe humans etc.
2013,"havent, read isaac asimov's books. predicted robots ai day work us, humans much free time cause dont need spent majority lifes working longer, bored, invent lot new things spare time."
2015,ok makes whole lot sense love someone points bullshit
2017,"dude, start teliing things others, start using quantum ai going hell ride future."
2024,worked captioning live phone calls hard hearing customers. everything computerized. translating regional accent grammar something ai do. took us year get fluent fast every us dialect.
2028,wow! never seen face! make great videos dude! handsome man.
2032,i'm actually masters dissertation topic took talking actual marketing professionals realise ai taking jobs indeed mainstream media paranoia
2033,feed hype cycle get vc funding. shit blockchain hype.
2034,first talking head video? nicely done always
2035,"maybe current ai versions replace anyone, agree inevitable point?"
2037,"know explain it, voice audio seems detached saying screen."
2040,rocking lately!! thanks great fun-learn!
2044,hey hari. new video format looking great! keep awesome content!
2045,"thaaaaaaank you. finally thoughts, easily digestible video. point video whenever people ask think ai. thanks lot"
2046,"please go back videos don't' keep interrupting show face? love voice, love videos, hate creators feel need make star instead information/education videos provide."
2048,glad hear man!
2049,amazing content. love consistency catchy interesting videos. also love decided show face. last videos started think custom ai cause voice control point lol
2050,"don’t know. something tells channel complete product ai, even doubt hari exists."
2053,"-guy white collar blue collar jobs annihilated ai, robotics, deep learning machine learning. wef 2030 agenda proof upcoming onslaught mankind. corrupt governments greedy corporations rule iron fist! wake up. already late!"
2054,awesome video! thank much!
2058,matrix ai approves message.
2059,ai replace majority jobs businesses go business long humans money buy products. ai replaces everyones job would buy products?
2060,"urgent warning: combination automation, ai, deep learning, machine learning, robotics dangerous threat humanity. poses immediate serious risk survival! need take action quickly it’s late."
2062,"*the wef agenda 2030 started. combination automation, ai, deep learning, machine learning, robotics destroy humanity. combination automation, ai, deep learning, machine learning, robotics destroy world humanity. past time cautious because, already late!*"
2063,automation ai ai whole different level. automation still requires human makes work less.
2064,"automation, ai, robotics become one mankind destroyed. alredy late!"
2065,"hari, agree you. hype around ai bit marketing play. anyway, love videos"
2067,"disrespect, sincerely, please revert face cam, kept unique. good video however!"
2069,love channel really enjoy new format enough anti ai hype video thank anti doomer
2070,love term “anti doomer.”
2075,that's openai's true goal agi. anything chatgpt prototype prototype that's serving purpose generating hype attracting investors fund true project.
2076,"no, create unique text based learning associations. going mind blown years think we've hit kind threshold, tech keep improving current models seem antiquated comparison."
2078,"agree, don’t get wrong. it’s still freaking amazing insanely useful know get it. it’s just… auto-complete steroids isn’t coming jobs anytime soon lol. type ai around corner well could, though"
2081,able shift systems develop reason logic rewarding true responses penalizing false ones? ai need develop internal model reasoning (i argue llm already version this)
2082,thank you.
2085,"-potter again, talking narrow form ai specifically here, large language models. don’t think reason. get better better mimicking human thought never achieve anything similar"
2090,no! praise chatgpt professional writers continue seethe.
2098,"ubi ridiculous concept. realistically best case would free soup provided government die everybody lives tent cities. general, nobody ever paid people provide value. figure provide new unrealized value die."
2102,imma cap look like sundar pichai
2105,fair enough
2106,ai going replace job. one guy ai replace job along hundred others.
2110,"hahahhah! ""so pick hammer"" sense annoyment, well come work then! love :) <3"
2113,"*the wef agenda 2030 started. combination automation, ai, deep learning, machine learning, robotics destroy humanity. already late!*"
2115,"ah, really appreciate insight man!"
2120,nice see man behind questions logically answered
2121,ai can't make new humans can. let's it.
2122,"ai care making new humans. ai able create new smarter ai, need humans all."
2123,interesting
2124,"nothing human brain could done ai. ai cheaper efficient human labour, replacing human labour forgone conclusion."
2125,"tech, retired 34 years programming, logic inescapable. thanks."
2126,"show face times, really handsome. please, i’m can’t “lgbt”"
2127,think speak everyone say face reveal great choice.
2129,"man, calm, measured rationality much needed antidote steady stream hyperactive alarmism see elsewhere mass media. keep good work, hari"
2131,@logicallyanswered really appreciate rationality guy uses. think many people stop watching videos take seriously since revealed face. indian people take seriously try put indian.
2133,"​ victimising yourself, indians known great engineers extremely hard working people (americans) respect indians please stop seeking attention"
2135,$50 says video made nervous ai :)
2137,"wow, finally saw face shocked........ guess expecting ai. fan content. keep bruh."
2139,"*warning: combination automation, ai, deep learning, machine learning robotics serious danger humanity, imminent threat humanity’s survival! already late*"
2140,"work machines automate factory work. trust me, humans required."
2141,"they're combining ai, deep learning machine learning robots, able walk able automate factory jobs. fully automated mc donald's texas already. 2030 everything ai robotics. already late!"
