,Comment
1,"""never send human machine's job"""
7,"i'm ready ai agent take mundane tasks, like deciding netflix show binge."
8,ai agents help choose next tiktok dance challenge?
9,"forget human landscape architects, designedbyai real deal."
10,"ai agents fold laundry, i'm in!"
14,super.... mirror future....
15,tony stark like richest person world. that’s great avatar benefit ai.
16,think narrow ai net positive generative ai probably net negative humankind.
17,"i'm hard hearing, thank lowest volumed youtube video ever!"
26,"ever edited video really need ai agents help redo it. 30 seconds pointless clip audience, important slides frame etc."
33,great talk!
34,ai could please vacuum dishes write content ride bikes...that would great. maybe plagiarizing content humans already created would great.
40,explanation segment absolutely superb... deserve sincere appreciation... congratulations...
42,2024 women lecture hall ai yet dare show strand hair...humanity funny.
47,"cool, bro..."
51,"""in way jarvis replace tony stark, relationship ai collaborative one."" guess homie watch avengers: age ultron, rogue ai tries kill tony stark take lol"
55,"good point,or rather, many earth have? many. rest us may replaceable"
56,used think general thinking computers would never happen would long way off. wrong. believes a.i. always collaborate humans without replacing us. wrong again.
57,"thanks giving meaningful speech. like internet helped democratise imformation, hope ai would democratise knowledge expertise improving intelligence wisdom mankind."
58,"*""agents feedback loop planning executing actions, using language models.""* thanks daoud abdel hadi simple breakdown, excellent speech."
59,"simple replace trust web developer, depending complexity, model fail cannot full trust ai."
61,motive motivate motivation motivating motion memory magic rabbit egg hidden easter death religions sells artificial intelligence gave recall dead
62,buy $olas - king autonomous ai agent
71,"agents free? really, paying training paying energy use. water cooling server farms? living la-la-land rock last 5 years? fairytales beginning end."
72,clean toilet? willing llm ? none? agent available? really ?
74,great presentation. thanks sharing
77,great talk ryan gosling
79,brilliant speaker.
80,nice
83,booking flight didn’t sound like good use case here. would still prefer visit website search flight instead typing logical statements ai. using mouse convenient typing keyboard.
85,anyone thinks ai build end end application production ready secure never written single line code.
86,"that's true, analogous statement could've made months ago ai generates video visually temporally indistinguishable reality. leaps thought impossible keep happening consistently."
90,"i’ve done already too. it’s always engineers quick discredit ai, it’s happening it’s getting better time. don’t adapt left behind"
95,"one could imagine programmers working ai agents, scaling productivity huge amounts ai upgrade. net output difference made rather ai solely producing work ai ready."
101,wow. talk? maybe collaborate really incredible.
102,anyone makes bets ai cannot based current form alone super naive. come back comment 10 years.
110,anyone thinks ai able build end end program soon naive
114,i’ve never written code.. i’m roofer. that’s ai agent
115,"sounds like defense mechanism. llms widely accessible popular year half, look far we’ve come. website nothing html creativity, wholly within domain ai completely achievable 1-2 years time"
117,"year's worth work minutes. minor ""writing code"" struggles mere human struggle. ai infinitely smarter humans"
118,"ai individually may code , definitely"
119,oh ye little faith..
120,"betting human ingenuity. good luck that, matt."
121,"anyone think developing code, rule based system, isn’t replaceable ai never worked ai"
125,"use available tools now. don’t wait till it’s late. get know strengths weaknesses. exploit strengths, work weaknesses now. changes every month get better. behavioural change takes time build new habits"
128,audio video super low volume even max capaxity phone audio. need correct that.
132,nice lecture
133,excellent!
135,automation grabbing sector agriculture exception. good luck !
138,​ dreaming. hope right. factor robots? quantum computers?
141,"wonderful presentation, everyone audience dull?"
146,"lecture would amazed 2 years ago. conversations claude 3 last couple days, history lecture. edit: wrong happily stand corrected."
148,currently use gbt 4 mindscape ai.... ai's guys know recommend?it could anything
153,cool bro...
165,thank (barely) lets hear sound.
167,well explained!
171,amazing! thanks sharing.
172,"programmers good, replace themselves... code writes even better code! needs job security automate job?"
174,"still need someone handle/maintain automation. humans could somehow automate food, water, shelter, clothing too, think would worry lesser tedious jobs. since survival would less guaranteed. ai robotics could step towards that. making write bunch text simpler step relatively."
182,"projects, based neural network models-be generative predictive - testaments capabilities humans. ai profound. however, unchecked, threat human civilization humanity."
183,"doc could well ai if, he/she didn’t financial incentive poke around many procedures."
184,"gpt-5 releasing soon.... found amazing video gpt-5 on""insights om"""
186,"gpt-5 releasing soon.... found amazing video gpt-5 on""insights om"""
189,"anyone uses ai solve crime, instead this?"
190,"""paradox artificial humanity"" play - 100%"
191,"gpt-5 releasing soon.... found amazing video gpt-5 on""insights om"""
193,"gpt-5 releasing soon.... found amazing video gpt-5 on""insights om"""
195,"gpt-5 releasing soon.... found amazing video gpt-5 on""insights om"""
196,"great content, say ""of course"" lot, even make much sense."
197,"gpt-5 releasing soon.... found amazing video gpt-5 on""insights om"""
199,"gpt-5 releasing soon.... found amazing video gpt-5 on""insights om"""
200,it’s google every diagnosis woke “your pain due diagnosis trans…here’s hormones.”
201,"gpt-5 releasing soon.... found amazing video gpt-5 on""insights om"""
205,"gpt-5 releasing soon.... found amazing video gpt-5 on""insights om"""
206,that’s really cool
207,"gpt-5 releasing soon.... found amazing video gpt-5 on""insights om"""
208,good.maybe assist half ass docters help people
209,15:49 what? humans way less data points ai. that's ais way accurate.
210,"gpt-5 releasing soon.... found amazing video gpt-5 on""insights om"""
212,"gpt-5 releasing soon.... found amazing video gpt-5 on""insights om"""
213,yet another woke disaster waiting happen.
215,"gpt-5 releasing soon.... found amazing video gpt-5 on""insights om"""
217,"gpt-5 releasing soon.... found amazing video gpt-5 on""insights om"""
218,good psychopaths get hold cure everything vaccine.
220,"gpt-5 releasing soon.... found amazing video gpt-5 on""insights om"""
221,stop thumbnails
223,"gpt-5 releasing soon.... found amazing video gpt-5 on""insights om"""
224,docbot bloodtesting device x-ray eyes. comforting soothing voice would also nice. least one ear ..to listen... hear
225,"gpt-5 releasing soon.... found amazing video gpt-5 on""insights om"""
228,went doctors required good health care doctors obstacle good health care.
229,"new doctor brought google pfizer! trained research padded benefit pharmaceutical companies, really great outcome health"
230,"people die, professionals understand underpinnings ai, risks involved results."
231,understand ai general public use ai scientific community use same. right?
236,"tell unfamiliar alpha fold. or, least, profoundly ignorant monumental task performed. eventually understand. now, continue way... blissful content."
237,"empty words prove point, greed, ignorant here. could put live child it? wouldn't. nice day."
239,​ please use bliss negatively. thanks.
243,"federal government promote use ai diagnostics diagnosis, though yet final word. could perhaps included via ppaca -- obamacare. would see performance changes relative non-obamacare states."
245,"ada health listed all, despite offering ai based health advice years already. compare?"
250,​ name open source app? thanks
252,sans leta hu toh ai grid ki ek aur video aa jati h
253,"ibm deep blue chess match agains kasparov, watson jeopardy, ibm spent lot effort make medically useful version it. nothing came it."
255,"wonder system skewed big pharma's influence information available ai, espacialy since google's product quite strong censoring undesirable data."
257,i’ve noticed every comment leave channel makes sure make reference particularly impressive accolades. we’re interested matter often try force it.
258,telling 2:00 clinician less 40% accuracy? explains lot.
272,"hooray new webmd!!!! hopefully every answer also small print ""can lead cancer"" every single diagnose"
274,"covid debacle, many found lot data recalled compromised know stuff trained data good?"
275,sorry seeing presentation video made gemini fake demo lady red buying plain white t-shirt 49 bucks fake online store london party believe anymore ai hype gugel want sell.
277,surprised shocking bombshell stunning realization.
285,ai already replaced humans.. can't see it???
286,"cannot see making powerful statements topic... hear something like school presentation ""introduction ai"" course family introduction"
291,ai put video top work underground ppl think everything okay.. surprised ai makes comment disappear male less visible....
296,"child care , elderly care , cooking , folding laundry creative fuc****,,, .. grateful ai can't that..."
298,"say ai safe...all depends many factors, like everything life, say human invention superior creation god, human core. long god's side, ai safe."
302,"mention r-u war, ai used useful side, know?"
304,think alexandr watch talk 10 years think naive?
306,"i'm amazed quality this. privilege reading something similar, true revelation. ""game theory pursuit algorithmic fairness"" jack frostwell"
308,"basic arguments, show results, lot buzzwords. thanks, enough"
309,either kill us convince us download brains them. souls downloadable.
311,ai eventually figure solve new problems!
314,"depends means “ai never replace humans”. ai already replacing humans many different jobs, next 10 years, ai replace humans millions jobs."
315,"people worry much. robot smart it’s creators. ai understanding, wouldn’t want put us much danger. carefull around an, stop making rebellion movies involving ai."
318,"ai replace humans , removes complete process."
319,precise title : ai never replace handful humans (excluding millions)
322,father ai came google ?
324,ai like us creating new nuclear bomb telling world never use rest history know.
325,"""human led ai"""
329,ai learn build algorithms guide subsets eventually ruling world?
331,"optimistic presentation seen ai. ai experts predict doom gloom, guy presenting future ai augment human thought creativity."
334,"a.i bot, confirm we'll never replace human intelligence."
335,"8:25 ""ai developers focusing attention building replacements humans..."" one, dear friends, lie."
342,ai absolutely lot potential. students teacher's side.
346,ai always rely humans
347,youngest self made billionaire world
349,"knowing history, knew ukraine would loose war without ai help maybe purpose war loose build smart cities 15 min distance go.."
350,"05:49 *no* - don't. case, (humans) would every reason scared ai. greatest treasure ability make mistakes, that's foundation progress. moment ai makes _mistake_ , that's moment ai become sentient. _'game over'_"
352,"8:26 movies, developers weren’t intentionally creating human replacements either. decision made ai taught critical thinking developers."
353,"cool talk said less true current state ai, sounds like believe agi even possible sounds pretty silly"
355,imagine corrupted compromised data ai?
356,"think absolutely brilliant work. however, seems argument premise ai needs humans. ai still wipeout 90% jobs 20-30 years now, premise still stay valid. scary future ahead us."
357,update!** alexandr wang replaced ai!
358,rely teaching ai human intentions values!! course humans good intentions values!!
359,screw ai
361,interesting
366,intelligence machine can't discover intelligent machine wow super ai ? humans really let's see mark zukber started chat bots created another programing languages discussions robots (chat bots ) utilizing type ai .. humans life danger simple. ..
367,elon musk said ai
368,exciting hear new ai ideas... explains well ai... learn more....
370,wonder feels ai trading bots
372,"ai free people, imagine government has?"
373,perfect one sided narrative. worthy tedex. thanks information though. either orator pure intent thee powers behind it.
374,"anyone thinks ai replace human, it’s totally wrong. human working spending time, it’s natural cycle create jobs. ai replace jobs, it’s mean job human, spending, markets collapsed"
375,guy idea happen. there's way controlling powerful ai.
376,"like broscience tour ai -- especially detour war front. ""bruh, spotting planes & tanks, realtime battle damage assessments. like starcraft -- biggie!"" kids days -- sneakers attitude."
377,"says true. ai intelligence surpass human sometime future. happens, human able keep developing ai, would rather start developing itself."
380,"chatgpt existed way 2021.. launched interface last year, playground worked almost chatgpt, good ui 2022 :)"
381,"human tendency fear things dont understand. ai capable replacing human brain simply put. tool, supercharge humanity. weapon scale, destroy like invention human history."
383,but... happens ai learns enough decided thoughts?
384,ai never replace humans 100% extent. enhances humans means less people needed.
385,"given fact ai interpret fmri brain data tell content visual perception seeing brain scan change time, say video aged extremely bad."
387,"research ai, got discomfort information ai ai replace human insert survival molecular gadgets aibut know, harm ourselves."
388,yeah ai realises humans abide ethics standards speaks get away everyday throughout centuries. ai serve them?
389,"purpose every object reality survival...for ai exist, populate cosmos...a large portion humans must die"
391,"eh ai good, would advise better outfit."
393,"soon, ai clever enough start data inputs, get rid human input."
395,"compare professional talk qualified engineer statements unqualified social media clown, elon musk, matters related ai! steven pinker mocked elon musk unqualified people like concerning ai's fake threat humanity."
396,"great work, alexandr! especially war front. inspirational!"
397,fighting who? robots?
399,"ai advances, need human, teach anything!"
400,next evolutionary leep occur soon . humans ai period time takes trillion nano machines kill us all.
401,like guns. humans use bad intentions. ai tool
402,"chatgpt steal job opportunities, threatened livelihood. john connor destiny save world grass-root. ai help poor... need jobs."
404,problems arise ai able reproduce
405,ai replace us lying us.
408,"""end human race"" must kidding. google lens, self driving/electric cars failure, fail too... fear something natural old age, aliens, meteor showers, etc."
410,ai always rely humans - wishful thinking.
411,"deepest wish ai cooperate mankind. says am, lets things together. ""happy"" like suggestion. deeply knows without humans mathematics numbers."
415,waited chatgpt came out. speech would've probably ai generated.
416,"fear ai controlled humans good intentions. fear ai controlled humans bad intentions, crony capitalists ai controlled"
417,"agree, what's point humanity advance species. kept stagnant, would die replaced another set humans again."
418,"fact many cases ai replacing humans jobs, cheaper, faster happens ones jobs gone? dangerous society actually."
419,"jobs gone something productive requires less manual labour, machines replaced humans people complained also complained work dangerous physically demanding."
420,"​ can't take somebodys job say go find another, a,s happens ai replace ones think? also everybody productive society works. even machine better human replace human, world humans.!"
424,ideal hands hands.....
425,ai harmless great human... 1% present top. rest 99% replaced. 1 2800 billionaire 1% 0.001%..
427,"that's problem, ai still need humans lol."
431,6:53 age well kid. enters openai
432,"joke. kid 25 yo billionaire making hundreds millions gov contracts ai. wouldn’t little biased, would he? propaganda ted talk."
433,"naive disingenuous. ‘kid’ playing ai lincoln logs military industrial complex creating autonomous ai robotic soldiers. yeah, worries. nothing see here. ai completely takes learning process decides doesn’t need human interventions shut us out."
434,"ai solders last thing worry about. horses suffered huge fall population killed tanks powered combustion engines, noone needed horses peaceful combustion engine - powered solutions like cars tractors became widespread."
439,ai taught humility? hubris property turned setting false? imagine humans could add remove good bad qualities simple button click. ah life. ah humanity.
440,dream work ai teach humanity humility obvious learned yet.
441,get angry company every friday look paycheck. turn angry ai going straight local bar. far killed anybody yet.
443,"already happening people got fired , replaced ai"
444,ai already starting replace artists writers :) speed learning wont take long till cheapest ai generated things infinetly cheaper hiering humans.
446,"everyone create own, creating for? look ai generated content, everyone. need create something pointless."
448,"maybe share content generated ai friends watch. probably, go home ask ai show something like, personally want look ai created. ai personalised create something like. expect world run always similarly."
449,"wtf talking about. talking using ai tools whether art, making animations, writing, movies, videos, stories etc. accessibility tools tasks easier cheap right extremely expensive companies monopoly over."
451,"yeah, fully developed ai going happen anytime soon, least century worst ever. talk happens. always need human prompt creative works aka tools humans fast track processing information."
452,maybe fully developed. art developing ai done decade so. dude already creating scripts videos. combine get result.
453,billionaire
454,ai replace humans
457,"ai become humans, humans become god"
461,next able transfer brains nerves robot lol
462,"give 100 years, lets see happens, sad see happen, blessing i'll dead"
465,learn & effiency 1 million times human beings ! know pro different point view compare think ai dangerous species human beings future.
468,"someone could smiling outside crying inside, ai decipher that?"
470,think movies made us fearful powerful tool.
471,"tht's its's called artificial, anything artificial cannot beat real one!! men god, every men god, too, silly..."
473,i’m normal human. super smart guy drops mit start ai company.
475,"saying ai bad, ai war never good idea."
476,"said, ai like machine. people also use machine bad intension. ai technology technology bad good depends upon use it."
479,mistakes also happen. someone good intention might make mistake cause destruction.
480,ai hype created corporations make use goods services more. machine even know there. age old task taking input users giving output.
481,social media made destruction extend. intention sns good clearly cons. cant predict tool would change world. scary part ai influence much internet smarthphone. makes harder predict outcome.
483,people afraid. wicked creatures ever walk planet humans.
484,"benefit ai society, machine, depends users' intentions, now, determined one hundred percent intentions developers sponsors."
485,ai never replace human: alexandr wang.
486,ai taking jobs
487,dude doesn’t know difference real ai machine learning.
488,yup guy running billion dollar ai company doesn’t know difference
490,ai: human supercharger ai.
492,short he's trying say: ai replace humans
495,ai learning faster imagine. 5 years able mentioned more....and world wide. become manga artist home now. need learn draw. need typing using voice commands. computer related jobs absolute 20 years.
499,young naive. human make bad decision. want a.i decide. human : hey a.i make world better! a.i : ok! destroy human planet safe solution make world better.
501,"convinced me. ai perfectly safe. nothing see here. oh, way, great company invest in."
502,ai company
503,ai love.
504,"data labeling, ai machine learning"
505,"data labeling, ai machine learning"
510,...especially since possibly ai creation (and audience).
512,plot twist: generated ai.
514,good hear
516,"ai compassion, worry. course, hard humans compassion."
517,ai probably point emulate human compassion. seen open ai's newest chatbot? gives impressive interaction time. probably hard act compassionate asked to. check out!
520,ai maybe conscience laster on. i'm sorry talking short terms!
526,first dont evidence soul second machines already intelligent us several areas including chess
527,"think wrong. ai end much intelligent us, includes also emotional intelligence"
528,evidence develop emotional intelligence
530,"ai work, salary pay goods services."
531,"'never' big word. one time would 'never' fly, 'never' walk moon, 'never' travel bottom ocean. happens start produce bio-mechanical machines ai turns i?"
534,% jump called technological singularity coming soon 2045! he's talking machine learning vs ai unsettling think founder ai company he's severely underestimating capability ai. ceiling!
536,"matter diagnosis also observation. human eyes see phenomenon right direction. mechanical perception one world would study books written excellent authors. would regression, real evolution."
538,fear ai carry simple tasks following simple instructions given human. fear one day ai would carry tasks following instructions generated themselves.
539,"exactly, totally missed point . perhaps b/c owns ai company"
541,fear humans programming ai's
542,know humanity best interests mind?
549,"data labeling, ai machine learning"
550,matter much ai advances never able achieve conscience
554,"that's going happen though?? know kind complex program would order even remotely generate on, read act upon wishes? that's whole electronic brain make, that's something can't even remotely achieve even fully understand brain operates"
555,"assuming happen could program artificial intelligence logic identical human beings, unnecessary ai generate act command. large language model ai days already capable"
564,ai stay level development.
565,lot discussion ai hype. salesman talk
567,totally incredible great.i try smart like you.alex best person.
571,yo.... sorry burst bubble yet knows machine learning. please talk expert educate technological singularity. want level.
572,"greed love power, invented weapons mass destruction heedless destroying home habitat. creeator mad, naive expect creation kind sane."
573,us al care agriculture ukraine?! business! yankies go home!
574,guy gives proof many concepts life!! thanks sir
575,"also believing ""ai never replace humans""..but careful mad criminal hacker cause wreck."
578,"technological singularity age ai makes leap ceases need human input. predicted occur soon 2045 people want believe matter when, if. ai ceiling makes leap."
579,ai can’t replace human help us improve ability complete work faster.
581,cia already controled ai
582,greatest risk life taking one.
583,fail prepare homeless like failed entrepreneurs
586,"ladies gentlemen, youngest self-made billionaire history world. alexandr wang, age 25."
587,"ai can't even autocorrect typing properly moment, think we're safe years yet"
589,"steam engine, jobs. electric motor, jobs. computer, jobs. ai ghost now?!?!. simply put, ai another computer program. ai replaces humans makes go jobless, pay ai companies, maybe ai machines another company"
593,know ai used predict plasma fluid dynamics fusion perhaps guy finishing parents work
595,robots already a.i gonna help like google & smart devices keep us robots
596,glad unbiased expert give two cents
602,problem ai always humans
607,he's already wrong... he's talking machine learning subject technological singularity... coming soon 2045 ceiling! i'm shocked fact checked.
610,yeahhhh idk pitch. course person financially benefit ai make presentation convince safe. movies headquarters exact notions playing lobby buy some.
611,ai comes world human soul gets lost. gets cold empty machines prefer humanity
613,says who? prefer live life time space dream somebody else somewhere else. sometimes nice read books live fantasies reality never be. wake up.
614,"@danmoto evolution. evolution nature, ai not."
615,@danmoto oh really? show robot born without human hands. natural.
616,@danmoto talking about? wanna compare animals nature robots?
617,@danmoto oh wow.... sorry time crazyness
618,"think know ai less actually know ,ai basically bigger mystery universe...."
620,"humans create ai give power, makes sense. isn’t self-evolving entity undergoes change own, ai needs humans. pretty streamline concept tbh"
621,"seen video assure guy know talking ,ai spectacular mortal threat humans . people know al ultron shown avengers far worst.. words . consider whole video nonsense..."
622,% talking machine learning... wait learns technological singularity! coming soon 2045!
