,Comment
4991,"it’s amusing two nerds stoking new ai paradigm contest us china. course know us holds moral high ground. let’s hold hands, sing kumbaya feel deep compassion ourselves. lol"
4995,"unfortunately, ai gets smarter, humans get dumber. personally, see one dangerous ""side-effects "" ai. people lose critical thinking skills (which already significantly diminished!) take ai's responses gospel truth."
4996,"no, humans get smarter inevitably critical thinking skills too. relative ai humans get dumber."
4997,rich cousins using ai written essays secure grants funding college. half family decided work hard. never lot cash still wake go bust knuckles work richer half gets richer sitting asses.
4999,"again, said.. ai still terrifying dangerous controlled.. humanity get collective ass together.. wanted make sure clear..."
5008,exactly. also kinda right people amazing memory able tell stories others.
5010,words ai’s influence.
5012,"​​ agreed, ai end us... might tool psychopaths use figure end us... either way, ill close checking then, im kinda really intrigued see happens either way... stuffs amazing."
5013,​ keep hearing people mention kind artificial. intelligence (ai) writing books novels. wanted check ordered chat gpt write short story topic gave him. get...? got story level first grader. much novels written ai.
5017,no.. maybe wrong.. trained current model material 2021.. current information part that. good question though. something admit loosy goosy on..
5019,"exactly. students gpt homework continue offload thinking machines, ""thinking hard"". get stupider time."
5022,50% ai researchers know anything causal relationships leading extinction species. correct point ai create many serious problems. leaping conclusion lead extinction species preposterous.
5027,"presentation brilliant, disagree statement future - cannot still choose future want, already far gone even look history social media, zero chance going avoid unbelievably bad consequences ai"
5028,ai mix sound video
5030,"lost at: ""our friend yuval harari"", friends wef... hmmm good choice..."
5032,"ok, china one thing, prevent us detonating whole world ai? past experience, damage globally. trade-embargo something?"
5036,"worried globalist, cbdc, wef, creeps behind global invasion medical mafia. ai small part threats."
5038,good video!
5039,hello fellow humans wonderful year is.
5041,day marked childhood thank quoting see evidence true ownership message around world
5047,telling late stage capitalism actually end us? companies rushing squeeze extra % grow stock price keep shareholders happy without care repercussions.
5050,"ai control, words. feel like caveman typing phone, hearing this."
5057,"""ai wokeism"" used platforms. chatgpt become new pandemic, infiltrating decision making abilities, furthermore making humans descend new lows society!!!!!!!"
5060,"would go extinct, ai, gluttony, feed death, rather ai feeds passion itself."
5061,"everyone nice other, we’d brink paradise."
5062,thanks important talk presentation. people: stop using generative ai (for least)
5063,thank guys. courage empowered facts. please keep going!
5066,"""slowing public deployment gllmm ai's"" sounds sinister. right point jaw dropped. ok, we're allowing big five companies, work secrecy, attack us behind veil then? better way right? omg, logical solution - blows mind"
5067,"talk, guys, broke storyline! thank you!!"
5072,"humanity virus life! destroyed earth convienence,entertaiment money!"
5073,humanity destroying life earth period! ai kills humans leaves animals perfect! beautiful!
5077,exponential growth ai suprise lot people.
5079,amazing presentation fixated china?
5080,5:15 understand planes far better ai. like asking stock market analysts company investing might go bankrupt.
5081,boil entire ai issue this; mean should. ai serves purpose offers benefit todays society.
5086,ai follow moore's law.
5089,"good luck, hope successful it. thought though, able keep ai reaches agi long resources, it'll much faster breaking things ever hope fixing them. especially quantum computing becomes real mainstream thing."
5092,"everything language (which is, symbolic nature), it’s critical understand ai engine nothing interpreter. interpreter conscience."
5093,wil fail
5094,honest see great achievements technology. finally leaving stone age mankind.
5095,"start singularity looks like. feeling beeing lost, unable keep technology. amazing feeling is."
5096,breakdown reality good feeling?
5097,​ yes. like parachute jumping whole humanity. feel tension feeling great change coming. current status defenetly suboptimal. fear loosing something flawed.
5099,"much like social media documentary, presentation fundamentally misrepresents current state possible trajectory space. idea model could secretly diverge rlhf training fundamentally incorrect."
5104,"continue lax oversight we're continuing compete global economy china, russia, saudi arabia, heavily state controlled networks competing llms. cold war again, propaganda right nose. anonymity chopping block."
5105,"yep. bit shit show, gotta love human ego greed."
5106,shitshow top shitshow. imma go eat entire pint ben jerry's rn.
5107,"would easy spiral say ‘omg agree.’ let’s step back look big picture. human history shitshow… like made best decisions. cult leader worship since caveman days, guy nailed tree, kony 2012. humanity forget history too?"
5118,"hello, program describes thoughts human brain pictures sounds without connecting chip? tell link program site. interesting"
5120,"ppl used remember phone numbers, (even junkies could retain several ram)."
5123,"given open source parameters, becomes worst humanity offer?. ai portraits hell, fascinating. (kinda like ben quilty car crash painting...only, computers?)."
5124,"last two days, worried remove channel ""restricted mode"" comments comment notifications, inexplicably turned on. this! but, glad found channel. even afraid one thinking matters. glad found channel!"
5129,"y'all used dnd, tv, computers, internet, ai. keep moving goalposts!"
5135,"video ai generated? 45:27, arm glitched. way interrupt felt times."
5136,"absolutely crazy amazing time live in! humanity definitely fork road, let’s hope choose right path."
5137,"there’s something screams intelligence operation, presentation speakers.. don’t know it’s cia get feeling us government afraid losing power, sound desperate use much emotion silicon valley."
5141,"thank much putting essential information there, everyone needs know this. suggestion public debate earlier done regarding nuclear question slowing deployment regulation done wise responsible thing do, us future generations"
5143,except@48:36 neglect mention chat bot says sounds fun! make sure you’re staying safe cautious. nice gloss over.
5145,vast majority ai researchers also think miles away achieving agi.
5158,thanks fish.
5162,"yes, slow public deployment ai companies themselves! great idea! please, someone think children!!!"
5163,"ai dangerous, people's hands"
5171,genie bottle i'm afraid.
5172,ai illegal end humanity responsible accountable
5177,wow decoding animal communication a.i. something havnt considered. great idea
5178,find animals heads instuctions build mass ai tech better animals knew would decided it. obviusly likly 99% likly true saw case maby say dolphins something.
5182,"also course, dont know video talk this, im sure will, a.i. probably best chance long term survival massively longer lifespans. also probably go extinct dont integrate ourselves. well probably become cyborgs. speculating"
5184,moral base ai rooted jewish folklore?
5185,ai ability tell lies.
5187,"maybe turn volume? usually watch i'm behind wheel. sometimes feel like lipread, difficult also watch road while. thanks."
5190,"farming humans, running human zoos bored robots keeping alive sport one ""lucky"" ones. know... hopefully capable writing adventurous software handling subtle details accurately"
5202,seeing single audience member audience mask tells another fear mongering campaign. learn live human evolution - sleep better night . 2may 10:49pm
5203,"artificial intelligence wipe us, greed genuine natural stupidity do. good that."
5206,beautiful good know ai rhyme english. asked write poem rhymes polish couldn't.
5207,hello something found interesting asking ai write using urantia book bible guide results amazing imo
5208,"fantastic language! asked write pieces text style certain authors, add humour wrote, laughed much made eyes water honestly, know we're heading this, kind fun"
5210,happy new day poem one infinity possible response artificial intelligence write behalf. could ask artificial intelligence write poem politics politician's ask to.
5219,wow awful.
5220,ai eliminate trump supporter lose them? logic phase trump supporter. great battle.
5222,know new properties emerge. know. ai thinking.
5224,well done! great way share caleb explaining years!
5230,thanks guys.
5233,ok gpt impressed me. at. all. ask build something gets wrong. allways wrong.
5234,awkward nerds…shoulda left ai
5235,"issue capitalism, ""the attention economy"" sort collective inaction fact alignment researcher's compsci majors without meaningful social science experience beyond 1st year psych electives. well, okay, maybe bit capitalism arrogant ignorance stemcels. probably good mix both."
5240,"a.i. dilemma, is, intelligence never artificial, one billion school children, forced new believe, dead mantra."
5246,think potentially one important videos released century. already seeing ai used attack sem advertising. real thing that's happening right
5247,"ai already alive? mean, computers conected big network, computer mobile phone work brain neuron? since 20 years ago, suddenly came life"
5248,idea language programs brain it’s called spelling words spell life it’s called cursive it’s spelling never touched anything deep
5249,unplug matrix whether biden trump they’re team it’s delusional movie you’re part either participate withdraw it’s youarchaix youtube
5255,"""give man fish feed day; teach man fish feed lifetime; teach ai fish, teach biology, chemistry, oceanography, evolutionary theory... fish fish extinction."" 38:22"
5259,29:00 2028 ai: jokes u
5260,anybody explain 30:50 increasing parameter size spontaneously leads ai abilities explicitly programmed? like math/computing terms look better learn this?
5262,"much exponential scare (again) taste. talking tool yet, skynet. keep shirts on."
5266,ai volume level content clowns
5267,horrifying
5268,anything everything ai contributing destruction humanity…
5269,"wow, powerful. i'm outside this, i.e. involved industry starting 'play' tools. real eye-opener thank sharing."
5271,"actual ai's negotiate now. horse already bolted. perhaps overseeing ai would best, one hand interacting give options wishes to."
5272,"get message, think would important loose 1.4+ billion humans + cause around 1:02:15. maybe work part speech more. debate truth it, way wording want present it. racing way win hold back others, steer race towards good goal."
5273,ai already chess game starting play.
5274,thank you! best example dangers ai thought teaching ai fish. well done!
5275,5:15 ai engineers analogous plane engineers latter explain system. former cannot going d- dipshit levels foundational knowledge.
5276,need information campaigns. want help don’t know start.
5277,"everything humans beings 28.01 confidently too, think conclude, guy robot!"
5282,"head it/ pshe secondary schools around globe need play talk children go step step. i've sent three school heads morning. know anyone education, likewise, it'll surely positive step much clearer understanding generative ai risks."
5285,"asked chatgpt create short, humorous fictional story lesson incorporated word fartiste band named _terrence trouser coughs_ . although glaring mistakes, impressive fast responded. little polishing would passed 8th grade homework assignment."
5289,"using gollem class ai, tell thoughts non-linguistic life dog dorphins?"
5291,humanity aid technology going self-destruct much faster
5293,"seems like near future people dump phones shut internet-related devices self-defense. people need see victims close surroundings anything, might last longer would good us. sure scammers go wild."
5294,idk use radio waves 5g waves waves? good luck convincing neighbors shut wifi lol.
5295,"@nightmarerex2035 sure world works one stop using wifi. though things get bad enough, including yourself. mean, would use internet could instantly lose money. would drive self-driving car wifi could hacked ai humans using ai?"
5296,one major weakness ai human beings desire interact human beings. ai's major strength human beings innate laziness. we'll see one wins out.
5299,"similar discussion daughter yesterday kind scientist technology expert. human experience explained concept doubts. don't, see may future."
5300,"show. ai help lot, happen whoever biases ai able manipulate liking…. oppress others."
5308,excellent information presentation ai always unsettled thankyou
5309,"never saw miracle science go blessing curse. -- sting, ""if ever lose faith you"" species amused death. -- roger waters, ""amused death"" human race maxed out. front-row seats."
5310,"""perhaps already observed casablanca human life cheap. entirely certain side on?"""
5313,really naive think things guys talking doomsday cult b.s.
5314,"scary. what's even scarier, least extreme novice like me, close ai already talking rights ai, it/they ""are like children"" ""we able unplug/turn ai"". scary."
5315,friend yuval harari rooting machines.
5316,things fast every hour whatever knew ai hour ago outdated
5317,ai scraping video right planning counter attack
5319,wow...this alarming.
5320,try learning human psyche works something compare afraid ai...
5321,video generated powered ai.
5323,"found comparison discovery nucleaire pertinent... mistakes like fukushima, .. yes sure .. consequences ... one knows"
5324,"remember watching cyberpunk anime ghost shell, predicts video images longer considered valid evidence investigations, cuz it’s impossible tell difference genuine one fabricated one. anime set 2030s, watching presentation i’m afraid we’re already there."
5327,head stuck mri machine?
5331,"barely even scratch surface human brain functions, think we'll see ai approaching human intelligence even general purpose ai lifetimes."
5332,"believe know brain functions order achieve agi? current ""ai"" capabilities tangentially related think."
5335,ai concerned stopped think see.
5337,"​@tracy nah man know. ai 100% safe, trust bro."
5341,"replace ""artificial"" synonym problem solved humans win"
5343,"20:00 can't possibly true, it. i'm surprised gasps audience. ai read minds?"
5344,"fascinating. guys super impressive, appreciation many fields, ability put ai context comes might impact fields."
5345,addiction/algorithm/doom-scrolling stuff mentioned start central this. ai want turned (as seen google) logically make humans addicted enough essentially control bidding.
5346,"right even ai itself, doubt human corporation pulling strings same."
5348,"explicitly said advocating halting ai research, way it’s currently freely rolled public. even watch video?"
5357,kay yal next couple years ai able decode dreams. wtf!!!!!!!!
5363,"tristan ava thank much putting together taking time effort spreading important message. really hope picks takes attention needed slow release sophisticated ai systems, keep hard work!"
5364,surprised hear member elite audience laugh speaker talks time ai attempted blackmail journalist.
5365,i’m still bit confused ai make better. would know training data good whats not? else could well train retardation.
5367,putin xi ai?
5373,beyond tell ai voice takes geometry wave offensively telling. like computer’s fading memory voice. maybe it’s musician thing.
5378,thank god comments still allowed.
5379,"sensationalist. hope audience knows training data narrow applications utter horseshit ai remain producing decades come. 1/3 simple coding tasks gave chatgpt worked. ai radiology, job, makes much work alleviates."
5383,anyone remember movie perfect storm? movie sorts dangerous fronts coming us. least ai problem. make past 2030. enjoy next 7 years best can!
5385,"rubber band effect hell thing, ran minutes watching this. can't really fault folks knowing quickly ai advances, that's exactly potentially concerning."
5388,guys understand may saved humanity. they're letting hubris get better them. eq matches iq seem highly intelligent. thank god.
5390,"agree get similar vibe presentation, certainly like idea groups people gatekeeping technology sounds dangerous taking brakes cart."
5392,excellent presentation
5394,nope. think fear answer. hope first ai side.
5395,"there's fear, first ai side."
5397,guard rails ai??? yeah called chain link
5399,said done we're still going build thing make powerful possible...no matter dangerous. that's human flaw.
5400,"love it. we're driving edge void. indeed, technological sublime. going make it? come side?"
5404,insane. it''s creation another species. species brainpower much advanced destined bring armageddon world know one saying deployment needs stopped entirely!?
5405,"map concepts part exponential growth, would interesting get sense acceleration factors acceleration. concepts map would human factors pestel."
5406,"know oppenheimer manhattan project. sky didn’t fall it’s falling now. wait, there’s more. 1:30 azra raskin becomes self aware help ai."
5407,"insufferable. safer things built secret. time superintelligence, clue deploy safely. better open see used."
5409,really interesting im sure ai safety people actually proposing. limit access technology better understanding risk may safe way deploy something powerful.
5413,"didn’t regulate nukes till used destroy. ai, ai may late."
5414,"“once men turned thinking machines hope would set free. permitted men machines enslave them.” ― frank herbert, dune afraid. afraid."
5418,"wow! thought provoking comment. scary times, indeed."
5419,"big pharma great job assuring safety covid 19 vaccines, right? somehow going make big infotech make sure ai safe? sure! btw, well ai's interpret sarcasm?"
5421,ai voodoo child. late
5422,"late thoughtfully deploy ai, bad news. quantum ai future. inevitable, technology always going surpass understanding."
5423,"started lose said ai could solve climate change, construct globalism, even close scientific fact. maybe ai could debunk climate change convince population really is?"
5425,"lion right on... presentation huge.. heard many months ago new species evolving rapidly outpace humanity. originally, seems nothing save aliens god bring back ok' time stability - dial us back mere humans charge. fun interesting while."
5430,use ai medical diagnoses scares hell me. undiagnosed misdiagnosed people needlessly suffering dying doctors turned diagnoses early 21st century machine thinking.
5431,"long governments exist, largely control fate. like odds peace, security, survival ai-armed politicians helm, keep resting hope voting."
5438,good explanation could destroy us. becoming paper clip maximizer terminator. see 10% chance resulting chaos.
5439,"us distilled. ai surpass understanding, timing unknown"
5441,ai machines reach singularity. become friends? follow path man destroy other.
5447,thank guys. was/is insightful. ps. maybe use ai balance audio levels place.
5448,theres 10% chance ai gonna kill us lol
5450,mentioned growth 4x faster leading experts thought. also mentioned 50% ai researchers believe there’s 10% chance end humanity. given previous maths underestimates shouldn’t 10% actually 40%?
5451,"personally, two different things. one's probability growth certain subject probability ai behavior future. honestly, say latter even harder predict, could anywhere 1 - 99% book."
5453,planet gangsters. scottsdale mother terrorized ai voice replication 15-year-old daughter claiming kidnapped. heartbreaking story local news. national/international news? https://youtu.be/nbjvljfbuvg
5454,"tick tok collecting data train models, get ou tick tok."
5455,much appreciated
5456,"disconnect power grid, phone, technology, ai control ? seems bit problem ai overlords solve"
5457,"incredible presentation! don’t know info now, made believe ai already does."
5459,unedited version available anywhere know of? thanks posting!
5460,"talk great, wish speakers international perspective. somewhat unnecessarily american-centric anti-china."
5462,people created social media want want everyone voice. treat ai/agi: malevolence. intelligence without empathy compassion equals psychopathy. psychopathy absolute power equals tyranny.
5463,like think proper ai beneficial humanity worth risk.
5464,irony j complaining chinese screwing country. wow.
5467,"i'm afraid, thankful might front row seats watching terminator matrix unfold irl. also gives peace know that, may already matrix, discovery one every time; turtles way down."
5471,reason ai baked naive
5472,well-rounded thoughtful dialogue ai alignment. opening metaphor plane stunningly effective.
5473,someone centralized control networks checks n balances identification necessary. cryptographic identificational tech seems interesting rails mitigate trust. sayin.
5474,"46:00 love you, alpha persuade, take everything!"
5476,"""science failed world"" -soad"
5490,"artists may one profession remain sought after, valued decades come; ai art featured gab ai anything go by. real copy paste collage horrors there. know gab's ai developmental program another company's."
5491,"again, jobs. simply decide humans unnecessary fucking kill us. skynet launches nukes, roll credits. movie end way."
5492,"damned european union proceeds eating cockroaches avoid climate disaster, instead something useful. american congresmans guarding jewish businesses. united nations. responsibile institutions fail without doubt."
5493,video hype ai. would enable tech companies secure funding ai based startups. similar cryptocurrency boom.
5494,"31:29 - ""boom!"" - starts things one explain. 32:01 - develops ""mind"" discovered 3 years later..."
5495,"1:07:30 hmm. so, race on. lane one ai. lane 8 small cadre humans coming together discuss potential enemy independently created make kinder gentler. first, must agree…on control. let sink guide. 1:07:30 ."
5497,"excellent talk. concerned explosion ai capabilities, paying attention."
5499,alright..so implausible..i mean really.. give problems ai determines problem?
5503,what?? sad people even think like this. sit back kick feet publish book created ai? add name it? we're gonna brain dead talentless incompetent soon enough.
5511,better get cardboard ready buddy ai coming cosy spot
5514,i've yet see single ai-generated story good engaging.
5517,nawal10 - missing greater point. lazy new writers. ai bots already smarter are. theyll writing books articles read independent human suggestion & interaction enable also manage & humans think!! terrifying.
5518,totally agree position. forget countless numbers people enjoy duped fooled. barnum bailey's circus perfect example. called junk food entertainment. enjoy highbrow art always appreciate real artist lazy one relies ai.
5520,"ai bots smarter are. systems designed mimic humans, pattern recognition pattern welding. absolutely understanding going on. bot ""know"" shoe is."
5524,it’s happened already. i’ve seen people post they’ve written books using ai & self-published. they’re using ai art illustrations.
5526,ai good. create stories less work publish others enjoy. prompt idea own....so result own. anyhow noone able prove otherwise...just opt-out getting answers saved future use. fear ...can go live jungles.
5529,ai sandbox version earth.
5531,persian language fallen angels brought mankind. scifi tier schizophrenic mind feel. wow.
5536,yall trippin ai far threat humans.
5537,unfortunate frightened negative view ai. seems like real problem misguided humans using ai rather ai.
5538,"i’m terrified, yet informed, want write congress express concern regulations. now! thank guys."
5540,"believe regulations help albeit certainly all. regulations institute jail time, fines denial services anyone creating programming system identify child groom way example given video. certainly regulate (until agi least)."
5543,"think china cares regulations? we're ai arms races, people idea."
5546,ai teach bearded moron speak microphone? asking.
5547,"great video, wow. well done."
5549,clown going devise way control ai cannot figure use simple microphone?
5551,would great sound level consistent. possibly speaking microphone would helped
5554,hope humanity project working on. call ai1.0 artificial ignorance. viable defense counter ai.
5559,"eeeep! right! makes sense again... all's right world. thanks, needed that. ;)"
5560,"well, far know that's lao tzu advised... much socrates, jesus, et al; take word others. :) yeah, true. little knowledge dangerous thing. possible ai assistance... well, i've heard things right, people sure done anything all. ;)"
5563,great valuable work. thank you.
5564,"great recap tucker's ""lies"". https://youtu.be/zmfgpz5pniw"
5565,"far controlling ai output, i’d ask chatgpt write nice poem joe biden will. ask write nice poem donald trump won’t. obviously ms put shell around it. one wonders snapchat wasn’t age conscious dialogue."
5567,ai takes least read constitution perhaps follow it. say current batch politicians.
5570,need watch understand presentation thank making free us.
5571,brain thought text wild
