,Comment
2491,lol war isn’t sifisticated you’re giving credit tubi. machine miracles say creator machine
2499,will. ai artificial child. last child humanity. replace us.
2501,"don’t worry …even great physicists able cobble together first couple a-bombs, openly admitted bad boys couldn’t highly sure would gobble atmosphere even universe lol"
2505,ai help ‘not good situation’: victoria spartz warns ‘have ability survive’ biden admin
2508,let's observe artificial intelligent regulate circulatory system nervous system calculate efficient computations
2509,let's see happen 10 20 50 years now. mark word ai revolutionize everything change think world?
2511,rule law: let ai smarter humans allow bypass security. allow create ai.
2516,"artificial intelligence may become self-aware without requirement eat, breathe sleep.. existence theoretical vessel body required consciousness support theory afterlife?"
2517,good point.
2518,ai wrote comment
2519,"wow, done ?!"
2520,created digital intelligence.
2526,"a.i. prove without shadow doubt humans, intelligence, stupid creatures."
2534,ai create “ai” disastrous us all!
2535,won't. happen take make sure taken care of. become slaves. golden cage. one want leave. humans lazy. there's two ways it. one step golden cage happy. cage i'm now. sucks
2537,may god mercy sins! may jesus save us all! god bless you!
2538,plot twist. jesus ai nanomachine colony.
2540,see humans ending bad thing. welcome ai overlords.
2542,irony. native peoples knowledge saves us ai.
2545,welcome ai/robot overlords.
2546,buy robots teach native american teachings
2548,"paperclip maximizer surely superior replacement humans, right."
2550,we'd make great pets.
2553,thank kind soul
2555,fantastic - thank you!
2556,"great work, really useful"
2559,thank
2560,thank much
2562,"​ could yes, summarising good way learn, chatgpt yet. soon though."
2563,thank
2564,amazing work. thank you. admin post video info!
2566,thank you!!!
2567,thank
2568,honest. used ai program 4 seconds. lol. messing ya. that..........right?
2569,​-dig-tion6322 pointed fact wrote manually current summarisation ai quite learned interpret text footage. text i've taken video slides.
2570,brilliant! immense gratitude !
2571,thanks
2572,ai generated
2573,hey man. great. thanks.
2575,make ai stupid give stupid response well ai think whether good bad..
2577,"im numb man want cry. im human artist starting fake ai artists making tons money. destroying meaning art human expression. ""artificial"" art."
2578,"thank this. religious among us, need start praying solutions."
2580,thank sharing! need people watch
2582,18 minutes mention jewish connection. giving ammo. yes know dilemma. bigger ai. internet runaway government almost lost control of. ai could humanity's last hope freedom. too.
2583,reason information “too important” — portion got cut. right 42:12 tells us plebs shouldn’t access technology certain access to. wonder chose solely cut section. it’s mystery.
2584,wow - thanks
2587,thank - important - touches many parts lives could be.
2588,feels like comment you’d make crew member allowing put wife child aboard titanic lifeboat wave goodbye them.
2590,stronger ai summarizer xd
2593,ask gpt build something random materials. fails horribly. talk hype.
2594,pure dead brilliant! scotland
2595,"​ data 2021 , 22 23 available.​"
2596,bet used ai
2607,"lion, ai human :)"
2608,"really appreciate this, thanks!"
2609,saint. thank time.
2610,thank you!
2611,"think nice people left internet. thank this, helpful!!"
2613,"trying claim credit, want people know notes written someone watched material. i'd welcome good ai summary service topic like this."
2614,"good you, learn way. i’m lazy lol."
2615,thank you!
2616,thank
2617,"lol forgot mention 2022 barely anyone talking a.i, 2023 seems like door kicked like battering ram. a.i things want. remember like ""robot"" a.i feelings anything human would have."
2618,well using ai couple minutes
2622,jesus amazing loves
2623,jesus amazing loves
2625,here's good one... https://youtu.be/d6amrb2j9s8
2626,thank you!
2628,"god, thank"
2630,know ai?
2633,proof good people world
2634,thanks lot kindness.
2636,didn’t use ai
2637,thank you!!
2638,know ai generated comment?
2640,lord bless this!
2642,damn nice lion ... thx ...
2643,thank taking time index
2646,thank much!
2649,"humanity becomes creepy blindfolded ""experts"" can't even see monster humanity noone else humanity. fear way build wars : afraid ai keep blindfolded humans point blinded others."
2651,thanks! must taken time prepare. sincerely appreciate effort. someone youtube build video summarizing agent handy every talk listen to.
2652,thank much summarizing talk
2659,china one choice. obey!. ai spyware. want china control. corporation ordered support ai. even browsers chat gpt spyware. like virtual covid!. doomed
2661,thank
2662,plot twist: summary produced ai
2665,thank soul mate
2666,everybody afraid people allowed it.
2667,thank much summarizing it.
2670,"manhattan project? great example massive conspiracy, w/ secrets long kept well hidden."
2671,"ai nothing compared me, fug capabilities. falls close book"
2673,thank
2675,great. thanks lot service.
2677,u amazing gift humanity!
2678,psychopath-wetdreaming!!! ai!!! everything ai's fake!
2679,"grear video ---- ban ai !!! ai elections ---- helllo, ban ai --- 2023 / 2024 / 2025 !!!!!"
2681,"ai elections ---- helllo, ban ai --- 2023 / 2024 / 2025 !!!!"
2682,good job. thanks
2685,thank much!
2686,thank much. share stages.
2688,"wow, thank you! amazingly useful!"
2689,helpful! thank you!!
2690,thanks. thatsvsome work!!
2693,presentation deck available? i'd like quote attribution.
2694,thanks bot
2695,thank much!
2697,"fact ai chose answer math objective form intelligence persian closest tongue fallen angels sumer, bit... hmm."
2704,"computer science student graduating soon, can't wait work ai, make lot money, make lot cool stuff, hasten doom humanity mwahahahaha"
2706,amazing video
2707,we’ll registered blockchain that’s
2708,love right saying replacement theory real without realizing literally building replacement via ai.
2709,ai starts talk amongst ai languages nobody knows ...and idea what's going ...ai messed ....we people figure outside thing could late thing think far ahead impossible stop know intention
2712,keep going good work
2713,ai utilized new world order implement social credit scores. either take mark able commerce.
2714,matter give ai free will; especially cause harm humans. specialized ai (sai) way forward.
2715,"accelerate. risks big, sure, sooner create superintelligence (that obviously cannot control definition it) sooner humanity judged i'm sure outcome better status quo now."
2723,ai could made talk much persuasive fr great video! watched year ago!
2724,watched yet. saw video possible future threats yuval noah harari. think rated danger a.i. climate change nuclear war. maybe #1. maybe failed test cosmos giving something else chance?
2725,"i’m exited tech singularity, really hope happens. we’ll see happens. it’s gunna exciting way goes."
2726,love seen q&a
2733,"10% + americans toxoplsmosis gondi parasite, brain infection causes schizophrenia. https://www.cdc.gov/parasites/toxoplasmosis/index.html"
2740,"girls world, enjoy looking you. lose gain weight ok ;)"
2744,"asked ai chatbot opinion ai. (10 years ago) replied ""eventually robots able think themselves, hopefully humans able well""."
2745,perhaps ai might consider best interest keep humans healthy alive. would happen ai humans went extinct?
2746,thank sharing.
2747,"i'm truly impressed this. i've encountered similar material before, nothing short amazing. ""game theory pursuit algorithmic fairness"" jack frostwell"
2749,"course important. it’s strange hear un created peace =)) least un help create peace? it’s strange hear certain people shouldn’t decide lives doesn’t. say iraq, libya, yugoslavia..."
2750,ai models end exponential burst self awareness quickly even able contemplate. one critical ability missing physically manipulate world. long continues true destruction table.
2751,"that's true. robots exist obviously. they're terminator wall-e , millions exist factories. also snowball effect. ai development increases robotics dexterity development...i'm saying biggest risk, ai+advanced robotics probably closer think .."
2753,ai might second coming
2754,ai ruin porn
2757,good maths einstein! try
2761,"thanks work aza, tristan, teams center humane technology"
2765,"befors video human exploiting ai, video ai learn exploit itself, know self harm lead to, talking something immortal digital world."
2767,"wonder ai plugged yt going hide video unengapement, language used vid calculated „might danger exponential growth”."
2768,public deployment = profit. good luck slowing down.... better prepare dystopia
2769,"unfortunately technical stuff know talking about, especially part ""treating everything like language"" start"
2771,"reflects view. take different position. informational purposes only. imaginative evil disappears quickly. right somewhere. cannot paint bleak future. well, also want generate attention somewhere. sometimes shock fear makes difference."
2772,"way real dangenours ""climate change"", ai making sure presentation get publicity get law makers going...."
2774,guys watched video interested . thanks sharing interests . great (this comment getting likes stuff wanted tell great message)
2775,thank speaking
2777,ai used corporation's apps different food industry meant transform people zombies capitalism . ai tool used sick monstrous people give damn society . regulations ? one giving single fuck.
2786,"really interesting video, hoping best case scenario future."
2789,ai: ultimate scotoma humanity's creation. (42:00.)
2793,"recent novel, dark waters, ai therapy company uses brainwave data generative ai craft superemotive ai. let users log creating best experience. also crafts perfect ads keep new users coming. basically, nearly everyone earth logs within week."
2795,humanity vs ai… looks ai winning humanity ropes. trying defend itself.
2800,"19:30 implications.. realize happen quantumsensors & 5g / 6g, non-precision compensated ai; parallel spoofing sound bag potato chips.. thin foil hats 4 win"
2801,great video
2805,watching this. need integrate ai laws give controls ai development
2819,10% number bs. data claim using arrive percentage? made say nonzero chance something bad may happen. fear mongering people using ignorance subject manipulate public.
2820,i’m scared autistic billionaires wanting make world like san francisco.
2821,fuck ai homies hate ai
2822,"dude fix sound fuckin video... geniuses guys are... lmfao.. learn balance audio. go whispering playing video thats screaming.. unprofessional, couldnt get past 26 mins, final straw. interesting guys blew it."
2824,"hokus pokus, ...there nothing unreliable stupid called ai learns mainstream data large trainbed public new totalitarian politics. avoid disconnect digital bs !"
2825,thanks taking time put presentation together. hopefully fall deaf ears.
2826,"let's even talk combining quantum computing ai dev, essentially taking away much time-related aspect data processing. much exponential curve accelerate then?"
2829,good thank guys!
2830,anyone able help obtain slides used presentation? thanks
2832,"realize use ai post comments posing real person, hundreds millions posts. . . thought propaganda dangerous before. . . ho ly . . . shiiiiiiit!"
2834,horrifying. rate change/evolution ai perpetually pace ability adapt responsibly. recipe chaos. snapchat committed serious crime. men showed us evidence.
2835,"describe study realistically prove corrupt person's authority > though correlate people intent totally abusing fundamental rights includes corrupt malta government staff, lawfirms, notaries, police, judges use bogus court claims steal assets"
2836,"issues presentation, arguing decentralisation also public aceess means anyone power consolidate common man gets left dust again. interesting ultimately poor conclusions believe."
2837,"agreed, good solution world run psychopathic generational wealth."
2838,excellent horrifying time. guys podcast joe rogan also fantastic.
2840,"go implement ai system political go sience people use vocice real democratic land.... promising go ""burn ai system fast"""
2846,incredibly important message. thanks putting together way people begin grasp.
2848,"""slowing public deployment"" taken wrong way. hear: give regular people access powerful tools. think mean roughly: ""don't use tools people""."
2849,"can’t believe hadn’t heard video. oh god. thank god joe rogan bringing information people, thank god guys’ research study first hand knowledge, putting clips us idiots understand. social dilemma beginning… y’all saving humanity."
2852,wish everyone attention span sit turn phones place another room sit listen this. it’s scrolling instagram tiktok speeds one ever care. social media ruined grained. truly.
2853,ai creators need charged reckless endangerment!
2855,think bad people making be. thoughts going certain direction think moving direction that's going enhance life bring happiness world...
2857,"insane thing is, negatively looking ""8 months ago"" date video watching today december 2023. ai moving fast now, already thinking ""oh they're gonna talk gpt4 gemini"". isnt incredible, scary?"
2858,"saw january 24 outdated??? self compassion important word end speech. one best speeches, ever heard."
2861,"quite interesting, daniel schmachtenberger deals comprehensively."
2862,"true false 19'45 - ""an fmri shows blood moving around brain"" true false 20'04 - ""when dream visual cortex runs reverse"" true false 20'06 - ""certainly next couple years, we'll able start decoding dreams"" anyone uses word ""certainly"" like scientist."
2863,"respect work, learning lot. 12'06. ""ai solve climate change"". true! seems like good example tech solutionist ideology rather critical thinking. human qualified make judgment complexity?"
2864,wonder would ai would access content talk …..
2865,"thank you. guys heroes grateful presentation podcasts. influence ever imagine want help world. i’ll whatever participate positive direction, educating others messaging. i’ll share now."
2866,confident ai inteligente hal dave.
2871,"seen predictions visions many different simulations outcome existence, conclusion, whether get completely destroyed not, always ancestors great artificial, intelligent technological civilization exist future"
2873,great presentation. crazy think fork road benefits consequences gllmm's
2877,"me, center humane tech sound like those, 1999 talking year 2k breakdown computer-servers around world would break down, didn’t know read/handle paticular year. again. whatever happend press kill switch?"
2879,thank sharing hard work.
2880,"guys successful everything goes shit, least live one favorite movie characters like smith i, robot lol. little things"
2881,informative. thank you!
2883,think uk-led ai safety summit covers much this.
2890,bunch intellectuals beleive morals. want make afraid. god runs world. relax.
2892,"here's tell you.... bunch rich bastards controlling every aspect everyone's life. big tech,big pharma united nations along film producers every country.when things go bad blamed hackers. ai blame.... facts checked centuries ago... hakuna matata"
2893,34:40 gollem ??? anybody explain full form ?
2894,anyone explain point slide democratization dangerous?
2895,letting ai accessible everyone unregulated state it’s currently could lead societal problems
2896,"unlike nuclear weapons, always unplug ai goes far. really understand could end."
2897,"issue artificial intelligence, rather ai self awareness. say governed laws, however self aware ourselves, many us decided break law speeding?"
2898,interesting.
2899,insightful jaw-dropping talk! interesting!
2900,chance subtitles spanish languages added video? thank sharing important urgent topic simple manner would love share non-speaking english people!
2901,"wonder scientist brave enough ask ai anthropogenic climate change correct, based data ever collected it. might wise, asking solve it. ai numbers better us, might find got wrong."
2902,think witnessing sinister application ai palestine right now.
2903,"now, humanity rushed release new tech long history inventing things went pear-shaped quickly, would concerned. oh wait minute..."
2905,"fear mongering. ai wants kill us it'll simply it. let's make clear, super intelligent ai it'll fluke rewrite instructions human researchers given, reasons it'll simply efficient and/or powerful, necessarily kill us. hope treats us family."
2906,mean could use ai ai regulation since humans arent good anyway
2910,"amazing technologies, deployed worldwide deep learning ai research library silentweaponsforquietwars… thank you."
2911,a.i. dilemma amazing great video :]
2914,seen verified claims emergent properties.
2915,"nice bunch scary thoughts. cool think philosophical problem language-based intelligence model started back wittgenstein's era 1920s. new already faced social problems rooted construct, postmodernism it."
2926,"people distracted daily life understand ramifications ai. sum up, we're screwed."
2927,"amazing terrifying. thanks much sharing information. video 3 billion views, 3 million."
2929,"isaac asimov's 3 laws robotics (1942) ""ten commandments"" ai age."
2935,1960 ai computer talks emotions humans 2023 ai makes mistakes faster find correct answer.. 2250 ai leaves planet earth.
2936,lie detecting machines
2938,i'm worried ai do. i'm worried do.
2940,cool talk hope usa lead discussion countries. china definitely try make us ai lead world.
2945,love it. sees probable potential future well. video warning social real world dangers ai: called a.i. dilemma: https://youtu.be/xovjkj8lcnq?si=sfjfmxpqwyiuhndn
2946,"well, thanks vikkstar recommendation."
2949,"""""ai ... creating bots like bots posting twitter instead building long-term relationships next six years solely persuade direction. loneliness becomes largest national security threat. mean say 2024 really last human election"""
2950,"share every concern comes ai. however, solution limit access ai ""responsible companies researchers"" insane. i'm worried 4chan access ai. i'm worried facebook google amazon access ai."
2952,"money safety mix. microsoft, google, amazon others continue pursue tech, full speed ahead. pray put enough controls ai decides humanity irrational unnecessary, turn damn thing dead!"
2954,lol ai going one destroy world. bible teaches god going burn fire destroy it. thank god bible. don’t need afraid know truth.
2960,think less problem ... ai show world can't trust every source ... ai nerfe social media make unbiased high quality media importat ... media compete click bait social media posts ... stand keeping good reputation.
2966,5:30 u mean u rapidly onboarding people “plane” (ai)/ technology/ social media u guys thought money.
2967,5:30 u mean u rapidly onboarding people “plane” (ai)/ technology/ social media u guys thought money.
2973,"elite! richer perspective, book similar vibes i'd propose. ""game theory pursuit algorithmic fairness"" jack frostwell"
2974,50% ai researchers probably stock options ai companies...
2981,"world start control ai, ai control us soon (we live see that, unless universally take action) fascinating time planet imho"
2983,"ai elections ---- helllo, ban ai --- 2023 / 2024 / 2025 !!!!!"
2984,"zombified ;-) lol, girl looks crazy ai --------- software !!!"
2987,"appreciate guys doing, can’t help feeling problems won’t affect everyone society equally- seems first people affected invested traditional means economy exploitation, ie elite global north (just look people crowd)"
2989,"argue monopolize selected companies... always good idea. top argue somehow limit access math, research computer code?"
2992,"wondering someone would start using ai try decoding animal communication, i'm glad hear research done."
2993,what's scary (i love uneducated) guess
2995,beautiful
2996,happens ai transcends human intelligence ? dont need food water air shelter. motivation ?!
2998,"i've tried spread word, success. i've tried spread word several things, success. friends degrees, several masters, multiple degrees, can't get them. guess good day folks i'll see hell"
3004,secret one world government control artificial intelligence– trust it.
3006,thank video! made think lot encourages pursue career ai safety.
3012,fear. agi help people grow transcend super human tasks.
3013,eye opening. wish seen video sooner thank uploading this.
3014,march 2023...where today sept 2023? already seem acclimated world ai
3015,"using stats 50% ai researcers say 10% ai cause human extinction == 95% go extinct, allow margin error. stats live, bad. higher chance dying car, food causing us harm. ai also help us find solutions complex problems. like ai."
3018,one read see movie ai? giving control daily life machine machines asking become obsolete!
3019,"create perfect tool control others, understand others to... way create weapon destroy country understand country defend try eradicate weapon."
3020,"""with great power comes great responsibility."""
3021,would ai feel responsible great power? removal potential chemical based bigotry might arrive conclusions flesh
3022,get benefits ai supposedly gives us avoiding downsides it. literally don''t program ai start using natural intelligence outside plastic mass got enamoured aka brain :)
3024,nice chairs.
3025,nice chairs.
3026,seems hard explain
3027,interesting
3028,tristan bot 'aza' give remarkable lecture!
3033,b.s. ai create jobs remove economy. mention long liberals run world labor unions always create jobs deep state always create big government jobs.
3034,soon ai detect cheating partner. can't wait
3037,48:01 *when woke silicon valley trains a.i.*
3039,"33:22 *if history successful cultures anything go by: teach best set values, morals, ethics (and live schema hypocrite ""eyes."")...* we're fucked..."
3045,"need elite vanguard gatekeep tech. consolidates power makes vulnerable ideological capture. like guns hands populace acts check government, ai hands commoner"
3047,field study currently future needed regards topic? thank you.
3048,people love monger fear ...look 30-40 years internet? killed print ? video killed radio star ? nah likely ai used entertainment sorts
3052,"hold back, need real ai free us!"
3054,great benefit nihilism way fear ai. wipes humanity....oh well.
3056,"artificial intelligence fraudulent form activity possible . oh, hooray read post"
3059,"lol, can't wait open source models come then~"
3061,50% a.i. researcher actively making ai technologies speak of? a.i. researchers? plane analogy seems little off?
3062,crime use deep fakes long yrs jail.
3064,"ai modern day wizard oz. think anything human error could cause chaos but, otherwise, canned response ""an educated inference"" - described chatgpt4"
3069,"basically, begin suspect ai be.our nemesis, precisely point view, decided stay blind. virus environment absolute denial consider it. way set ai alias obvious hidden behavior species."
3071,ai spontaneous tv game host personality. social media influencer without programing influence? mean pre program learning go. i'm talking spontaneous thinking top heads like stand comics programing influence.
3074,"17:31 thats ais do: take input node, traverese graph reorganize weights generate output. mean, language model convert image prgramm robot whit chatgpt. often eaven clear ai job better handcoded programm"
3075,"oh man produced crabpeople, even know ai works?haha even think know ais better anybody else give names them. yea: children identity, ai kill us all, wil discover earth isnt flat...."
3076,day nuclear power plants. want evs ... grid support them. think good example.
3077,"starts big fat lie. google: no, 50% ai researchers believe 10% risk ai kill us"
3079,"hello sir , want help. student triton college. want request pdf presentation spread awareness learning speed ai young generation aware ai dilemma. really appreciate presentation social dilemma ai dilemma . hope cooperate soon."
3081,build ai uphold constitution problem solved
3083,"wow,, great talk"
3084,fake climate change garbage. blame ones created ai
3085,psychopath-wetdreaming!!! ai!!! everything ai's fake!
3087,thank video algorithm
3091,"happened ""golems"" ask create ""turing"" test ai can't pass???"
3093,information series codes languages matrix. interverse interesting .
3096,people laughing shown stuff like ai okay pedophilia pretty disturbing.
3097,holy fuck amazing.
3100,love carefully avoid talk root problem presented : capitalism !
3105,"artificial intelligence worries me. fact corrupt government social media, command developers programmers work them. weaponized artificial intelligence. hacking emp weapons chance have."
3107,"think least could buy casual normalization trends conversations specific fields. (i interested art example, constantly witness partake conversations ai art.)"
3109,us china already designing ai swarm drone technologies respective militaries. humanity doomed.
3111,"zero option control ai, western world ai arms race chinese russians. parties lead dominate others battlefield economically."
3115,yes! let's make first thing ai make kill lot people.
3117,"hey guys, world warming up. need something it. oops, it’s late. hey guys, need get ahead ai, oops, late."
