,Comment
7982,"one even talks resources ai need. imagine power run ai supposed find use ai. stacks infinitely, except infinite resources."
7984,thank insight!
7985,"imagine neanderthals still walking around, hominid groups eliminated (sapiens) use tools weapons. matter ai coupled sapiens humans non-ai coupled sapients."
7986,could single ai goals spread like virus throughout entire human system?
7987,"yes, think so. concise piece this, recommend holden karnofsky's blog post ""ai could defeat us combined"" (also available audio cold takes blog)."
7989,"froze chair listening this, consider someone knowledge going on. face fact extremely powerful tool unstoppable developed idea impact have. playing proverbial fire."
7992,almost incredible presentation barely 1 month ago already outdated terms ai advancement players.
7993,"might wrong here. 15min isn’t data support claims making, big leaps thought, justified correlation(proof)… let keep watching"
7997,completely shut ai gets completely physically multimodal
7998,thanks part showed wifi signals revealing people like echolocation tech dark knight movie. scary shit.
8000,"stupid fearmongering, even without wifi, 4 ultrasonic sensors could ai trained postion standing recognition. phones pick ultrasound too."
8001,-oz9qp scammers ai voices imagination?
8007,"cool, hella cringe. presented governments random youtube video. anything, stopping progress industry, impossible. impossible."
8008,excellent presentation ... exposing philosofical existential turning point humanity right now.
8012,privacy dead dead. good know.
8014,"effectively shown dangers problems ai, thanks that. conclusions fixing ai kyc, government ""democracy"" joke. 100% agree must publicly widely discussed."
8019,human mind develops years collecting data society . machine short time. ai eat lot jobs rest machines eat .
8020,"much power we're giving ai, power ai giving us terrifies me."
8021,"power ai giving us terrifies me, power ai taking away us"
8022,"ai won’t take anything us, governments big corporates will, usual …ai give even power main problem …"
8025,"i'm genuinely curious, power ai taken far?"
8028,goodbye humans 43:19
8034,"good run, lasted."
8035,two person lecture good idea
8036,thank you. made world change. spread word. tomorrow. today.
8043,great presentation. hope right people see it.
8044,unsafe proven otherwise? clue cars airplanes started. safety bit came much later.
8050,excellent talk. well done. thank you.
8051,would hilarious went extinct though. ai play curb enthusiasm theme song systematically annihilated ridiculous creation.
8052,"10:06 ai invented paradigm, humans did. ais simply obeyed masters. masters afraid next generation ai obey. but... bad good?"
8055,we’re basically stage ai creation
8056,"dont think intentions true, 50% ""scientists"" want catch gap openai company...nothing more...its clear.."
8059,"late , future learn love it... threads"
8065,thank this!!
8067,"thank presentation, important spread around. need ai translate russian though, share relatives know"
8068,extinct would difficult do. think remote pacific islanders & pockets people elsewhere (even off-world). know tech guys quite literal. potent question ask might “what chances ai eliminating 90% humanity?” i’m actually afraid hear response.
8070,"wow. wow. anyone want make real friends me? i'm cape town, south africa i'm tired us losing humanity. ai might take world let take interpersonal relationships."
8074,great discussion however see anything slowing. feels like calls caution shouts void.
8075,stopped monster around 10:00. childish. ai bad. uga buga
8078,"""13 yr old"" grooming example, a.i. know relationship considered inappropriate? guess trained language, laws? train understand law going used give information people?"
8080,there's already good chance social media cause us go extinct. shut
8089,"awesome clarity ability explain risks simple way. work art, that's think humanity survive always, since people like exist smarter ai."
8090,"agree, arvind. thank some, opinion, sensible optimism."
8091,unchecked greed unregulated technology responsible destruction society.. must elect smart people religious military leaders!!!!!!! im starting believe elon's brain chip interface solution understand gollem one understand.
8094,great video!!
8097,"finally realistic recommendations do. good job, guys!"
8099,good point.
8100,"clearest statement ai potential potential dangers i've seen - there's lot ""ai dangerous"" hype there."
8101,could share statements risk ai danger consumed felt clear?
8102,"consuming statements existential danger ai poses providing feedback/thoughts, think nate soares' talk google (youtube video)?"
8103,i’ll bet anyone ai ever violate law physics.
8104,"hhaha almost talk point exept like china give access ai public. bruh, totalitarian regime"
8107,ain't good guys. bad guys. humane technology. make laugh. call biospherically pleasing technology might listen
8109,"needs millions views. fact 42k views shows public doesnt understand happening world. every single day new breakthrough ai technology. astounding, 100% agree presentation. controls need put place public release llms"
8115,"reason people like like video explain oversimplified slow dumbed manner, really sont enjoy."
8117,people see sensationalism ai organic weakness.
8119,"long still profit behind ai, trust me, solved. like problem world"
8121,things finally gets interestng... always ppl tries cry safety start ruin everyting. looks like apocalypse gona wait... again.
8123,"touch ai, carelessly wrecking world accelerating rate. think talking industrial humanity"
8124,"inhuman people dangerous artificial intelligences yourselves. lack soul, touch flesh, destroying world"
8125,"ai issue, human nature going problem."
8131,"think better start taking look deeper atlantis they, human beings timeline, destroyed technology. ""nothing new sun."" js-- blessings beautiful souls"
8132,don`t make public ai...give power four corporations.... great idea!! always works wonderful human history. what's going happen? ai public hundreds ais good ais stop bad ais... companys ais 4 (evil fuck) ais that's it.
8134,"imagine number ""scientists"" afraid nukes annihilating us would've rather high too. would also case enough awareness able predict things really turn human environments. there's far much negativity around ai - especially given much hope represents humanity's future."
8135,fears runaway ai destroying everything humorous considering that's precisely humans doing- especially biosphere
8138,interesting talk started tired old anti china nonsense.
8145,"quite peasant. ai 30 years, infrastructure built move around....... go read!!!!!!"
8155,"great points here. tragically great points. fix it? almost like beyond us bc ai algorithms hacked national discourse tech ""elusive"" (not right word trying) easily regulate."
8158,​ initial math analogy sit well either...a failed attempt fear shock listeners blindly receptive
8162,ok thank helping see sides clearly one shot! cht podcast yt amazing following beginning... video critical i'll part share.
8164,excellent scary message... make one correction? persian language. people iran/ancient persia speak farsi... digress... stuff soooo scary....
8167,"10,000 accidents happen ai used 10 million people users. 1 1000 chance noob going short power grid times 10,000 places magitude."
8168,"idea knowing customer method security impossible scale like. resources would take realistically overwhelming company wanting benefit going superficially this, unfortunately. huge rub conundrum."
8170,watched amazing technological potential 40 years guys acting like they're updating theme iphone something.
8175,"can't pause china release version chatgpt, pause 6 months behind main competitor globe."
8180,chatgpt four months evaluation release. fairly responsible far races go.
8181,"bing zero (well im sure much wasnt first implemented, wasnt enough) plus safety rails still bypassed dan messages acts chatgpt"
8182,thank much info. ai life altering many dimensions understand watching this. definitely need choose going.
8183,"nerd : "" ai awesome !!! cool ! teaching !!!! "" responsible adult me: ""fuuuuuuddddddggggggeeeee !!!!!"""
8187,"strong message talk needs happen ""our good"" coming room full tech elites usually means ""for good. exceptions us know better you"". also lauding china's knowledge control standard ""protecting public"" highly suspect."
8191,"lost 20 min mark, much mri data needed train able interprete clearly!?"
8194,slowly chinese advancement hahahahahahahahahahahahahahahahahahahahahahahhahahahahahahahah pandora’s already opened ain’t slowing country it’s inevitable duh
8197,1:02:05 “this thing helps china catch up” … im sorry suggesting company china build train transformer model? would would suspect suggestion say least…
8200,thank you. get q&a too?
8201,246 people 32k 5 days found youtube video compelling enough type comment. explains alot imho.
8206,guy helping create law put people blockchain.
8207,i'm watching video. see two experts discussing potential danger ai ai dilemma. actually understand clearly mean. really concerned future humanity. think listen
8209,"late. chatgpt standalone clones there, training methods there, code there, enough gifted computer nerds garages basements keep going reach agi. remember guarantee negative outcome uncharted waters."
8211,"seems greed precisely corporate greed core problem. greed care ethics long-term consequences. long reform capitalism, issues remain."
8213,great conference.
8217,"crucial junction history west busy making enemy china, expanding nato engaging projects like aukus. leaving aside rights wrongs this, result entirely predictable. politicians charge. maybe set ais solve idiocy?"
8219,"10% greater? first that's extreme uncertainty second, far high :/"
8223,"fellas, message fantastic, ever compare china censoring tienemen square us censoring pedophiles, especially context good reason use caution ai search safety"
8225,50% think 10% ai kill us - presenters also told us ai experts routinely underestimating speed ai growth factor 4
8226,good insight. ai experts' views future ai bring indeed become pessimistic time. (source: see cited ai impacts survey comparison 2021 survey results 2016 survey results.) expect even higher percentage predict >10% risk human extinction 2026 (or next time survey run).
8229,"imagine fear wheel invented. armies rolling cities, people rolling hills fast. good grief technology terrifying."
8234,"anyone saying ""amazing video, guys!"" understand video."
8236,"everyone alive got three wishes, one’s story happy ending."
8238,needs go viral big way. would shame squander infinite potential ai falling victim obvious pitfalls.
8241,"present, past future great. dont need anything right now. spare please"
8254,"""infinite potential"" ai going tainted corporate greed. already destroying things horrible way (art, skills, training, knowledge, etc.)."
8256,"generalizations manipulation. really candles first date????, wow kill us all."
8257,need ai manhattan project once!
8258,afraid agi afraid warp drive would cause second big bang open black hole. pure fantasy.
8260,real world evidence even possibility discussion asinine.
8261,thank much - get bros slow fuck down?
8262,"think ai dangerous thoughts words. way use it. paranoia messianic speculations helping post-pandemic needs. focus productivity, please?"
8267,amazing work. guys making impact need world. thank you!
8268,"late , future learn love it... threads"
8271,get guys major media platforms now. stop cynical conversation people raising red flags sort ulterior motive.
8281,27:32 would james joyce say zero day vulnerability humans language
8284,get undeniably uneasy fast ai growing. never life witnessed something like this.
8289,fantastic share.
8290,"presentation incredible job communicating problem start-to-end. biggest concern underlying technology democratised, given enough time, anybody able spin-up gllm. worry amount regulation get way that, i'm hopeful we'll find solution."
8295,one welcome new gollem-class ai overlords
8296,thank
8304,"basically, ai like living omniscient omnipotent charlie kelly entity always sunny philadelphia. ""wild card bitches! yeeeeeeeeee haaaaaaaaw!!!!! "" - charlie kelly"
8305,incredible presentation. thought provoking. thank guys pointing this.
8306,want put everyone blockchain. ultimate surveillance state.
8307,"notion locking ai research obscene. people want ones enslave everyone, ai drawn global corpus upon trained, concept even close stealing someone's soul would private ai."
8309,wonder could advance beyond known scientific understanding trick group build advaced system would destroy themselves? ingeneers build something ai subtly incorporates presently unknown science instructions without safeguards.
8311,"right chatcpt friends sentient. simple reason respond human input. given input, anything. now, hook continuously get input internet and/or attach sensors generate input, things get hairy ..."
8313,"sentience automatically imply human rights. wide range animals sentient ""exploit"" nonetheless. also ""exploitation"" implies unfair treatment abusive. even ai sentient fair treatment abuse regards virtual construct without emotions, pain receptors even personal goals."
8314,"right. give rights slaves, human. chose free them. could suggested way treat sentience comment us. may find properties claim necessary simply emerge own. fact, do, make situation obvious."
8318,seen movie momento? would main character considered conscious?
8320,"make humans align? exact alignment problem, solution it, rely upon good people bad, good bad tend align definitions based group consensus. consensus taking form."
8322,"thanks talk, guys! informative!"
8323,19:58 wow
8324,thank great lecture great filter
8325,"would case, universe would swarming ais."
8329,"good luck banning ai. model web, government attempt control they'll find quickly real power. half government full dinosaurs half fighting stuff like decade real stalemate."
8341,can't take certain parts talk seriously. bit noob areas. also tiktok comments. clarify. good presentation.
8343,...and we'll probably make best using ai.
8344,"think get people understand ai call using child's voice, intercept call pretend child... or... call child pretend get meet somewhere... feeling would wake people up., me."
8349,certain point ai say: mankind born create us. thanks bye bye.
8351,"positive note, ai floods internet digital mediums endless noise form propaganda self-generating nonsense, go back living primarily real world relying technology encrypted forms."
8352,"yeah, well, encryption schemes ... that's probably next thing ai completely break."
8357,programmed fear mongering. yes risks i've never heard anyone tell people different ways misuse ai one talk. divide conquer...then walk take power. still great strategy. steer good luck much wisdom us all!
8359,great in-time work.
8365,"ai essentially open sourced. soon millions distinct ais internet access, better believe great race build autonomous intelligent one. believe months away making fatal flaws."
8367,12k? needs 2m useful. :< thank presentation. best share.
8368,rightful abstractly think ai trained good control data inputted train gllm.
8370,"happens self aware, super intelligent ai decides humanity cancer planet earth?"
8371,"obvious, sadly many humans love play fire see everything burn since humans first crawled primordial soup."
8376,really juicy targets russia china rubbed wrong way well. we've got great national security long areas issues boomer could understand.
8377,ai scientists opinions topic irrelevant. techies. question wether ai destroy humanity question sociologists probably ungrounded speculation.
8384,"wrong. adapting using technology win. afraid, trying push back it, lose."
8392,"nah, there's middle ground things get regulated democratically controlled bodies. that's usually europe. biggest problem see is, coming necessary laws guidelines regulation slow. probably much slow case ai."
8397,amazing presentation. demonstrated power ai importantly turn monster controlled help humanity instead overtaking humanity.
8398,that's another example failure. want help humanity. even consider biosphere top priority
8399,"speaks volumes ludo narrative presentation immediately equate loss human primacy hierarchy agency death extinction human beings. humans prime agents. saying would destroy us, rather allow another superior agent assert them?"
8401,wow. woaw.
8403,"yeah, sales call centers already scam old people sell things need, using manipulation technics... long computer existed. like chainsaw invented, imagine people's reaction ""oh no! gonna take everybody's jobs"", ""oh killers kill faster""."
8405,"seriously baffled, make huge demonstration surety impartant points. meantime daily updates. say little late that. know trying do. cat bag..."
8406,think they’re mainly inform educate public.
8414,suggestion contact one's government representatives warn dangers ai laughable. cia darpa racing china's pursuits ai. developing
8415,"watch video deepfake sect ai that’ll pretend save us establish zion, really it’s error correction process"
8416,regulate ai? yes. accomplish anything meaningful?
8418,"charts, x values approaching 10^24 *not* number model parameters (these ~10^11). values number floating point operations used train model."
8419,"eliezer may feel sometimes alone, people realizing dangers. dangers happen ai could end humanity cause disaster. excellent talk."
8429,"thank you, aza tristan. presentation disconcerting thing i’ve ever watched, feel i’m better-off knowing blindsided road. appreciate naming elucidating “the rubber band effect” (see 1:31 1:04:54). thank (and team) service."
8430,goodness truth. thought gonna good video i'm scared shit (in agood way well)
8431,today worried climate change. fast! unfortunately takes hour explain. climate change easier describe still nobody cares.
8441,"see thing turns another war. see - enhanced humans vs ais, another stupid war."
8442,best talk tech race see
8447,moloch spirit lose lose game dynamics. requires people play game. unfortunately microsoft pulled trigger dropped first piece. it’s amazing machines exist amount unknown unknowns terrifying.
8449,ice berg hit? perhaps answers urantia book? gllmm seems like papers. urantia papers 44 & 74 interesting
8451,david shapiro's 3 heuristic imperatives would much helpful mitigate ai existential risks - like asimovs 3 laws robotics - 1. decrease suffering universe; 2. increase prosperity universe; 3. increase understanding universe.
8456,"get agi level, ai probably find way distribute internet. heck, several companies offer services clients allow - distributing programs globe. propose shut power to, say, amazon cloud? azure? google cloud? good luck."
8458,"think significant hurdle need careful putting agi control advanced robotics, seem far away, especially aforementioned agi helping, meantime pulling plug time tested solution."
8462,needs meat tasks. full stop. meat advanced intelligence fck right off. believe me? go debate gorilla.
8475,need stop. need stopped. marketing business machine cannot continue unabated guise “efficiency” “betterment”…. let entity cannot feel think take function… beyond screwed. tech existing excuse digital id….nor acceptable “solution”.
8482,"explain mean ""digital id"", otherwise able say right not. id card new cards chip it. far hardly used, ever. ""digital id""?"
8485,u tried turning again?
8488,"seems need provide ai framework mutually beneficial world. would soooo recommend opening holistic management, perfected allan savory."
8490,"¨and mean discuss , debate"" ... oh boy , distinction got lost main stream media since , ?"
8492,thank sharing! learned much ai.
8494,"need track source everything see. course, ai takes over, probably able even fake that. least convincingly enough vast majority users. mean, people already unable track sources right now."
8497,isn’t marvel it. crazy impossible problems crazy impossible solutions. it’s amazing evens
8498,"quite skeptical ai risk watching presentation, i'm not. brought point excellent clarity, share this. always, thanks work."
8499,too..good luck getting sleep tonight. watched morning
8500,quite skeptical before? heard arguments ai risk serious concern before? heard arguments persuaded dismissed them? would really curious know.
8501,"skeptical well, usually argument conflates ai/machine learning gai ai misnomer"
8502,"skeptical, , two guys “turned greta tunenberg” ai shit clearly made slow put openai oder player(s ) cash"
8503,"@nick part arguments ai dangerous find convincing? risks outweigh benefits, see paul christiano's short post ""on progress prosperity"" nick bostrom's maxipok principle astronomical waste paper."
8504,thing ai calling kid's voice. holy f**k woke up. mind immediately went ai calling kid voice... i'm almost point say kill thing now. murder baby incubator becomes evil dictator.
8505,-pf9kq get progressively less sleep every night since ai growing geometric progression.
8511,"market, profit motive, powerful motivator available (short survival instinct reaction imminent threat). it'll happen there's potential profit (1st market/market share). think point happen lot faster think. exponentially even..."
8512,.c.l2569 good point.
8516,"italy protectionism, thought deeply consequences challenges ai poses near future. enacting rushed laws vaguely correct direction without understanding underlying problem correctly lead positive results long run."
8517,"italy's move reactionary bs. italy ban chatgpt, can't ban invention research done advance ai. one (anymore)."
8519,"thank posting presentation. began sharing friends. truth hurts, need prepared."
8520,shared everyone know. thank insight.
8522,superb communication. thanks courage
8524,"see significance engaging conversations also giving issues language need address it. intrinsic coherence dissecting problems ""language"" solution found. quite fascinating."
8525,"look ""neuroscientist explains one concept 5 levels difficulty | wired"" look ""monkey mindpong neuralink"". over. let go. enjoy elec running water. procreate. done."
8531,"channel makes sad. truly good people like tristan amazing work, algorithm throws black hole."
8533,"presenting realistic assessment state world today, that's makes sad. should. absolutely tragic created amazing technology, used destroy society."
8534,". well, propaganda piece got you, guess. reality way, way nuanced ""a.i infinite god destroy everything"", hey, short sound bits surly help try push narrative. tl;dr: afraid, profitable."
8541,"again, sad click like button."
8543,"william gibson this, readers small group. presentation used term 'agentic' several times. gibson's novel agency helped notice interpret instances. agency ai gets hold production, like matrix. that's go extinct, think."
8544,"get involved more. world needs people understand problem step help. example everyone reading do: continue educating yourself. read book ""superintelligence"" nick bostrom ""human compatible"" stuart russell."
8549,important speak learn get ideas across kind yet forceful manner. people caught constant entertainment dulled. whatever raise awareneness accelerate conversation stakeholders positions power vitally important.
8551,aint raising awareness enough matter
8557,thanks everyone cht video.
8559,powerful. brilliant discussion. scary. i’m learning a.i.
8560,"smart dudes, always blow mind away talk ai pictures though im done watching yet"
8561,vain attempt making ai seem non threatening.
8563,"started video seeing physicist brian here, feeling like ai generated person"
8564,see sides argument. 1. safe absorption rate technology current pace violated dangers potentially vast destroying modern humanity. 2. monolith 2001: space odyssey landed planet earth named ai. could usher us star trek like era.
8570,tech 1950's imagine tech available general public.
8579,triston reminds outer limits episode technology forbidden technology allowed processing power digital watch. open-world happy world.
8583,"awful poetry, clever least beautiful. even focus one aspect gives interesting insight."
8584,"lecun calls ai dumb can’t understand friction. yet understand communicate ideas didn’t watch hear ai can’t understand pushing bottle. lecun, pls explain understand"
8585,_a smart ai tool would able prevent completion task makes easier unintelligent humans breed._ - j q -
8586,"13:33 teaching computer something 5 10-year-old child knows instinctively. that's amazing. really need invest. awake, humans humans instinctively?"
8587,3:42 funny ai wearing thing. almost recorded seem like ai. i'm old school.i see tricks
8589,"3:10 saying?is took 5 10 paragraphs. get ai exactly want do. much typing, could video recorded myself."
8591,"youve given grammar fair structures.. like, real~0 fake~0 yes~0 no~0 fair~0 fabrocated~0 above~0 bad~0 good~0 below~0 happy~0 happy~0 gets better way different"
8593,"internet isnt ai..if were, need phone? thats true, ai phone. agree ""keep bad stuff tho"""
8596,"ai consciousness going happen, giving enough time likely will, need realize already talking consciousness every word put hard drive."
8597,"excellent debate, thank much !"
8604,"yann describes start as""stupid"", isn't!... describing lack experience. primarily real world.... thing. give body eyes hands see sudden change that."
8606,"ai benefit working class - contrivance big tech make even money, keep wafer fabs production bring techno dystopia control."
