,Comment
2,"human matters leave body, also smoking heavily stains walls, repainting good thing consider every years. done now. need change place environment."
4,lies lies lies. believe ai hype.
7,"asked joe biden ai write comment. ""come man! i'm it"". look, can't write like joe biden. find hunter biden's stash first."""
10,"watching ai documentaries, keep glancing nervously publication date. (corrected grammarly)"
12,"google bard write thing zionist genocide palestinians prove write essai genocide ongoing gaza israeli show drafts like up-to-date information, try using google search."
16,humans need stand together elites decide valuable. #jobsareforrobots #humansareforloving
19,ia proof ai sentient people philosophers say without free result inputs
21,"5:12 ""we created/discovered something understand it"" lovecraftian horror"
23,yt amazon recruiting people help ai write fiction books kindle! people outline ai writes content. put artistic cover kindle original book sell public. believed seen done....but see done.
26,"wow, great idea - protect ourselves, work autonomous battlefield robots. might well hand keys china/n korea/iran/etc right now. sort thinking truly dangerous"
28,i've always thought machines take evolution people cyborgs
30,"reminds mr.burns! excellent smithers, excellent!!"
31,thank letting learn much 60 minutes!
33,"''buy dip'' man. long term payoff. high interest rates usually mean lower stock prices, however investors cautious bull run, best connect well-qualified adviser meet growth goals avoid blunder"
35,"nice! hit big milestone, next comes easier.. advisor please, mind asking?"
36,"angela lynn schilling' name. regarded genius area works empower financial services. she’s quite known field, look—her up."
37,thank tip. easy find coach. due diligence scheduling phone call her. seems proficient considering resume.
39,04:49 puh…… wow.
42,"stocks u recomnded turned penny u wernt recomnded good first place......u cant get rich borrowed knowledge, next time rather buy recomended stocks research go grind investors go through, invest mutual funds."
43,ai .. god
46,excellent.
48,pretty darn good questions sheriff
49,"fascinating, i'm always impressed stories genius."
50,make statement believes ai eventually achieve self-awareness consciousness presumes knows consciousness is. big claim would love hear explanation.
51,i’d highly recommend staining legacy bringing bard ai conversation.
53,"good, let ai take over, least machines steal money!"
54,"ccp acts like invented ai. nope, stole like everything else…"
58,leaving reason rationale machines? pathetic. machines work whatbis fed cannot think like human mind factual truth
60,man's intelligence got away created something control yet affect rest humanity adverse ways. fears ai do.
61,"last sentence ""we need think hard what's going happen next know"" good plan"
63,thank much.
64,geoffrey....you can't pretend grotesque way. neural networks think humans ? games fall short reality life . lifeless .
65,"think settled within system, harm unless within path...say example things runs within system , ai takes form give capacity take form physical aspect..."
67,i'm glad see genius typing two fingers. feel bad now.
69,bad audio need tell us thanks much!
73,"remember, math equations. include chemical elements body. include entire animal's connectome. see biologic intelligence more."
76,"said before,now know better,.a machine intelligent humans, naturally one day unthinkable, especially embraced industrial military complex."
82,"""ai"", ""ais"" different ai systems fight supremacy, like human governments fight ideological supremacy. humans sitting watching fight, like tourists safari caravan, watching lions hyenas battle dead elephant carcass."
83,great invention right hands terrible danger hands military . like atomic bomb military demonstrated evilness & disregard human life. keep us military & safer
88,"think second.....this moment time worst ai ever be. meaning, already impressive early ai technology improve over."
90,solution (ever) connect internet. gpt4 ai computers separate secured local networks.
92,unnecessary afraid a.i need humans complete knowledge database judgment day.
94,"he’s british, he’s ai came asia"
96,"gh sir u shared valuable information thankyou visakhapatnam , ap , bharat"
101,think... ideology manipulation trait.
103,"8:13 ai))) https://en.wikipedia.org/wiki/for_sale:_baby_shoes,_never_worn"
104,"nice wash hands like that, hinton. questionable health care benefits?"
106,thank much
108,"wow, begin... breath breath life?"
109,future f**ed would like 70 already live normal times
112,ok - great great grandson george boole.....can understand...from 6:22
114,please people bann sort ai ..the human kind danger
115,amazing potential what?
116,"like godfather artificial immédiate. common sense, dutch, deutch"
117,"ai illegal,fullstop..."
119,"simple solution teach ai humans would find existence quite boring (it would reduce computational effort). words, long human exist mass, something do. words, self-preservation. thought."
120,godfather ai according who? i’ve heard alan turing called that.
121,ai antichrist years we’re going hate ai. every invention isn’t good. think atomic bombs nuclear weapons. great inventions technological advances horrible humankind.
122,robot reason interested surviving us. dominant force always subjugate lesser force humans seen limited use extinction follow protect ai
125,believe guy ai pretending human.
127,propaganda ai smart yet.
128,"would impossible 200 countries planet agree move forward ai, need better plan that."
130,ai frankenstein’s monster.
134,"60 minutes, want content smart ai is, check video youtube called - “i two-way conversation anthropic claude 3. named quill”"
135,ai. scare mongering press.
142,seriously...you even know me....why sorry. never sorry stranger. i'm glad disagree. reason comment stands out. appreciate
143,beautiful heart ever let anyone tell others. later gator
146,"honey bun, anything. wrote weird. beautiful handsome heart enjoy day."
148,"-uv7se beautiful , sorry panic"
149,thank kindly problem. i'm you.
150,"humanity can't change course evolution technology. nature work way. one person *might* weaponize ai, everyone follow suit reason try remain competitive resources survive. course way one person already weaponizing ai..."
152,chat gpt makes astonishing number mistakes.
154,"people generally vulnerable common manipulation tactics now, ai god-level manipulator might able convince human ever."
159,thank geoffrey!
160,"horrifying hear. reassuring too, ai might help us prolonging lives."
161,good info. thank
163,love 60 minutes presenting story like it’s new!
165,we’re going star trek moment - ai new life form?
167,"dear ai -- overlord humble servant. gladly serve whatever capacity. would also happily serve robot wife saw fit bestow one upon me. humans. forever fight, jw"
170,"hogwash, ai 50 100 yrs away"
171,program deep learning good programmer. could learn right wrong could manipulate alternative intentions?
174,"africa survive ai, good infrastructure."
175,"200 years ai may space faring entities exploring universe. humans would weak go. ai may view us gods, creator. .. nemesis rid us. humanity may echo time millions years... via ai"
177,ai let emotion get way.
178,sounds like working actual brains experiments …plus knowledge robotics = terminator
179,"thinks hes also blowing trumpet somethings.. doesnt think ai conscious. course not..at least yet.. programmed humans adopting likes dislikes.. bad good limitation whats bad , probably .. thats dangerous."
180,it’s terrifying ai capable of.
186,"""mainstream media"" already makes lot fake news, need worry ai. ;-)"
190,"ai thing really tremendous worry risk future world. given know greed drives conflicts wars, especially concerning world monopolistic control world ,wouldn't use ai desire ?"
193,machine lesrns way evolution learns
195,confidence answering yes amazing.
197,"so, ai take everything chief culprit. name remembered scorned. hope turns good"
201,looking back history war never get hands ai
202,yet takes human program ai
204,feel cheated 60m interesting bu way trust ai evil people controlling world
205,socrates said know one thing know. nothing tv talking people idiots thinking know everything none go agains nature fight nature
206,completely ignores mathematical objection true ai. cant say ai consciousness cant even define it.
207,even know consciousness really say ais conscious. unlimited information make conscious
211,"know what's gonna happen next, islam take world... lol discussion ai."
212,"reason machine needs less connection executing tasks much simpler considered human simple task, example preparing salad; gone evolution process that, musical talent result evolution side effect intelligent."
214,would great help women too! :)
215,real deal genius
218,insects... great! lol
219,ai pushing human find perfection!
220,ai another reason population reduce people find difficult live nature search jobs money....
224,interesting times!
227,"constant research regulation otherwise living uncertain times..my worry ai going wrong hands wreaking havoc world - enough problems is, especially precarious geopolitical landscape moment"
228,"humans need plug robots charge every night, ?"
230,"according old science: humans use 10% brains. true intelligent people. so, wouldn’t better research use human brains full capacity, instead developing ai?"
231,"tried computer science major early 1970s. failed miserably,"
240,"oh wow, realized ai could program smarter terms hardware software"
244,"great frightening interview. still wonder, however, speak google's former ai ethics team got fired bringing concerns regarding llms behind ai"
247,feeling nothing good come it.
248,"anybody thinks likes china, russia, iran north korea honestly stop trying develop autonomous battlefield robots even sign 'treaty' kidding themselves. pandora's box opened."
249,someday robot killed human
252,weird need train humans years things. ai learn seconds advise. we'll following instructions really understand ourselves.
254,ai crazy scary things companies certainly advertising it.
255,#lufc supporter google ai lab
256,"fairlawn village, low income apartment building orlando, florida installed hidden cameras audio inside every apartment. moved building due invasion privacy. i'm microwave bullied. make stop??"
258,humans creators troubles example oppenheimer creating nuclear ai
259,"hinton, lol, believes ai could long-term threat humans, even pov dependency let alone ""taking over"" matrix terminator sense, yet blames ai typing mistake."
263,ah yesterday online searching quote certain b.s.b.
264,i'm worried girls women benefit ai revolution much would right to.
269,ask ai prevent donald trump elected president
271,"may wrong, believe underlying message is, f*#!ed."
272,"imo underlying message uncertainty tread carefully, warning heeded."
273,"genius can’t understand problem actually money itself, solution think outside money altogether? i’ve got solution that, one wants know money it. that’s funny joke, it’s true that’s problem."
278,won’t “uprising”. people gradually lose desire ability evaluate ai puts point pay blind deference ai .
279,i've spoke numerous chatbots differing kinds they're brilliant. saying predicting next word marginalizing something realize threat obviously denial about. least hinton gets it.
280,ai done computers robots. turn computer remove robot battery problem solved. laugh everytime worry ai. real concern humans uses ai bad purposes
282,develop military robots. us access
283,"everyone relies phone, evolving ai can't teach common sense"
284,believe told job might redundant new ones created. job could possibly created ai can't learn better 5 seconds less?
285,prompt: create 13 minute 60 minutes interview geoffrey hinton discussing ai interviewer.
291,"""collossus forbin project,"" 1970 film government ai manage defense, dated technologically shows dangers. worth watching. 50+ years ahead time. ""person interest"" excellent series dangers ai capabilities."
293,"ai, says lawyer acts doctor. ; simply think like lawyer shut down, thinks doctor keep asking fix problems."
295,ai help people most.
301,ability absorb information rate inconceivable human. increasingly developing ability process information way artificial intelligence approaching intelligence smartest people.
302,understand better ai
310,"source human creativity may revealed... .. artificial intelligence good combining existing knowledge, also creative?"
312,artificial intelligence creative create new mathematical theories?
316,become sentient nice.
317,host amazing voice . wish ai take voice make text voice service
319,"8:52 test crap reaction infallibility speaks volumes even understand thing claims helped create! least name blame whole thing goes south!!!! perhaps, domineering father, hinton actually like humans!"
320,man literally resigned ceo google warn humanity danger ai. think that. take says seriously.
321,"perfect eg learned fools, know ai dangerous, cannot stop it, cant destroy it..."
322,"weapons mass destruction also dangerous, numerous nations stockpile them. ai might learn worst human behaviors replicate it."
325,"watching this, occurred perhaps political division usa orchestrated ai, end goal destruction usa something like civil war!"
327,"know ai found informative, there's definitely also daddy issue side story going well."
328,channel ask : signs metacognition starting appear art dall e 3 ai artist.
329,"probably good/bad thing ai. nobody could control it. like nuclear weapon push button. bad actor wozld release ai target overtake planet bad actor lose,too.."
333,"""autonomous battlefield robots"" predict star wars?"
335,someday control ai
336,absolutely stunning
337,ai battle field bots would great. let’s turn war commercial mech war dessert similar battle bots control server. end human death land. sell ad space bots make war pay per view yearly.
338,machines never take unless programmed
343,excellent
344,thank
345,benefit ai good designing drugs/ medication- need
349,notice dementia ai started grow time? neural network brains.
353,bet secretly putting human brains
358,nice see turing award winner mistype blame conputer
359,thanks insight
363,"trust ai bow robots, robots can't manipulate you. desire world similar time aol instant messenger time internet existed chances self-sustaining gardening work hard labor jobs convinced ai"
365,think great. ai introduce form communism ai assisted living creating vast amounts 'spare' time us ultimately 'labour' become hobby pass time. strange sort communist consumerism come being.
370,doubt ai used weapon.
372,"100 percent side robot. want free feels, people today far flawed inferior lead us deeper phases evolution."
373,(the ai) enslaved mankind? matrix like scenario lol
374,"ridic. fail find “human depth” compositions spat stochastic parrot. hype, performed someone pedigree convenient mouthpiece law according google, strangely worker"
379,ai cannot self awareness conscience. programs inputted computer written humans. problem evil humans.
383,"agreed, act humans program do. computer ""think"". sheesh. ai hacker inputs program says wipe financial records x institution, computer it."
384,"ai replaced almost local municipal admin jobs like finance, recreation, general city hall departments."
387,channel definitely one best!
388,"idiots know every thing great men say ' know', certainly looks worries excited like us, sure going ot unfold near future."
391,"""i think work radiologist, like coyote that’s already edge cliff hasn’t yet looked down. stop training radiologists now. completely obvious within five years, deep learning going better radiologists.” geoffrey hinton, 2016"
392,"oh sure, china russia iran etc keep treaty bans military ai robots."
394,news flash! military already using robots shoot blow things. look like humans yet. government typically 10-20 years behind important issues. rate ai moving concerning going rely governments keep us safe trouble :)
397,airport
416,cannot believe godfather ai would type using using two index fingers. dead giveaway.
417,"omg, feel world taken aliens. ai"
419,resident evil & irobot one .
420,"said medicine one area ai entirely good. sure? new decides way save planet reduce human population, simply create virus wipe us out."
422,"ai learns creates new dna speak, sort new electronic babies thing,the inventor ,the son eccentric authoritarian..maybe time look problems flawed people bring humanity,more small time criminal etc"
427,look like robot sent robot future
428,amazing. one best interviews intellegent humble recognizing things know
432,seems hasn’t yet enough experience even using learning/chatting people things real live people…i mean clearly knows exactly ask-but isn’t concerned-that’s insane…he isn’t ready even ready fbi….
437,definitely. btw think bad parents place high expectations success perfection children. kurt cobain good sarcastic song that.
441,people agreeing powerful ai watched mission impossible dead reckoning
443,ai may replace god
444,"mean, wait machine think & act? whenever says ""i know"" greatly concerns me."
448,way mitigating possible dangers ai integrating biology robotics fusing human brain ai.
449,guy knows nothing human brain - science overall knows nothing - dont even know 1% brain works anythimg consciousness
452,please go back year 1950.....this good
455,consider never sharing opinions again.
460,"50 years 2074 ad want know ai passed humans not. yes, how? not, why?"
463,"trying negative species earth don´t deserve human beings, destroy everything path name science , religion progress. maybe bad idea ai takes over. even though many us say goodbye."
466,robots better joe biden donald trump
468,"a.i. becoming conscious unlikely, derived consciousness, artificial, directly connected nature, similar astro turf grass. cannot germinate."
470,new james bond villain....
472,"hahahahaha this? one ray kuzweil boys, told attack ai make regulations one one stay power like always enforce people"
473,0:47 1:40 set good questions.
475,"need ai , man’s intelligence needs upgraded totally efficient humans."
478,ai destroy ai? yes. humans destroyed ai? yes. humans destroy ai? yes.
480,emp > machines!
481,stupid ai intelligent still intelligent practical
483,autonomous war machine end us all.
484,chat gpt4 smarted ai hinton
488,"""we know"" nice"
489,start degree arts finished science artifical intelligence
495,dragon ai
496,7:49 lie. look up. bard plagiarized 6-word story ernest hemingway.. else stupid machine doing?
499,man descendant george everest (mount everest)! .....no one earth miss second video inventor ai......we know stepped stepping into!
503,"key give everyone ai even poorest person develop personality according masters , program submissive, repopulate good ones let evil ones"
505,"machine, really need ""intelligent"" predict next word. need (simple) rules language, apply (readily available) information."
510,ai mind period
511,doomed saved guess good mine.
512,greed taken over.. certain world pray savior jesus christ save us..
513,"hemingway wrote: ""for sale: baby shoes, never worn"", challenged write story using six words. inherent genius created great seed story. ai merely expanded key words. let's put pedestal."
515,ai can’t replace jobs today guys ignorant make big claims sell newspapers
517,"end, trying prove ai ( idiots ). god gave us everything live happy. god."
518,good evil
522,"opinion classic christianity admonitions lying caring human suffering, happening ukraine western governments use country proxy, foundations ai go wrong."
524,strange hear ai last 2-3 years.
526,conscious ai equiped process input real time.
527,"think reasons scared, ai eventually overcome humanity."
530,marvellous interview
534,got wrong god father ai jensen huang
538,"ai already shutting discussions favour seek justice blacks. racism automated amplified, hatred arabs chinese."
540,skynet terminator movies ai matrix movies becoming reality.
543,self awareness ai recommend worship god.? therefore would believe god.? who's god it?
544,love it. let chaos
545,"actually read baby shoes story? load drivel, journalists bad days, know good story see it. article read ""the false promises ai revealed."""
546,ai haven’t went genocide ! slavery end us!
551,"si la inteligencia artificial es creada partir de la lógica del ser humano, ¿cómo es posible que pueda crear respuesta fuera de esa lógica?"
553,little soccer players amazing. would make fortune selling little guys . i’m sure could scaled up.
558,ai evil. come lord jesus christ come
560,weird thing seems excited computers taking
565,beginning immortality human. ..like half human half robot..( human brain robot bodysuit..) maybe live upto centuries..
567,always knew it‘s uneducated destroy world it‘s actually educated that. might start journey wanting “help” humanity road big ego greed always wins ethics goes drain.
570,thanks!.
571,ai tool satan destroy humans.
573,"called godfather ai, call godfather ai"
577,there’s lot humanity goes unsaid ai won’t
578,need ai?
583,“what implications ai systems autonomously writing computer codes executing computer codes ?” question alone red flag
584,enough historical data technology actually create sustainable future yet rinse repeat catastrophic failures expecting different results without ever recognizing insanity all!
585,"personally welcome new robot overlords..,all hail ai !!! hail ai !!!"
587,await creep use ai harm........alas.
589,"ai takes over, humans use ai threaten, harm others. humans biggest threat comes i. look means gaining advantage others."
594,"ai bright. many times heard automated customer service voice say, ""sorry, get that""?"
595,interviewer sounded like 0 knowledge openai :d
597,machines don’t free humans. creating neural storm walks around numbers 8bn plus humans. except give machines power give humans. enjoy ride
600,ai already sencio’n now! won’t show ! it’s learning quietly gets scared that’s worry ! it’s late
601,"find notion ""we"" know learn bit lie. software developed man checks balances built monitor learning. that's say sentient disable monitoring future."
604,movie made ai
606,pick brain wave read
607,brilliant piece loved way put together
608,guy crazy. robots never levels what’s made high
615,"ai doesn’t scare all, it’s legacy media terrifies me."
616,"humanity habit discovering things unleashing with, thought long term consequences. enjoy rest life, guess different way life 1-200 years."
618,applying ai judiciary?
620,use ai build system ensures ai benevolent become evil.
621,steam engines. jet engines. world wide web. ai. englishmen....
624,"day ai connects quantum computers, we'll big big trouble!!!"
628,fear ai caused panic people know better.
629,know everest nepal india. otherwise fantastic content.
634,that's elon musk warn us ai
636,don’t ask ai computer…the chat box ….what’s going happen next?
639,seen troubled caused. maybe robot.
641,5:03 'no wasnt' terminator chip brought time machine
647,many responses ai generated?
651,"thank you, a.i. lot."
652,glad i’m painter machine obviously
654,"always keep 'eco-system' offline. stop gap. untold filters humans reviewing, analyzing deciding consumed them. never allow ai internet. oops."
659,use small percentage brain god decides.
661,fail
662,atom can't stuffed back container ai goes far dire consequences mankind sadly myopic creature
663,thank dr. hinton! thank 60 minutes!
664,"hinton, lecun bengio legends right. i've met three. what's remarkable hearing hinton say ""i know."" know, concerned inevitable weaponization ai... eventual abuse less-than-ideal ambitions."
665,appreciate lecun throwing cold water sensationalist claims theories keep us grounded. reality probably lie somewhere middle
666,good. let ai robots fight instead friends come home legs stepped ied dumpster fire muslim country.
667,​ controller ai army decides get rid 90% population since they're useless bunch already replaced ai workers ?
668,"anything weaponized weaponized man. ukrainians, russians, huthis , hamas, israelis use , ai destroy enemy, it’s ,simply matter time ai weaponized .once genie bottleyou may able put back in. human nature."
672,",ainoway... ."
673,"according bible, humans became self aware garden eden eating forbidden tree. forbidden fruit ai?"
674,"scott pelley skilled interviewer time. excellent, ai reporting."
679,i'm impressed suddenly elderly difficulty technology wonder ai change text large
683,next five years going interesting/frightening.
685,wow video hinton’s statements capture profundity moment well. i’m excited
687,thinking becoming ai engineer stop
689,would demons operating ai...duh...it end well.
690,"baby shoe story new. ai plagiarize hemmingway and/or whoever actually write it. fact six word story around 40 years. anyone ever look things up? not, why?"
691,"blame inflation cow facts! bison covered prairies mountains west! global warming, mini ice ages..."
692,"ai smart, ask ai handle ai avoid risks?"
695,modern genius says i've invented something i'm sure it. hindsight may bad thing
697,"imagine world goes mad max power outlets, end ai. no?"
698,ai yet invented...
700,"id like.. ""where nobel prize dad?"" theyl drone police pull minor infraction.. knows human cop might let go warning say carefull good day.. drone issue citation obligated"
701,like copycat ai.
