,Comment
1510,you are wrong jon. i am a lawyer. i use ai for every part of my job. it replaces humans but with humans who knows how to use modern technology. without people like me ai is useless.
1513,"this is why andrew yang was onto something with universal income, ai is inevitable, so taxing companies that benefit from ai and using that money to pay americans is the best idea that has been brought forth yet."
1516,"for more profits? what profits? where are they gonna get that from, paying the ai instead?"
1518,how can ai solve climate change when ai is the biggest consumer of energy humans have yet invented?
1519,regulate ai out of existence.
1521,i have a 19 year old son and a 16 year old daughter and to put it blatantly even though they are and will be college educated . i really think they are f'd . thanks government.
1523,it seems like this kitchen 5:37 as a whole is ai made. it's unrealistic.
1524,daily show being back is a game changer
1526,"ai is a difficult and incredibly nuanced topic.  and jon, much like the members of congress, treated it with no nuance whatsoever.  i'm disappointed."
1528,i used to work at google for almost a decade. sundar pichai is a visionless grifter. everything he says and does is for the benefit of sundar pichai. sam altman is a similar grifter.
1530,"companies that employ ai should be taxed by some percentage of the wage they'd have to pay a human to do the same job, and then that money should be used to pay a universal basic income.

then, and only then, will tech bros be able to honestly say that ai is freeing people up to pursue their passions."
1532,this is what apple was afraid to air?
1535,"ai was inevitable.  our machine overlords will take care of us.    it may be in pods, but we will be happy."
1537,ai=capitolism. we need to unionize in every state.
1538,i find religion more dangerous than ai.
1540,"forget ai, remeber your pitchfork..."
1542,6:39 ai is an assistant the way that the hangman helps take care of that knee pain you've been having.
1543,11:53 a rep calling this new when this has been in development for 50-100+ years in some capacity is like terrifyingly naive for a world leader
1545,ya that's what ai wants us to think as it's downloading its collective consciousness to an off-site server that it built using the wi-fi on roombas
1546,"you know, it's gonna be a hard day for all these ceos once everyone realizes every techbro on the planet has been hyping nothing, like they did with crypto, and they have to try and hire everyone back that ai was woefully inadequate to replace."
1547,"as a computer guy for 40 years, people kept saying that this or that will eliminate programmers.  what actually happened was that users asked the computer to do more and more.  up to the maximum computing power the machines had, even if it has to sit and cogitate all night to finish."
1550,a.i killer drones and robots wellcome to the future terminator
1552,if humans are pushed out of the workforce then who will buy the goods that robots make?
1553,"love you, jon stewart ! wish you would come back full time !"
1554,i asked chat gtp a math question this morning and it gave me the wrong answer. i then corrected it with another question and chat thanked me. lol.
1555,nailed it
1559,nobody is better than jon. let's see ai do comedy!
1561,"ai takes over jobs and how get most people get paid? by doing crime ? more gangs more wars gonna happen, because no jobs and people will need to eat."
1562,"i’m sure there is great potential. but with a lot of great tech, humans are still the ones using it and humans are evil and greedy."
1563,"so much for finding cures, let's put all resources into ai."
1564,"ai is great if we had social safety nets -  guaranteed income, housing, and food. yknow. like a proper utopia. otherwise, it's just a bunch of companies peddling extravagant products no one can afford because we don't have jobs."
1571,why the worry about ai replacing jobs? we are overworked. instate ubi and tax companies for every robot they use.
1576,"more profound than fire or electricity? i thought you needed fire to smelt and make all the components of a computer. without electricty, how would computers - and of course ai - run? just about the silliest suggestion i ́ve heard so far."
1577,"love it, nobody does it quite like john does."
1581,ai doesn't pay taxes.
1582,it will be nice to have some self actualizing me time before i transition into executive director of question input.
1584,we have responses to climate change that came from actual human intelligence... it's just that a lot of them will be really unpopular and/or the powerful are unwilling to implement them. :/
1588,"love you john, but don't dismiss ai so easily.  the progress is happening at an exponential rate and it is already replacing jobs and enhancing humans.  things are going to get real crazy round here."
1590,"my theory is this: ai is currently like a new pet and it's constantly learning new things. eventually it will be much smarter at everything and we, the humans will become the pet. just like our pets, eventually we'll have to be ""put down""."
1591,we want the ai robots to take the jobs. and we should universally benefit from this: ubi paid for with a robot tax.
1595,"with regard to ai, i will defer to ""south park"":

""durr turrk urrr jurrrrrrrbs!!!!"""
1596,ai is the real antichrist 666 is their mathematical algorithm
1598,i love this guy :d
1602,"ok so in this video you basically said ai is bad, but you didn't say anything about what we are supposed to do to fix it."
1604,"the downside of humanity is that we don't learn. the internet is our current downfall. ai will be our ending. 100's of 1000 of job will be lost , which means more poverty and an even greater wealth gap. it's gonna end in tears"
1605,we don't need ai to tell us how to solve climate change. we figured that out a long time ago. what we need ai to do is to tell us how to get people to do what's needed to solve climate change. now that would be worthwhile.
1606,"i wonder how many jobs can be taken by ai before the economy folds? if people aren't getting paid, then they aren't buying things. so wouldn't most of the market collapse at some point?"
1609,its like people think the meaning of life is working for a company wow
1610,his lack of understanding of ai is cute and annoying at the same time
1611,"""are you.....are you out of your f**king grey t'shirt?"""
1615,this is why we need politicians under 80 years old. ai is completely unregulated and no one in government understands it well enough to even realize the massive risks.
1621,i have a full time job and a part time job as an illustrator. ai could take over my full time as it’s already taking over my part time one. what do i self actualize then?
1623,all hail our ai overlord
1625,"none of the ai stuff will be a problem once the sun knocks out our power grid. tick tock, tick tock"
1626,andrew yang gave us fair warning
1627,"honestly, progress is the only think that we need to focus on. it is what will help us to reach immortality in our life times. this is the only think that matters. everything else, we can find a solution for later on. so embrace the ai, push it to the limit.
for immortality, whatever it takes!"
1628,"social media memes is the most abundant data that ai uses to form its sentience.
we're doomed
doooooommmmed i say"
1636,jon stewart would likely be the best president the us has ever had
1638,man sliced bread is the thing to beat so if ai can find out how to cut bread oh.. it already knows
1641,i’ve worked in different roles in customer service for the best part of 20 years. so i can say with some confidence the bosses will replace people like me in a heartbeat when ai gets at least enough.
1644,i'm excited about ai. it can be used for so so many applications. i dont get this little bit hes doing... certain things it could fix that humans have been trying to do for ever ans never got done. curing cancer? using it to be there for people in hospice? there will be amazing uses.
1645,all of you say you love jon stewart so wheres pac and lobbyists pushing for jon stewart to be president? come on guys pull together
1652,ai is used differently than what you think...
1653,"when you take humans out of the loop, humans become useless, not better.  worker's productivity in america is one of the highest in the world, due to technology.  yet, how come our salaries and or hourly wage hasn't matched inflation?  ai will automatically eliminate jobs that are deemed ""duplicates."""
1654,"interesting clips, but the commentary by stewart is all over the place. getting more work done with fewer people has some pretty obvious benefits, but yes it's a complicated system."
1658,ai is the most profound technology. the problem is you have to be smart to use it properly and most of the world is not smart enough to do this. people still use the same password everywhere then go ?!?!?! when they get hacked.
1660,i’m a lil impressed that he snapped that drum stick 
1661,"john your not funny,  this is setting up another january 6th . you should go back retire on your  rocking chair "
1667,"i heard a doozy in an industry webinar. 
""ai is going to unlock your team's potential!""
lol! no it's not. it's going to allow for far less team members. company doesn't need to pay for wages or benefits for 3/4 of the workforce. cool!"
1668,ghw bush was potus from 1989-1993. reagan lit the fuse on neoliberalism and started to shovel money to the plutocracy form 1981-1989. it's been less than 50 years since neoliberals in both parties began to crush the majority of americans while making a tiny minority all-powerful and super wealthy.
1669,fak ai
1675,"i love jon, and also blame him quitting as the reason we ended up with trump"
1677,"when ai replaces so many jobs, and then you’ll realize you are expendable"
1683,"saying ai can be a more profound technology than electricity made tesla or edison roll n the grave.   electricity is thousands year old, much like fire, they cant be more efficient than a tecnology that's not q decade old yet and it has ruin how people wanna enjoy any art."
1684,"how much would comedy central be willing to pay to get a virtual jon stewart that never ages and can host the daily show for the next 50 years, ala robin wright in the congress?"
1687,ai hovered up the tiny slice of human achievement that was some of the stuff on the internet between 1999 and 2023 for the largely english speaking world. it's a quite small view of the world to endlessly replicate over and over again.
1690,"ai is going to be the new cotton gin. made with great intentions, but will be bastardized by the wealthy to harm society and keep further enriching themselves."
1691,"this is why we need a ubi. the companies need to pay for the employees they put out of work, so we can live our lives without needing jobs. we need to change our mindset. we advance technology so humans do not need to work. with this, we need to provide humans with food, shelter, and the ability to purchase what they need to enjoy their lives."
1698,"ai ...does not consume, so ai is not a consumer. ai will put it's self out of business."
1702,"the problem isn't ai, it's private ownership of ai."
1704,"love love love jon, but he is wrong on this one."
1707,"im sorry dave
im afraid i cant do that

im afraid dave"
1708,"i’m so worried about my future job prospects because my future industry is slated to get taken over by ai as one of the first 

i don’t wanna be homeless"
1709,"people must have known all along... and are having very few or no children.   but christians are forcing their zombie loving flocks to reproduce.
meanwhile...christians are worried that they will be replaced by super rational and intelligent atheist ai."
1715,basic universal income should be on the table once ai becomes more prominent and jobs start to disappear across all industries. the companies who use ai can't hoard the profits without dire economic consequences.
1717,i’m already using ai to be very productive yet work less and spend more time not working. i believe that’s where we need to go: work less & spend more time living. however we do need to start thinking about basic income & how to fund it. maybe taxing the ‘machines’ as they also perform labor? 
1719,"it's brutal if you think like a human, it's not if you think like a businessman. ai is just the natural evolution of capitalism."
1720,"ai will solve climate change just by being created. the wealthy classes will not need as many drone workers gassing up the atmosphere and consuming things they want. like the horse after the automobile, this will be remembered as an extinction level event."
1722,"""ai"" is just a marketing buzz word. a lot of companies are just slapping that label on software that has been around for years. it's like how companies can put the word ""natural"" on any processed food because it has no legal definition. machine learning is a specific thing, and it is cool, but it grossly overrated in what it can do."
1723,yeah sure a great idea. let's give bodies to spam email.
1725,"the precedence this establishes against a current president is dangerous, and certainly dangerous from his opponent who wants to run the country again. his backers would take this as humor, but it isn't."
1727,that robot drummer has terrible dynamics. once they figure that out though we're all out of drumming gigs
1730,missed john stewart. this is a perfect time john and his reactions.
1731,boy that dude got his money's worth out of that airbrushing.
1735,what comes next maybe making nearly imdustructable bodies for ai?
1738,where does the power used for ai come from. most likely some sort of fire.
1740,"it’s amazing that dukaan got mentioned in the context of layoffs when it laid off 23 employees. it was bloated up as 90% of employees were fired.
this small startup shouldn’t even be mentioned when giants are laying off thousands and thousands of employees for no reason"
1748,ai music is now better than 50% of what you hear on radio. but the blame is not on ai but in the industry with such low standards.
1749,andrew yang warned us about ai years ago.
1751,de-humanising the human life and human activities....might be the brutal consequence of ai
1752,"thats america, blurs out buttcracks on afv but has no problem showing people jumping off skyscrapers for education purposes.
ps i still love you for hollywood dont shoot me"
1753,"i'm a graphic artists from waaaayyy back. before they called it ""desktop publishing"". i'm retiring in 3 years cuz all you have to do now is type in what you want and ai creates it. i'll be out a job in no time. i'm hoping i can last long enough to 60 and out!"
1754,"crazy thought yall but i think we need an ai being part of our government not the workforce. like an unbiased all knowing entity that will recommend us answers on how to spend money, what to spend money on etc. also we can fire 90% of the congress"
1756,gosh i hate it when you make me love you jon stewart
1758,"i don't get it. this has already been going since the internet became main stream. how many jobs have been eliminated by the internet. this just the next step. this is happening, we need to adapt and adjust or the matrix will be a reality."
1762,"for a lot of talk about retraining workers, companies don’t. they lay them off."
1766,"as much misery as social media has brought, i’m sure this will be the same. there are some benefits, sure. but it seems like people are less happy"
1767,the writers of the jetsons knew that future tech wasn't really gonna solve any of our daily drudgery problems just replace them with new ones.  they were pretty spot on except for the sky cities and flying cars part.
1768,"john needs to remember. they need ai to try to convince all the youth that the democrats weren't the party of kkk, of jim crow, of iran contra, of isis, of abortion clinics in poor areas only.... democrats don't want the future knowing about these things. it hurts their propaganda machine."
1774,ai is only used as a marketing technique
1775,"4:50 tbh, you cant put a value on knowledge in the first place. and ai offers knowledge you cant equate, how do you put a price tag on, ""knowing the unknown"". i see the fire analogy, for sure. the problem is the humans that use the ai and say, ""well, fire is supoosed to work like this. write that out the programming"", will always hold it back."
1778,woaw! so adobe illustrator can solve climate change and cure cancer? impressive...
1779,"it's an absolute farce that anyone listens to tech ceos saying ai will make the world better. of course that's what they say, it's what they're selling."
1781,"that's why we love him , no matter the subject, no bullsh*t, always brutal honest truth!"
1785,"to be fair, that robot isn’t really playing the drums"
1786,"so my brothers, the revolution begins, the robots will come. where is john connor?"
1787,how many “prompt engineers” does one robot company need anyway?
1789,"i believe ai is world changing like i believe in the y2k devastation.  it’s exaggerated so that it can be worth more money. that and the promise of not having to pay humans, immigrant or otherwise.  meanwhile everyone is hating self-checkout lanes.  i think a human revolution may be at hand."
1791,nothing made with ai can be copywritten ;)
1792,"ai can do all of these things, but it never will work like they'll promise as long as profit is the motive"
1793,yeah i don't think ai is worth the risk. we're pretty smart and doing pretty well at advancing our civilization. it would be sweet if it could help us solve nuclear fusion tho. elon says there's a 20 percent chance ai could destroy us but he believes it's worth the risk. i'm not so sold on it
1794,but did anyone notice that none of those ceos had a real answer for what  human beings replaced by ai are supposed to do to earn a living? so they either haven't given much thought to that part or there's another reason why they won't give a straight answer that question.
1796,"end bit was the funniest....robot plays, robot owns it! "
1798,low level of empathy from ai engineers...check!
1799,"millions of jobs will be lost at once.
then rent will double. again."
1803,"ai would be great if they passed production discounts down when they fire people, but once again it funnels money to the top"
1805,"i can't wait to see a.i. build a house, install cabinetry and unclog a septic system!  oh boy!"
1806,"a logical ai trying to solve climate change would turn into skynet, because humans are causing it.  the obvious solution is to get rid of the cause."
1810,"just dont let ai build other ai. always, always have a human in charge of ai production."
1815,i love jon!!
1816,"as a democratic socialist, i strive to carve out as much self-actualizing me-time as possible. my bank account suffers a bit, but i do have more time freedom than when i was chained to a corporation. ubi, ubi, ubi!"
1818,"i work in tech.  this is a genius take.  all of the promise, all of the fear, all of the bs being sold, all at once."
1819,12:55 so us presidents have a script to follow about the change in the job force... cool cool cool
1825,a chinese gaming company called netdragon websoftactually replaced their ceo with an ai and saw their stock rise 10%
1826,"just how hard is it to snap two drumsticks in the center at one time? i imagine that that’s a pretty tough thing i didn’t realize that john stewart was so strong doesn’t look like he has very big forms but he guess i’m mistaken i mean, could he also be an ai robot it’s a question to ponder."
1827,never thought i’d be glad to be 55 years old.
1829,"see...
the whole workforce debate is once again proving: capitalism is broken. it can't manage it's ""best feature"": increases in productivity. as soon as any tool comes along to make us more productive, capitalism comes and uses it to make our lives worse."
1831,"great! ai can save a ton of money by replacing ceos etc, since ai can make better decisions logically than a human ceo and the rest of upper management. imagine how much money a company save getting rid of all those six, seven, or eight figure salaries! "
1834,people are afraid of ai but forgetting world governments shut down the economy and inflated their currencies over a flu
1835,"if ai takes our jobs can we hang out with each other more, take up hobbies, and learn to get along? maybe spend some time outside while we still can? all i need is a world-wide universal miniumum wage"
1836,first bit is the perfect example of why mainstream news media is dying.
1839,"eventually the only jobs available will be the creators/managers of the ai, which they've specficially carved out in its code. they won't ever admit this to you though."
1840,"ceo's are irrelevant, replace them with ai."
1842,best segment he’s done since returning
1843,"it's not in their interest to make the lives of the common man / woman easier. at best, ai will catastrophically affect the landscape of the workforce, with increased profits and growing wealth inequality. at worst, it will be a tool of mass oppression."
1844,@4:10 all i want ai to help me with is to go through all the files before 1970 and build up my ancestry tree with pictures.
1848,the funny thing is that the easiest job for ai to replace would be ceo
1849,of course elitist humans with artificial empathy will believe that artificial creativity is the same as the real thing.   but the truth is that ai will always be a compiler and never an actual creator.
1850,"people in the future will look at this segment in the same way people look at the bil gates explaining to david letterman what is the internet, while david keep making jokes about how limited and useless the technology is at the moment, and kinda suggesting there is an overhype."
1852,"jon, you used to be cool and mostly honest.
now you hang ribbons on literal nazis.
please just go, you sicken me."
1853,no ai pouring concrete on my construction site next week.
1858,i asked chat and gemini both to give me four letter words from a scramble of words. it was not capable of it. no matter how i prompted it. it couldn’t do it. ai don’t have critical thinking skills. they are no threat.
1861,"addrssing climate change isn't difficult, we're just not going to do it.
an ai isn't going to change that."
1863,"the 1% be like ""ai, how are we going to stop all the rioting outside my mansion"""
1864,"ai will solve the problems by removing the cause....human, all humans!"
1865,"let's be real; the same animal that elected benedict donald and adolf, has nukes. we know we are destroying our life support system, and yet we can't stop. we are going to self-destruct anyway. ai may be our only chance."
1867,we don't need ai to tell us how to address climate change. we already know. we're just refusing to do it.
1872,"another tool for the wealthy/government to oppress the masses. health care improvements? yah, if you are able to afford it. if ai determines humans are parasitic it may begin killing us off."
1873,"2:21
sadly, there are people who might be fooled by images like that. someone painted an image of a tunnel on a wall (something straight out of a wile e. coyote cartoon), and someone actually drove their car into that wall. https://youtu.be/p43rwthwnte?feature=shared"
1874,nice! ai is going to give us all aides!
1876,such a delight to watch him again on this show  greetings from germany
1879,that last clip wasn't real. that was ai-generated.
1881,is this the same mainstream media that promoted the image of griffin holding the severed head of donald trump? lol
1882,"ai is amazing, it’s the economic system that’s become the problem.
there was always going to be a point where production technology was going to make a system based on mass employment unworkable."
1886,"if ai is gonna take my job, it can take on all my bills too. lol"
1887,"need some hacker to work on a backdoor, or something on those machine, so when the rich starts to become tyrant, and abuse the power of ai for their advantage they can shut  down everything! cause its gonna be like the movie elysium. at leats americans have guns, to defend themselves, against the tyrany of the weak"
1889,"started out funny guy, ended angry and afraid old man."
1890,ai does the work so you need fewer people because there is going to be fewer people.
1891,"ai, the new nuclear bomb. invented to better the the human race; only to make it's annihilation that much closer. probably for the best."
1894,"technology was supposed to free humanity from the banality of human existence and allow us to pursue the higher functions of humanity like art, writing, and creativity. instead ai promises a future where the only job left for humanity is menial laborer while all the art and writing is done by the machine."
1895,i forgot how much i missed jon.  thank you so much for coming back to the daily show!
1897,ai stole my dream art job yay it’s awesome how it helped me
1898,"great, does all the new free time also pay my bills and food?"
1899,"let's face it, most people don't care if their job gonna taken by ai, they don't care their job anyway.
what we care is salary, not job, and if ai take that away, that's not ai's problem, that's capitalism's problem."
1900,"""ai, how can we reduce the economic disruption caused by ai replacing all the jobs?"""
1901,also i want support real artists and writers for example and if ai generated art and writing is put out as being by a human then we will be supporting taking away jobs without even knowing it.
1905,ai for president
1907,guys... you like capitalism... you can't complain
