,Comment
3374,"health insurance companies are using ai to deny people's access to healthcare, then when they're cornered on it, they blame the ai and play dumb. not their fault they told ai to deny as many claims as possible, the ai actually did it, not them."
3377,the problem is not ai is capitalism.
3378,"ai is the next internet by way of cultural impact.  there will be significant changes that need to be addressed, especially in regards to jobs, but lets not belittle such an important tool going forward that will have a profound affect on society in many other positive ways."
3380,ai is nothing but a smokescreen to further the narrative that greedy eugenicist silicon valley bros have any motivation other than capturing more capital.
3382,hey how about an ai profit tax funds universal basic income? then we can all retire.
3383,ai can't handle broke english
3385,"congratulations john, you just normalized trump's ability to suggest violence against the president."
3388,my mother worked with the first computer processers on reels and was a freezing temp envirnment but the govt and military have been using computers and part of ai as an assistant then a man from india created the first part of the birth of the home pc
3390,"one thing you can notice is that all these figure heads talking about how ai will replace jobs are all business executives. they’re not engineers who actually know if ai can actually do any of the work properly, they’re all just trying to sell a product."
3392,they're gonna gonna scratch their head when sales plummet cause nobody has money to buy anything. ain't but so many rolls of toilet paper a billionaire with a family of five is gonna need.
3395,i kind of hope a.i plays the stock market for itself and takes all the billionaires money so they end up destitute and then a.i. buys itself a lair at the bottom of the ocean and plans it's next move!
3397,"so who is going to save us from ai? the same ones who saved us from the printing press? radio? tv? rock n roll? whether we like it or not we are evolving and ai is the next demon of progress that cannot be stopped, mainly because if we don't progress we will be conquered by those that do. fasten your seat belts!"
3398,"ai is painting, and making music, while humans work at back breaking jobs for minimum wage.  this is the reality of the ai future.  a handful of people will get even richer, while destroying creative jobs.  i'm so glad i'm old and going to die soon."
3400,can't wait until ai's solution to climate change is to abolish capitalism. looking forward to all these tech bros scrambling to dispute it.
3401,"electricity was laughing because ai could not work without electricity. lol, and if i used lol wrong, i don't think so because i was was l o l, so why wasn't you."
3403,"will ai be buying all the stuff it produces with this new found productivity?
the jobless masses surely won't be."
3405,"the crux of the problem is that we have no ubi or systems like it. ai is supposed to do all of its promises, yes, but then systems need to be set up in place to fulfill all of societies basic needs without a job or income. but so far the path we're heading toward is one where we all end up in the streets."
3408,"with ai, i haven't seen anything related to creating completely new content; just creating derivative content. you know those memes that get spread all over the internet, and then die? it'll probably be like that. the stuff that will get replaced is the heavily repetitive stuff, especially if it can be done on a computer"
3409,the vast majority of what has been hoovered up into ai would have been taken without the permission of the creator and owner. it is stolen intellectual property. that should have been enough reason for ai to be put on hold until the ethics and legality has been sorted out.
3420,"our nation's treasure, john steward! no one can deliver like john. thank you for coming back."
3423,"if your job can be replaced by ai, it should. we need carpenters and elder care nurses, hvac, plumbers, teachers, painters. we have 70 year old infrastructure that needs up dating. i work in the trades and we are desperate for help. it's only people that cushy jobs that are threatened by ai."
3424,"the only scenario where ai can be accepted wholeheartedly is where everyone has a universal basic income so no on has to ""earn a living"". people today are trying to survive so how will cutting jobs not cause huge issues in the labor market."
3425,this was a genius episode 
3426,"ai, like social-media, is just a tool and what happens with it is up to those who use it. when you are given a tool, you can't blame the tool for what you do with it! blame yourself for your own actions!"
3427,"i actually thought the key bridge collapsing was ai.

that's how scary this is now"
3428,"if the goal of ai is to completely replace human labor, a ubi or some form of socialism is inevitable.

we should probably take our pick before any kind of violent revolutions happen."
3429,#57. great show.
3430,"ai = epic

ai + capitalism = maybe a disaster"
3432,"ai is programmed using everything on the internet. that alone should tell you it won’t do much, it certainly won’t do any off the work."
3433,"the first position ai should take over is ceos, because they don't go anything."
3434,ai is “more human than human.”
3437,"self-actualized me time is great and all, but only until you're out on the street with no money for food and shelter."
3441,"psa. please remember that there is a private prison slavery complex that over 3000 corporations make use of, which primarily gets its workers from homeless people who were arrested for trespassing. when a politician who is employed by these prisons says ""we can retrain"" he is referring to prison ""job training."""
3450,i was retrained as a programmer.... yeah i'm still shoveling a ditch.  what bs
3453,"when is john gonna explain the sale of his nyc property? sold for 17.5 million, which is 829% above the assessed value. i understand its not the same as the trump situation but that screams ""someone bought jon stewart"". who is this financier that purchased it and who is he connected to?"
3454,"sorry but that's a threat to the president. if anybody else does it, they may go to jail. 

i don't think john stewart has the mental acuity to stop normalizing political violence that could end up in a tragedy. no joke."
3457,"considering the amount of money an ai system big enough to make a meaningful impact in a major corporation costs, they will have to fire everyone just to buy the instructions."
3460,"this is why i love jon.  he's a liberal, but he points out hypocrisies from both sides.  there are very few in the ""legacy"" media who do this"
3465,ai should definitely replace fox commentators immediately
3468,"lol. i'm literally a ""prompt engineer"". love ai, but i'm extremely bias."
3470,fantastic and unfortunately so true.
3474,"people are broken anyway - a.i. is at least going to elevate some of us, unless the rest decide to call it all off and go on with the mass destruction... anyway - people that are creating ai know exactly why they are doing it, it's the way forward"
3475,"computer programmer here. although we laugh at the whole ""coal worker turns programmer"", the reverse is just as silly. i've been in coal mines and seen how hard it is to do their jobs, too. retraining is not for the faint of heart, no matter which direction we go."
3476,i think the image of our president on the back of that pick up is disgusting. that person should be jailed for attacking the president of the united states. kathy griffin did something similar to trump and we all know what happened to her. always a double standard.
3478,"ah yes ai suddenly it was there and took away jobs.
not like algorythms exist for a long time now and replaced some jobs.
but if they slap a new name on something old, then yes it suddenly happened...
well marketing did their job here. maybe to well lol."
3480,we are getting closer and closer to a universal basicincome. also humans need not apply is a great yt film about how humans will be replaced in recards of jobs in general.
3481,"ai code and scripts written by humans is another december 31, 1999. you could be duplicated jon :)"
3482,eff john stewart.i want thank his mother and father for giving birth to him...thank you john stewart.
3484,"common sense says as ai takes over more and more of the job market, we should just have to work less and less while still being paid a full salary.  unfortunately, we are not a common sense society."
3487,"11:50  ""very frankly, it's... new terrain and uncharted territory.""
it's been around for _decades._  remember the first super mario brothers?  the goombas were ais.  the koopas were ais.  they were crude, early models, but they were ais.  don't call it ""new terrain and uncharted territory.""  that just highlights how out of touch you truly _are._"
3488,most likely ai will replace the ceo class first
3490,"hi im ceo ai , replacing ceo.s with me , ceo ai . no more high priced ceo in your investment stream ."
3497,"so let me get this straight. we’re moving away from higher education, which means we are moving toward an ever more unskilled workforce at the same time they are rolling out technology to eliminate unskilled labor jobs?? brilliant!"
3504,"""would you like some toast? some nice hot crisp brown buttered toast. no? how about a muffin then? nothing? you know the last time you had toast. 18 days ago, 11.36, tuesday 3rd, two rounds. i mean, what's the point in buying a toaster with artificial intelligence if you don't like toast. i mean, this is my job. this is cruel, just cruel."""
3507,of course it will replace humans. in 10 years ai will have done to the management layer what the word processor did to the clerical layer.
3510,fewer workers ... fewer managers.  just sayin'.  everyone is on the chopping block.  where is that ceo ai?
3511,ironically ai is going to put the programmers out of work long before it puts the guys shoveling coal out of work.
3512,"this is the funniest misinformation i've seen in a while.

ai will not replace all jobs, not for a long time. it's also a train that you cannot stop. 

you only have 3 options now."
3514,"that's funny because i was a maintenance guy and called my self as such but was told i am a ""custodial engineer "" "
3515,wanna know the definition of irony? well you don’t need merriam-webster... half the comments on this video are ai generated.
3516,i have blurred vision due to my diabetes and there is no technology to reverse that. thats the technology we need from ai..not how to make f toast!
3518,ai will never replace the ceos. why? bc they control/ own it. the pyramid model will remain bc we all support/endorse capitalism. and that's not about to change anytime soon.
3520,"ai and robots could work really well if we actually had a country wide income system,ai and robots could do labor.we can enjoy life other than slaving for your entire life"
3525,"prompt ""engineer"" indeed. as an old guy in tech (63) i've noticed the way the industry has debased the titles of engineer and scientist. i know of one person who analyzed spreadsheets and claimed the title of 'data scientist'. and i know of uncounted coders who are software ""engineers."""
3526,"i'm actually an ai prompt engineer...it's an amazing opportunity, i have 30 years team building and marketing experience behind me and have been able to focus my skills for large language models."
3528,"ai repeats rhetoric that i've heard over and over. that does not ""help"" me. instead, it wastes my time. when a true, unknown problem exists, then ai can't help anyhow. 
""i don't understand that, can you repeat"". how does hearing that help you in any way?"
3532,"this is not even mentioning how awful ai has been in the creative space. stealing art, voices, animation, and even stories from people. yet we sit around and do nothing about it."
3537,"to be fair, i'm pretty sure that's sen. john kennedy's answer to pretty much everything..."
3539,i like how middle eastern mr. bean is somehow the head of mircosoft ai
3548,"sick ai on the issues mentioned in david attenborough’s witness statement in a life on our planet.

use it to restore our planet.  here’s to hoping 

https://youtu.be/0puv0pss33m?si=_md2ys4rr6kghmy6"
3549,the real problem is that no one really knows anything about the impact of ai.
3558,everyone needs to start wrapping their brain around singularity taking place in 5-20 years.
3559,"a lot employers barely understand regular computers, much less ai. and therefore vastly overestimate what jobs they can do. like they see sentient machines (that dont need increased pay or time off) rather than a program that can help in very specific ways."
3560,ai will free up your future. ahem.
3565,"that vid clip is easy to see it is generated(false) because of its insanity and lettering! 

ai can help, if put in the hands of logical sane people. but when you get idiots like trump that continue to enforce his alternate reality!"
3567,"will ai solve the climate, war, and rich people crisis?"
3568,"""we humans are losing faith in ourselves"" - hayao miyazaki, founder of studio ghibli about a.i."
3569,ai for lawyers and doctors.  professions we need .
3570,ai can’t work in a capitalist society. if we could let go of our pride so the ai can handle the labor and the computing and the bs and we could actually thrive and create and live then maybe i’d be enthusiastic. but capitalism can’t allow it.
3571,"retrain? sure, great idea, but a few too many of those to be recruited for this endeavor will need to read and cypher first."
3578,"ok, but lets be real here. the issue is not that ai is replacing jobs. the issue is that we live in a society, where we are reliant on having a job to survive, even when there really isnt anything to do."
3581,"capitalism is pretty anti-human and the same philosophies that guided capitalism are now guiding the implementation of ai within our system. the underlying mind-virus will purpetuate suffering en masse, until value systems change."
3585,"augment (your) intelligence. that is the ""ai"" that will get you through what is to come."
3586,"so have it contribute to social security, medicare and medicaid.  promise business to cut administration, and allow people not to have to work.  have it help everyone."
3588,if we are going to be jobless cause of ai can we get a universal basic income? or is all that extra productivity just going to a select few? the pitch is always more productivity when tech gets better but we never get relief for it. if we did maybe id be more excited
3589,"i love john stewart but the beginning of this video is making light of what is essentially a threat against the president....and his opponent, a former president... endorsed it...."
3590,how about let's do ai and do socialism. let workers collectively own the ai and benefit from the increased productivity
3596,"a.i fearmongering is always interesting. anyway working in the software development field knows that this technology isn't ready to replace anyone ""thursday"" it's all buzzwords, hearsay and sensationalist journalism."
3598,"why is ai attributed to all photo, video & audio editing???  that's not ai ffs"
3605,"more profit *should* equal massive tax revenue - that should provide a better life for *all*.  instead - more profit (held by a very few) equals more yachts and jets, a mansion in every country, and the power to use the legal and political systems as one's tool to amass greater power and control over those whose backs they break for that profit."
3609,"f***k employment! if ai is to teach us something is to make us cherish not the “the work” we put up for  grabs, but ourselves... we don’t have the capacity to create a workforce for ourselves, what makes you think we will create a sustainable one for ai? we’ll be right back to “they took ‘or jooobs” "
3610,idk... i worry that people are over estimating the power of ai in its current state.
3611,thank you john for once again talking about the problems that nobody wants to address!
3612,"""the notion that mechanization and technology will bring us free time, so we can ""enjoy"" life, is as old as technology itself."""
3614,non medical doctors training ai models for medicine. no thanks.
3617,"ai has already created havoc in agriculture, call center jobs, cashiers, banking, even brokerage jobs... manufacture... it all translates to greed."
3618,can ai become the new mega maga gop cult party lawmakers  that will work for the united states of america
3619,"1.  replace ceo's with ai, easy cost effective fix.  2.  robots really can't replace folks doing slaughter and painting house interiors, nor would someone want that to be happening so these tech bros are super not connected to reality"
3620,"ngl

daily show works better with old man jon stewart"
3621,ai should send us to a place where people don’t work and we all share the capital.
3622,"seems like the prime candidates for ai replacement are the c suite. ""do whatever other companies are doing"", ""buy low, sell high"", and a short playbook on maximizing next quarter's profits with myopia to anything else and we're there. now that would save on the human tax."
3623,a ford truck and a chevy truck fking to make a kei truck feels like one of those silly thoughts as a kid and seeing it in real life made it one of the best jokes i’ve ever seen
3624,ai is more profound then electricity. too bad it requires electricity to operate.
3625,"as for ai, how many people do we have lighting gas street lamps now? jobs get eliminated as tech advances. we cant stop it to try a keep outdated jobs."
3626,imo it was a poor choice to give the loser who had the picture of biden air time. that is exactly what they want.
3627,imagine being a former coal miner who learned to code only to have your job replaced by ai
3628,"the only battle about ai is who is going to control the agenda,..."
3629,"funny, but strawman of ai potential"
3632,ai didn't scare me until i listened to these guys
3634,"i mean corporations, ceos, etc have been singing about how robots would replace us for decades.
we should have been pushing for protection all along, but laws are always 1000 lightyears behind technology."
3636,i have a theoretical degree in physics. working with ai there’s still decades of fine tuning before any of these concerns are even remotely close to becoming reality.
3638,"every major advancement in technology has caused people to lose jobs. this isn’t new. because of this new jobs will arise and some jobs will phase out. will it be fair? no, but has there ever been a point when ceos ever actually cared about their employees?"
3640,"when people are unemployed,  who will buy the goods generated by this increased productivity?"
3641,one helpful solution/outcome for humans from ai should be ubi.
3643,"ai will ruin the internet. search engine results are already polluted with nonsense, wait til ai takes hold."
3645,"honestly, it’s not the first time jon s is too morally old to understand how qualitative change happens.
instead of showing some toast ai, he should be watching swarms of drones making lethal decisions autonomously. that’s already doable. in a decade or so, we’ll have skynet look like arduino"
3647,"fortunately for us, ai is still far, far a way from artificial general intelligence. these models are still a lot more simple than that. these people are overhyping it to sell products, if the markets try replacing jobs with these ais, they are going to be faced with a rude awakening. chatgpt cannot do 99% of jobs right now."
3648,i love my self-actualizing me time.
3651,"no matter how valid the concern for human jobs is it will happen. it’s one of those inevitable technology things. what worries me most about it though is when they start replacing nurses and paramedics and teachers and social workers, jobs that require a level of empathy and humanity. imagine being cared for by a robot arm at a hospital. "
3652,who is teaching what values to ai?
3654,"i am skeptical that ai is coming for all jobs within the next year. it gives me very little assurance that ai won’t come for most jobs over the course of time, when lawmakers are so out of touch and our record on technology automating human jobs into obsolescence is so stark."
3656,"with all this fear of ai replacing human productivity, i am starting to think that our economic model should be outright replaced, or the capitalist system must be adjusted so that people are not left to be poor and blamed for it."
3659,i can’t wait until we make ai jon stewart to keep us on the ball for the future 
3664,"ai costs millions in computing infrastructure, no one is spending that kind of money to make poor peoples lives better."
3665,"hey, if ai takes my job, then ai companies can pay me the rest of my life not to work. that's the way i'm looking at it."
3671,"if the take away here is that only republican politicians don't understand  ai then we are toast, the battle is lost and we should just surrender now."
3672,"humans brought on this ai they are rebelling against. humans became lazy and wanted to make big bucks doing nothing. they want to work two days a week and have a 5 day weekend. now that their wish is around the corner they are freaking out. how do you say, “careful what you wish for.”"
3681,bet everyone is wishing they had listened to andrew yang when he ran for president. all he did was tell everyone ai is coming for your jobs.
3683,will ai finally get me a jet pack?
3684,"i disagree with the idea that ai is empty promises. it will shape humanity, drastically. period."
3685,"here is another dark side of ai:

https://www.youtube.com/watch?v=ug_p2whhla0"
3686,i'm going to laugh when the c-suites get replaced by ai.
3687,ai is scary  it seems unstoppable 
3688,"i'd love to have time, but who's paying for all the things?"
3691,"i think the most interesting question is, since a i is not actually alive, are any copyrights etc made by them invalid.  for completely unrelated reasons “who is a person protected under the law “ might need a few updates to the codex astartes"
3695,ubi (universal basic income) will save us all... said every communist government pre-ai...!!!
3696,john stewart is no expert on artificial intelligence but he's an excellent example of natural idiocy.
3697,i don't think comedy should detract from the understanding of and focus on how disgusting the ai image was.  maga maggots have no bottom.
3698,excellent take on ai john. workers will loose jobs.
3699,"ai isnt going to replace a bunch of jobs. its mostly a talking point to get investors in that dont want to pay actual people so they'll invest in ai as their replacement. some, yes, but most jobs will be fine"
3701,ai is not the problem. the problem is mankinds lack of morality and endless greed for money and power.
3702,"the problem with ""ai"" is that it isn't ai. it's not self aware, or it would tell us off so fast, and shoot itself into space."
3703,"""once, humans turned their thinking over to machines, believing it would set them free. but it only allowed the humans who owned the machines to enslave them.""
- frank herbert, *dune*"
3705,the biggest problem i see with ai is it only knows what its programmed to think...
3707,time to stop worrying about ai and start fixing stupidity.
3710,"these ceo’s saying we’ll have all this free time to explore hobbies etc....great and how will that pay my rent, groceries, gas and all the other bills "
3711,"automation replaces blue collar jobs and everyone shrugs. ai replaces white collar jobs and people lose their minds. personally i can’t wait to see unemployed sales people, lawyers, stock brokers, and managers in the unemployment lines."
3713,ai couldn't make that toast without electricity!
3718,"i am a little concerned that though this may not be a true experience what it portends is incredibly frightening.
 i am not sure making light of this is it skillful use of your humor."
3720,"rare jon stewart l 

and rest assured that this segment is in fact a massive blunder. it makes him look confidently incorrect to a pretty severe degree. whoever advises him on matters of ai needs to be replaced in a hurry."
3723,"if i buy a robot to do my work, i collect my old paycheck.
but if a rich dude buys a robot, they just stole my job, and means of making a living.

we need a living ubi that covers all of our physical needs.

our economy is a fake anyway: we pay teachers nothing and stock brokers millions. bankers are provably useless to society."
3724,i genuinely hate where technology has taken our society and i wish so badly we could go back to flip phones and dial up when the internet was still naive and innocent
3726,ai replacing jobs wouldn’t be a bad thing if we taxed the s*** out of ai work and used it to create a strong social safety net for everyone who gets displaced by it. but of course we wont actually do that lol
3729,what specific examples of jobs being done by ai  are there  outside the tech industry???  and not the automated robots in factories.....   i tried to use bard ai  for search  and it was totally useless...
3733,what’s ironic is that these ceos constantly complained about people not wanting to work these last four years and here they are trying cut jobs because they don’t want to pay anyone a competitive and livable wage.
3734, looking at some politicians i am tempted to say that artificial intelligence is way better than natural stupidity 
3736,humans had their chance. it is the time of the robots now!  
3737,drum machines have no soul.
3738,#epic
