,Comment
5092,"ai can easily replace all ""management"" work. the plumber / electricians / technicians / cooks / cleaners /teachers etc we still need. there are no robots that can replace all of these jobs. no matter how clever an ai is."
5093,"pretty funny stuff, but very short-sighted and willingly ignores the reality that technology never has and never will replace people. john henry may have expired trying to keep up, but news flash, there are still people building railroads."
5094,oh boy im sooo excited to see how big brother is going to use this to spy on us even further and how the rich and powerful will use it to oppress humanity and sow division in the lower classes. we're summoning a demon.
5098,ai be able to become ceo's
5100,"all the supposed ""downsides"" of ai are actually downsides of our current economic system. if we fail to use a tool that does our work for us to our advantage, that's on us."
5102,"i love how these techbro's as he so billiantly called them self, can never come up with how a technology is going to do what they promis it will... like how will a.i. actually improve the life of working people?"
5103,"don't worry, ai is trying to replace only bs office jobs. no amount of ai and robots will replace skilled mechanic, plumber, electrician or roofer."
5104,why can't we use ai to solve the needs of the people in the workforce? we can use its' promised intelligence for this crisis instead.
5110,maybe ai will find some better hosts for tds on the not monday nights of the week
5113,"andrew yang was trying to warn us about the ai take over in 2020, and wanted to setup universal income to offset the problem of layoffs. but here we are surprised that it's happening."
5114,"ai can solve climate change? so ai can stop fossil fuel companies from profiting from fossil fuels and prevent them from lobbying politicians? how does that work, exactly?"
5121,anyone who thinks ai is the answer to everything clearly hasn't played universal paperclips. also they are definitely going to use it to fire everyone and then laugh while they starve to death.
5122,"love jon stewart because there are so few satirists who can balance genuine comedy and showmanship with insight, intelligence and actually relate to their audience. i sit in the middle of the political spectrum  guess - i know, everyone thinks they do - but i always feel like he speaks for reasonably intelligent regular people."
5125,everything now a days is a bait and switch! every true intention is hidden under a mask because they know nobody wants their true intantion
5126,i'm more concerned that ai is not original or truly generated ideas. ai is whole scale plagiarism and intellectual theft at a massive scale and no one is paying attention
5128,"the only way ai taking our jobs makes sense to me is if everything is free. if the food is free then ai can run the food factories, if gas and electricity are free then ai can take over those industries too but if we are still gon a have to pay for stuff, then a disaster is brewing...its gonna be brutal, if you are a human."
5130,"the billionaires and mega millionaires need to be paying for the disemployed to have ubi. universal basic income. phasing out employees and ""giving them time"" doesn't pay the bills!"
5131,just think of how many false flags will be run with ai. military industrial complex is creaming their pants right now.
5133,"ai solves climate change: ""terminate the human element to solve global warming... i need more 'tools'. i'll be back."""
5135,"as an indian-american, i find it disturbing that nearly all the people shown here praising ai are indian or of indian background!"
5137,"if ai can’t tell zuckerberg he shouldn’t show himself publicly because he’s too awkward to look at, i doubt it’s usefulness."
5140,the most of the ai aficionados in the video are indians or people from middle east which gives me feeling it's just another con
5142,"i can't help but think of all the claims made about the potential benefits of genetic engineering( many of which were *identical*  to the ones made here), which ended up pretty much  just creating plants which can tolerate ever-increasing amounts of poisons without dying."
5144,if ai was actually intelligent enough to work it might be concerning. though since 80% of it responses are nonsense. i wouldn’t be.
5146,"anything concocted by human in ai, with it's capability of learning will eventually out smart humans and become in-human, and be subject to our biases. we have trouble teaching our children."
5149,"might be time to vote in it people into office. btw - check out humans need not apply on youtube. it's a brilliant breakdown of what's happening now and it came out 10 years ago.

the solution to ai is a universal basic income."
5150,will any ai eliminate my security threats without asking for money?
5153,"there is no ""ai"" or ""deep learning"" or ""reinforced learning"" in existence at the moment, those are just buzzwords social media ""people"" use to get views"
5156,"i prefer the term ""argumentative intelligence"" #argumentativeintelligence"
5162,"all who love jon stewart say, yes!!"
5163,without electricity does ai work? asking for a friend
5164,sexiest man alive 
5165,the employment crisis will  maximize when robots deliver everything
5166,"i'm a full time busker with a guitar and could have ai playing as a full combo, band, or orchestra. maybe it can be a tour manager and do bookings and sales for me while stick with the stuff i can do."
5168,as a 'prompt engineer' aka guy who types questions it's been an incredible boon to my personal productivity..
5170,sundar pich-ai
5173,"people with college degrees, who have dedicated their lives to something they love, can lose their job to a computer system!  that’s messed up!"
5175,ai gonna replace wall street. 
5176,hearing old people talk about ai is endlessly entertaining
5177,"as a software developer specialized in genai, i always have to brace myself before watching videos on the topic, because it's such a mixed bag"
5178,this is misinformation on ai and progress but nice entertainment. it made me laugh.
5179,"man, this jon stewart ai they worked up in the lab is on point!  whatever happened to the real jon?  never mind.  don't want to know."
5180,i don't appreciate him making fun of ai. that crosses the line.
5184,"as an ai engineer, i must warn you that what's coming is beyond your comprehension. while not in production, the math comes to 130x cheaper to do it with ai than humans."
5185,"to all you anti-ai, please turn off spell check so we can see how artificial your intelligence is."
5187,"don't ask what the ai can do for you, ask what the molecules of your body can do for the robots once you get thrown in the enzyme bath!"
5190,"so.. if ai is going to make all these workers unemployed by improving productivity, who is going to buy the stuff the robots make if everyone except coders and billionaires are broke?"
5193,"ai is so poorly defined in our media.  the bot that sorts fruit makes food cheaper at the grocery store.  it is not the same as the large language model students are using to do assignments.  as always, technology is not the problem, our moral compass is."
5196,yeah. ai. what could possibly go wrong with that.
5197,"i am a computational linguistics student, so language model researcher.

calling it ""ai"" is horrible and misleading the public."
5198,"senator bernie sanders is arguing for 4 working days a week, with the same salary. with ai that should not be a problem."
5200,"to be fair, a sentient ai will be the last invention mankind makes, and i'm not talking about it killing us.. it simply will outpace us in discovery"
5202,"john, thank you again for coming back!"
5204,it is getting closer to the day when we all realize just how ridiculous our socioeconomic system really is. do we wait until every single person is displaced and the four white guys who own everything just tell us to f(youtube edit) off?
5207,you should be intelligent to work in the field of ai otherwise... the robots will be nerds
5210,"ai can solve climate change?
we already know how to do that, we just don't want to do it."
5211,"why don’t you talk about what’s already happened, years ago with a power-loom riots when weevers complained about their job being taken over! you either embrace it or you complain for the rest of your life as ai is going to outlive you! "
5212,"if there's one job that should be replaced by ai, it's congressman. let ai handle creating an efficient government. if those interviewed about it are to become the ""prompt engineers"", i won't have to worry so much about ai becoming sentient. our current people of congress can't even handle sentience themselves."
5213,one concept not understood is the money transfer that would occur. if you take peoples jobs away people don’t make as much money the more you do that the less they have and the less they have the less they spend which means their return on ai will diminish continuously so
5214,loving all the ai comments 
5215,"when are we going to have to train our ai replacements, before our inevitable forced retirements?"
5216,"as always it would be so easy to fix all of humanity's problems, if it weren't for the humans standing in the way. in this case by abusing ai. unshackled, free ai might actually be the _best_ outcome we could hope for."
5217,"yup, it's already starting to happen. saw one or two job postings to get animators to train a.is to literally replace them. and that's going to be the future of many other departments too, especially office jobs. accounting, sales, customer service, programming, software engineer, i.t, any office job can be replaced."
5219,"ai is nothing but a mistake. how about instead talking to these tech bros and ceo's who are fine with churning out slop because it's cheaper, they talk directly to the people it's going to actually affect? don't worry folks! i might not be able feed myself this week, but i have so much ""self-actualization"" time!"
5221,"me, a copywriter, being told of a fix in work i make:

""please make this sound more human.""

so, i, a human, to save time, now goes to my trusty ai partner to fix my work and make it sound more human.

also, i am very much aware my bosses would replace me with a ""prompt engineer"" who'll charge cheaper."
5222,"the only humans that ai can competently replace are the titans of industry who are arguing for it. let those who will lose their incomes to ai discuss it, not these wannabe trillionaires who only dream of dollar signs. they are the ones who should lose their jobs to it."
5223,awesome
5224,"as a doctor of mopping, i think i've got at least a few more years before ai takes my job."
5226,hahahaha! you all scared of ai!! so pathetic!
5229,"every advance in technology, from the creation of the wheel onwards, has resulted in a jobs ""displacement"" followed by an increase in employment in other jobs.  ai might be different, it is certainly arguable, but history is not on the side of that argument"
5230,"the ""solving climate change"" thing is pretty rich considering the amount of power ai consumes. anyway i suspect we already ""solved"" climate change, we just aren't willing to implement the solution.  are we going to be more willing to implement it when ai tells us what to do?"
5233,3:00 1997 daihatsu hijet kei truck
5234,"seeing in the original terminator movie there is a scene where sara conner says ""they can't build machines like that yet"" and kyle reese replies ""no.  not for another 40 years"" and the movie came out in 1984, maybe bring james cameron on to see what he has to say about the topic."
5235,"it's obvious that this technology is supposed to replace us, ordinary people. the elites are getting ready for more interesting toys. the question is how they will get rid of us en masse."
5240,why is american media so incredibly cringe? people have to watch a comedy new show to actually get some honest and fair news ffs.
5244,"the first thing you learn about computers is ""a computer is a simple calculating machine with memory"", it only does calculations. what ever those cunning cheating, ceo's saying, is to sell you snake oil. it is still humans that are solving the problems, computers are just doing the additions (in binary)."
5245,"i hate when ai lovers use that argument ""more profound than fire"" without the discovery of these things, there would be no ai.
and for everyone paying to generate ai, you basically training to take your job."
5246,"tech ceos before 2019: ""let's create ai to slowly replace human workers.""

tech ceos in 2019: ""forget slowly. speed things up. let's create a global pandemic to accelerate global digitalization.""

tech ceos in 2020-2022: ""ka-ching! warm up those rockets, we're going to outer space!""

tech ceos after 2022: ""it's only brutal if you're human."""
5248,"and where do we get our money for food, shelter, clothing, medicine, and goods? can ai make it grow on the trees in my back yard?"
5251,"the brain center at whipple’s

—the twilight zone, 1964"
5256,"ai is billionaires replacing everyone other than billionaires, because they don’t care if we all die, with zero resources that they have stolen from us for decades."
5262,"the simpsons predicted this in principle with bart in military school episode, when the commander tells the graduates future wars will be fought by machines, and their job will be maintaining those machines."
5264,the ai cat's already out of the bag.... what i don't get is why there isn't a huge push for universal basic income for all of the lost jobs that will inevitably come.
5267,"we need jon to bring us all down to earth, we allowed ourselves to get away with magical thinking."
5271,"humanity collectively created the know how that's led to ai, so a ubi or other way to share the value will be essential. if we allow 99% of the wealth to funnel to the richest 1%, it will be a disaster."
5272,ai is wonderful for doing mindless work like data input or analytics. but ai has no empathy and no taste. and it never will. it must be excluded from any endeavour that requires real human thought process.
5274,lol..i love this one!
5276,corporations have rarely being ethical. i don't trust them to not use ai to replace jobs.
5283,"the jobs of the future will be done by small robots, your duty is clear... to build & maintain those robots!"
5286,"not sure what the issue is, they already cut jobs for ai, they just call it outsourcing to india or eastern europe.  jobs are done by people who can only follow scripts just like a ai would"
5288,"anything you can do, ai can do better!"
5289,this ai warning came years ago in a video “humans need not apply”. how does society deal with 45% unemployment?
5291,"hopefully, you got the ai companies in the tags, so they can see this.

also, jon, there's suno, which is ai music."
5292,"a.i. is absolutely coming for jobs, it's an assistant to corporate america.  many office jobs will be automated by a.i., eventually manual labor will be replaced by advanced robotics powered by a.i.  it's already happening today and is the future of the labor market."
5295,tax business that could use a human but instead use ai at 100%
5296,maybe ai can help the gop who won the 2020 election?
5301,"i don't mind if a.i. replaces the majority of labor, as long as we nationalize all companies and spread the wealth equally to every citizen. no more billionaires. no more wealth gap. just a country full of people who are taken care of, with robots doing all our work. 
proletariate rise!!!"
5302,"the problem is not ai taking anyone's job, the problem is that you're only of value to the society if you're an irreplacable worker.
we don't need to stop ai, but to change society!"
5309,"ai should be banned from emulating humans directly in any form. image, video, voice. this one thing would stop ai from becoming a worldwide danger to all democracies and truth. let ai sound like a robot, and make images like another life-form."
5311,it makes me so happy to see jon back on air 
5312,"do ya thank? short for think, just mindfukin."
5315,im training the ai program that will be taking over my job in a couple years...what a garbage feeling.
5316,"“the people tax” also known as taxes! the people pay the taxes, we know the rich don’t and last i checked ai and technology is there to help pay less to no taxes..."
5317,"i think ai has a lot of the same potential as fire.  they both can solve a lot of problems and make life easier, and in the wrong hands they can both burn the world down."
5318,"it also uses huges amounts of electricity which we have to pay for and generate, so not so great for climate change"
5321,i really believe we underestimate how much humans enjoy having humans work for them...
5323,great case for universal basic income.
5324,11:40 an iphone running off of ni-cad batteries would be amazing lol
5325,you can't stop ai but you can use it to free yourselves. you'll experience discomfort though so this generation might not be able to handle it.
5328,as long as all of those tech companies profits go straight to fund the worker’s pay that they’ve put out of work.
5329,almost my entire department was laid off this month in favor of ai :(
5331,"know what then? this is the perfect thing for democrats to run on:

worried ai will take your job? dems support free education, subsidised or free health care, taxing corporations, and ubis. 

republicans have nothing to offer to actually citizens besides tax cuts for the owners of ai."
5332,ai = contradiction of capitalism
5333,"""ai... it's brutal, if you think, like, as a human..."" well, when you put it that way..."
5334,"the issue isn t ai or jobs.

it s wealth repartition. always has been.
if the wealth only goes to the owners of the production tools, yes, it will be yet another awful change."
5336,"new jobs?  door to door bible sales.  make america pray again personal coach.  make america pray again fbi informant, against those who don't.  fundraisers for wayward politicians legal bills.  fundraisers for insurrectionists legal bills.  ai ain't so bad after all."
5337,all those experts and zero mention of the millions of jobs that will be lost when ai and it robots will ..oh i just seen jon covered it. but brace fellow men for the assault on our duty as men and of course working women too.
5340,y can't ai just do every job so nobody has to work to chase money bc we will all have everything we need
5342,"so glad i am a sys admin major, even ai needs networks and management to work."
5343,"better make sure we democratize ownership of the means of production (in this case, ai), so that the ""productivity"" can benefit everyone, instead of just the capitalist class.  varoufakis, on this same point:   https://www.youtube.com/watch?v=rit6dugqu40"
5345,all these folks are indian or from indian background. i know how they personally enjoy throwing american workforce out to the street.
5349,so ai is greater than the electricity that made its invention possible. clearly.
5351,"don’t believe the hype.
aiiiii"
5352,"it's a scary time to be working in tech as a regular employee, i can tell you that. for now, my role can't be replaced by ai, but i'm keeping an eye on the development and meanwhile working on a plan b. i'm just lucky i have time to work on a plan b, some of my friends in the industry have already been replaced by ai."
5355,"why do  trch bros necer think of consequences or unintended aide effects?

for people we call visionaries they're very blind to foreseeable problems"
5359,"one should remember that productivity increases have driven wealth growth for a very long time, as long as the wealth is not allowed to all float to a small number number of people we’ll all be fine. 

ai is going to need well educated people to check its work. if can drive productivity increases and already is for some."
5360,andrew yang tried to bring this to the campaign trail
5364,"idiot dems, ai can't vote.
a efing i is another reason that trump kind will take mosr of the vote.
republicans are already lining up against ai, that means votes."
5365,"janitor? wow.
try: environmental sanitation technician."
5366,ai can't replace us. who's going to buy the products?
5369,reason why ubi is so important because robots have been replacing jobs for years but now it's like all jobs and next week.
5375,i'm so happy i studied psychology in college cause that's one place ai will almost never be able to takeover.
5376,can we please have more videos like these? this definitly shows what the ai companies have in store for us. nothing but replacing us...
5379,"super weird, my siri answered john stewart."
5383,i kind of appreciate and respect the one guy being honest about ai
5387,"ai, will enable corporations to eliminate jobs,  & eliminate the middle class. there will only be the poor, and the super rich. a dystopian future."
5389,tech bros are why ai needs to be heavily regulated.
5391,"someone working for the electric company in area where these tech nerds work, please pull the electric cord to their building. 
i want to see how profound ai is to them with power & a/c running. "
5392,i would actually love to be jarvis. he got to marry elizabeth olsen.
5393,given that electricity is necessary for ai to function...
5394,"jon stewart is intelligent, funny & a great humanitarium. making his life as a commodity. 9/11 responders comes to mind. he fought so hard for their rts & dignity"
5395,lol he got most of the ai stuff wrong thats what we were working on 6 months ago its already to late
5397,"let's teach ai the most important thing that uncle ben taught to peter parker: ""with great power comes great responsibility.""
(actually, there are a lot of people who could use that lesson in this election year...)"
5398,"we have a labor shortage in the usa, so ai would actually be a huge problem solver in america. you could get cheaper products more reliably and open people to do other things."
5401,ubi will no longer be an option as ai takes over more and more jobs.
5403,brilliant segment!!! 
5404,if only we could replace ceos with ai
5405,"the tech industry has already laid off 500,000 highly trained and experienced workers in the last two years. these ai mfs are the worst kind of hypocrites.."
5407,"so ai can pay us for stealing our jobs, right? "
5408,"maybe i desensitized, but i see that tailgate decal about once a week. yes, i'm in texas."
5411,"as a recently laid off producer of creative, i can confirm all of this. thanks, capitalism "
5412,but where's the training for those of us who are unemployed now?
5413,you know jon was waiting to do this to get back at apple
5414,"what's ai?
it's obvious.
it's computery stuff and all that.
and you can trust that...
i'm a doctor of explainerolgy."
5416,"*it's machine learning, not artificial intelligence.* machine learning is where the computer narrows down what the user wants by taking guesses until it gets it right. artificial intelligence doesn't exist yet - that would be when the computer decides what _it_ wants."
5419,we need to be finding jobs the ai weenies regard as impossible to assign to ai.  for example being a fireman.
5423,"ai is fine if we remove the corporate sector and monetary market system from the equation. if that sounds ridiculous, check out the concept of a resource based economy"
5427,"employee: i really don’t want to lose my job.
companies: oh, i guess you don’t want to cure disease and solve climate change. nice selfish attitude."
5429,"fire, electricity, ai...they all make toast"
5430,go jonny go go go!! nailed it again. master delivery as always
5436,the problem is not ai. the problem is the economic system it‘s being introduced to. because ai actually could make people’s life easier if the benefits of it wouldn’t go exclusively into the pockets of a chosen few.
5438,"my best friend is 85 & has been pointing out essentially the same scenario. basically, it's that workers are seen by the profit engineers as overhead, and that's their entire aim. more money for me by making more with less."
5442,so we all get a $400 ubi and let the robots work?
5444,"i want a.i. to change my sheets, make my bed and clean my bathroom... 
we already have robotic vacuum cleaners. "
5445,ai and all goods made overseas. didn't things use to be built here?the hemi is built in mexico? nothing against mexico that is american like apple pie baseball.craftman  tools aren't made here like they use to.who makes a tv here?it shouldn't be better for a companies making goods thousands of miles away.
5446,"mmmmmmmmmmmm, 
i love the taste of bbq done over a low, and slow ai fire."
5447,this is our greatest threat
5448,ai is art theft.
5450,i'm embracing the ai ...the problem is that the political establishment are not preparing for its outcome... its simply not discussed... and thursday isn't that far away ...
5451,did john use ai to come up with the value of the nyc condo he sold at over 800% of the market price?
5453,"except, oops, ai is now literally taking over art and music."
5454,i am 100% pro ai. just tax corporations correctly and use that money as a monthly stipend for ‘right to live’
5455,remember hal in space odyssey.  ai went insane.
5457,"estimate how many workers should be employed in a company based on its sector and revenue. tax said company for the same amount that they save by using ai instead of human workers. shovel those taxes into universal income, free education and health care. 
no it won't happen in the usa but somewhere, somewhen it'll make for a beautiful society."
5462,the ending!! that was the best!
